04:06:15.494429 IP 64-137-147-206.beanfield.net.64554 > lamp-s-1vcpu-1gb-tor1-01.ssh: Flags [.], ack 2670888, win 513, length 0
04:06:15.494433 IP 64-137-147-206.beanfield.net.64554 > lamp-s-1vcpu-1gb-tor1-01.ssh: Flags [.], ack 2671416, win 511, length 0
04:06:15.494436 IP 64-137-147-206.beanfield.net.64554 > lamp-s-1vcpu-1gb-tor1-01.ssh: Flags [.], ack 2671792, win 509, length 0
04:06:15.494567 IP lamp-s-1vcpu-1gb-tor1-01.ssh > 64-137-147-206.beanfield.net.64554: Flags [P.], seq 2677396:2678232, ack 1621, win 320, length 836
04:06:15.494647 IP lamp-s-1vcpu-1gb-tor1-01.ssh > 64-137-147-206.beanfield.net.64554: Flags [P.], seq 2678232:2678420, ack 1621, win 320, length 188
04:06:15.494724 IP lamp-s-1vcpu-1gb-tor1-01.ssh > 64-137-147-206.beanfield.net.64554: Flags [P.], seq 2678420:2678608, ack 1621, win 320, length 188
04:06:15.494798 IP lamp-s-1vcpu-1gb-tor1-01.ssh > 64-137-147-206.beanfield.net.64554: Flags [P.], seq 2678608:2678796, ack 1621, win 320, length 188
04:06:15.494874 IP lamp-s-1vcpu-1gb-tor1-01.ssh > 64-137-147-206.beanfield.net.64554: Flags [P.], seq 2678796:2678984, ack 1621, win 320, length 188
04:06:15.494947 IP lamp-s-1vcpu-1gb-tor1-01.ssh > 64-137-147-206.beanfield.net.64554: Flags [P.], seq 2678984:2679172, ack 1621, win 320, length 188
04:06:15.495024 IP lamp-s-1vcpu-1gb-tor1-01.ssh > 64-137-147-206.beanfield.net.64554: Flags [P.], seq 2679172:2679360, ack 1621, win 320, length 188
04:06:15.495096 IP lamp-s-1vcpu-1gb-tor1-01.ssh > 64-137-147-206.beanfield.net.64554: Flags [P.], seq 2679360:2679548, ack 1621, win 320, length 188
04:06:15.495172 IP lamp-s-1vcpu-1gb-tor1-01.ssh > 64-137-147-206.beanfield.net.64554: Flags [P.], seq 2679548:2679736, ack 1621, win 320, length 188
04:06:15.495245 IP lamp-s-1vcpu-1gb-tor1-01.ssh > 64-137-147-206.beanfield.net.64554: Flags [P.], seq 2679736:2679924, ack 1621, win 320, length 188
04:06:15.495321 IP lamp-s-1vcpu-1gb-tor1-01.ssh > 64-137-147-206.beanfield.net.64554: Flags [P.], seq 2679924:2680112, ack 1621, win 320, length 188
04:06:15.495403 IP lamp-s-1vcpu-1gb-tor1-01.ssh > 64-137-147-206.beanfield.net.64554: Flags [P.], seq 2680112:2680300, ack 1621, win 320, length 188
04:06:15.495498 IP lamp-s-1vcpu-1gb-tor1-01.ssh > 64-137-147-206.beanfield.net.64554: Flags [P.], seq 2680300:2680488, ack 1621, win 320, length 188
04:06:15.495573 IP lamp-s-1vcpu-1gb-tor1-01.ssh > 64-137-147-206.beanfield.net.64554: Flags [P.], seq 2680488:2680676, ack 1621, win 320, length 188
04:06:15.495649 IP lamp-s-1vcpu-1gb-tor1-01.ssh > 64-137-147-206.beanfield.net.64554: Flags [P.], seq 2680676:2680864, ack 1621, win 320, length 188
04:06:15.495723 IP lamp-s-1vcpu-1gb-tor1-01.ssh > 64-137-147-206.beanfield.net.64554: Flags [P.], seq 2680864:2681052, ack 1621, win 320, length 188
04:06:15.495798 IP lamp-s-1vcpu-1gb-tor1-01.ssh > 64-137-147-206.beanfield.net.64554: Flags [P.], seq 2681052:2681240, ack 1621, win 320, length 188
04:06:15.495871 IP lamp-s-1vcpu-1gb-tor1-01.ssh > 64-137-147-206.beanfield.net.64554: Flags [P.], seq 2681240:2681428, ack 1621, win 320, length 188
04:06:15.495959 IP lamp-s-1vcpu-1gb-tor1-01.ssh > 64-137-147-206.beanfield.net.64554: Flags [P.], seq 2681428:2681616, ack 1621, win 320, length 188
04:06:15.496063 IP lamp-s-1vcpu-1gb-tor1-01.ssh > 64-137-147-206.beanfield.net.64554: Flags [P.], seq 2681616:2681804, ack 1621, win 320, length 188
04:06:15.496143 IP lamp-s-1vcpu-1gb-tor1-01.ssh > 64-137-147-206.beanfield.net.64554: Flags [P.], seq 2681804:2681992, ack 1621, win 320, length 188
04:06:15.496176 IP 64-137-147-206.beanfield.net.64554 > lamp-s-1vcpu-1gb-tor1-01.ssh: Flags [.], ack 2672168, win 508, length 0
04:06:15.496189 IP 64-137-147-206.beanfield.net.64554 > lamp-s-1vcpu-1gb-tor1-01.ssh: Flags [.], ack 2672544, win 513, length 0
04:06:15.496193 IP 64-137-147-206.beanfield.net.64554 > lamp-s-1vcpu-1gb-tor1-01.ssh: Flags [.], ack 2672920, win 511, length 0
04:06:15.496197 IP 64-137-147-206.beanfield.net.64554 > lamp-s-1vcpu-1gb-tor1-01.ssh: Flags [.], ack 2673296, win 510, length 0
04:06:15.496200 IP 64-137-147-206.beanfield.net.64554 > lamp-s-1vcpu-1gb-tor1-01.ssh: Flags [.], ack 2674424, win 513, length 0
04:06:15.496204 IP 64-137-147-206.beanfield.net.64554 > lamp-s-1vcpu-1gb-tor1-01.ssh: Flags [.], ack 2674952, win 511, length 0
04:06:15.496343 IP lamp-s-1vcpu-1gb-tor1-01.ssh > 64-137-147-206.beanfield.net.64554: Flags [P.], seq 2681992:2682956, ack 1621, win 320, length 964
04:06:15.496439 IP lamp-s-1vcpu-1gb-tor1-01.ssh > 64-137-147-206.beanfield.net.64554: Flags [P.], seq 2682956:2683144, ack 1621, win 320, length 188
04:06:15.496521 IP lamp-s-1vcpu-1gb-tor1-01.ssh > 64-137-147-206.beanfield.net.64554: Flags [P.], seq 2683144:2683332, ack 1621, win 320, length 188
04:06:15.496593 IP lamp-s-1vcpu-1gb-tor1-01.ssh > 64-137-147-206.beanfield.net.64554: Flags [P.], seq 2683332:2683520, ack 1621, win 320, length 188
04:06:15.496669 IP lamp-s-1vcpu-1gb-tor1-01.ssh > 64-137-147-206.beanfield.net.64554: Flags [P.], seq 2683520:2683708, ack 1621, win 320, length 188
04:06:15.496740 IP lamp-s-1vcpu-1gb-tor1-01.ssh > 64-137-147-206.beanfield.net.64554: Flags [P.], seq 2683708:2683896, ack 1621, win 320, length 188
04:06:15.496815 IP lamp-s-1vcpu-1gb-tor1-01.ssh > 64-137-147-206.beanfield.net.64554: Flags [P.], seq 2683896:2684084, ack 1621, win 320, length 188
04:06:15.496894 IP lamp-s-1vcpu-1gb-tor1-01.ssh > 64-137-147-206.beanfield.net.64554: Flags [P.], seq 2684084:2684272, ack 1621, win 320, length 188
04:06:15.496968 IP lamp-s-1vcpu-1gb-tor1-01.ssh > 64-137-147-206.beanfield.net.64554: Flags [P.], seq 2684272:2684460, ack 1621, win 320, length 188
04:06:15.497047 IP lamp-s-1vcpu-1gb-tor1-01.ssh > 64-137-147-206.beanfield.net.64554: Flags [P.], seq 2684460:2684648, ack 1621, win 320, length 188
04:06:15.497133 IP lamp-s-1vcpu-1gb-tor1-01.ssh > 64-137-147-206.beanfield.net.64554: Flags [P.], seq 2684648:2684836, ack 1621, win 320, length 188
04:06:15.497204 IP lamp-s-1vcpu-1gb-tor1-01.ssh > 64-137-147-206.beanfield.net.64554: Flags [P.], seq 2684836:2685024, ack 1621, win 320, length 188
04:06:15.497275 IP lamp-s-1vcpu-1gb-tor1-01.ssh > 64-137-147-206.beanfield.net.64554: Flags [P.], seq 2685024:2685212, ack 1621, win 320, length 188
04:06:15.497345 IP lamp-s-1vcpu-1gb-tor1-01.ssh > 64-137-147-206.beanfield.net.64554: Flags [P.], seq 2685212:2685400, ack 1621, win 320, length 188
04:06:15.497472 IP lamp-s-1vcpu-1gb-tor1-01.ssh > 64-137-147-206.beanfield.net.64554: Flags [P.], seq 2685400:2685588, ack 1621, win 320, length 188
04:06:15.497562 IP lamp-s-1vcpu-1gb-tor1-01.ssh > 64-137-147-206.beanfield.net.64554: Flags [P.], seq 2685588:2685776, ack 1621, win 320, length 188
04:06:15.497640 IP lamp-s-1vcpu-1gb-tor1-01.ssh > 64-137-147-206.beanfield.net.64554: Flags [P.], seq 2685776:2685964, ack 1621, win 320, length 188
04:06:15.497766 IP lamp-s-1vcpu-1gb-tor1-01.ssh > 64-137-147-206.beanfield.net.64554: Flags [P.], seq 2685964:2686152, ack 1621, win 320, length 188
04:06:15.497865 IP lamp-s-1vcpu-1gb-tor1-01.ssh > 64-137-147-206.beanfield.net.64554: Flags [P.], seq 2686152:2686340, ack 1621, win 320, length 188
04:06:15.497955 IP lamp-s-1vcpu-1gb-tor1-01.ssh > 64-137-147-206.beanfield.net.64554: Flags [P.], seq 2686340:2686528, ack 1621, win 320, length 188
04:06:15.498064 IP lamp-s-1vcpu-1gb-tor1-01.ssh > 64-137-147-206.beanfield.net.64554: Flags [P.], seq 2686528:2686716, ack 1621, win 320, length 188
04:06:15.498146 IP lamp-s-1vcpu-1gb-tor1-01.ssh > 64-137-147-206.beanfield.net.64554: Flags [P.], seq 2686716:2686904, ack 1621, win 320, length 188
04:06:15.498221 IP lamp-s-1vcpu-1gb-tor1-01.ssh > 64-137-147-206.beanfield.net.64554: Flags [P.], seq 2686904:2687092, ack 1621, win 320, length 188
04:06:15.498265 IP 64-137-147-206.beanfield.net.64554 > lamp-s-1vcpu-1gb-tor1-01.ssh: Flags [.], ack 2675328, win 509, length 0
04:06:15.498279 IP 64-137-147-206.beanfield.net.64554 > lamp-s-1vcpu-1gb-tor1-01.ssh: Flags [.], ack 2675704, win 508, length 0
04:06:15.498284 IP 64-137-147-206.beanfield.net.64554 > lamp-s-1vcpu-1gb-tor1-01.ssh: Flags [.], ack 2676080, win 513, length 0
04:06:15.498288 IP 64-137-147-206.beanfield.net.64554 > lamp-s-1vcpu-1gb-tor1-01.ssh: Flags [.], ack 2676456, win 511, length 0
04:06:15.498292 IP 64-137-147-206.beanfield.net.64554 > lamp-s-1vcpu-1gb-tor1-01.ssh: Flags [.], ack 2676832, win 510, length 0
04:06:15.498296 IP 64-137-147-206.beanfield.net.64554 > lamp-s-1vcpu-1gb-tor1-01.ssh: Flags [.], ack 2677208, win 508, length 0
04:06:15.498515 IP lamp-s-1vcpu-1gb-tor1-01.ssh > 64-137-147-206.beanfield.net.64554: Flags [P.], seq 2687092:2688056, ack 1621, win 320, length 964
04:06:15.498608 IP lamp-s-1vcpu-1gb-tor1-01.ssh > 64-137-147-206.beanfield.net.64554: Flags [P.], seq 2688056:2688244, ack 1621, win 320, length 188
04:06:15.498721 IP lamp-s-1vcpu-1gb-tor1-01.ssh > 64-137-147-206.beanfield.net.64554: Flags [P.], seq 2688244:2688432, ack 1621, win 320, length 188
04:06:15.498818 IP lamp-s-1vcpu-1gb-tor1-01.ssh > 64-137-147-206.beanfield.net.64554: Flags [P.], seq 2688432:2688620, ack 1621, win 320, length 188
04:06:15.498923 IP lamp-s-1vcpu-1gb-tor1-01.ssh > 64-137-147-206.beanfield.net.64554: Flags [P.], seq 2688620:2688808, ack 1621, win 320, length 188
04:06:15.499003 IP lamp-s-1vcpu-1gb-tor1-01.ssh > 64-137-147-206.beanfield.net.64554: Flags [P.], seq 2688808:2688996, ack 1621, win 320, length 188
04:06:15.499076 IP lamp-s-1vcpu-1gb-tor1-01.ssh > 64-137-147-206.beanfield.net.64554: Flags [P.], seq 2688996:2689184, ack 1621, win 320, length 188
04:06:15.499149 IP lamp-s-1vcpu-1gb-tor1-01.ssh > 64-137-147-206.beanfield.net.64554: Flags [P.], seq 2689184:2689372, ack 1621, win 320, length 188
04:06:15.499222 IP lamp-s-1vcpu-1gb-tor1-01.ssh > 64-137-147-206.beanfield.net.64554: Flags [P.], seq 2689372:2689560, ack 1621, win 320, length 188
04:06:15.499294 IP lamp-s-1vcpu-1gb-tor1-01.ssh > 64-137-147-206.beanfield.net.64554: Flags [P.], seq 2689560:2689748, ack 1621, win 320, length 188
04:06:15.499365 IP lamp-s-1vcpu-1gb-tor1-01.ssh > 64-137-147-206.beanfield.net.64554: Flags [P.], seq 2689748:2689936, ack 1621, win 320, length 188
04:06:15.499459 IP lamp-s-1vcpu-1gb-tor1-01.ssh > 64-137-147-206.beanfield.net.64554: Flags [P.], seq 2689936:2690124, ack 1621, win 320, length 188
04:06:15.499572 IP lamp-s-1vcpu-1gb-tor1-01.ssh > 64-137-147-206.beanfield.net.64554: Flags [P.], seq 2690124:2690312, ack 1621, win 320, length 188
04:06:15.499622 IP 64-137-147-206.beanfield.net.64554 > lamp-s-1vcpu-1gb-tor1-01.ssh: Flags [.], ack 2681616, win 511, length 0
04:06:15.499636 IP 64-137-147-206.beanfield.net.64554 > lamp-s-1vcpu-1gb-tor1-01.ssh: Flags [.], ack 2681992, win 510, length 0
04:06:15.499642 IP 64-137-147-206.beanfield.net.64554 > lamp-s-1vcpu-1gb-tor1-01.ssh: Flags [.], ack 2683144, win 513, length 0
04:06:15.499648 IP 64-137-147-206.beanfield.net.64554 > lamp-s-1vcpu-1gb-tor1-01.ssh: Flags [.], ack 2683520, win 511, length 0
04:06:15.499654 IP 64-137-147-206.beanfield.net.64554 > lamp-s-1vcpu-1gb-tor1-01.ssh: Flags [.], ack 2683896, win 510, length 0
04:06:15.499661 IP 64-137-147-206.beanfield.net.64554 > lamp-s-1vcpu-1gb-tor1-01.ssh: Flags [.], ack 2684272, win 508, length 0
04:06:15.499875 IP lamp-s-1vcpu-1gb-tor1-01.ssh > 64-137-147-206.beanfield.net.64554: Flags [P.], seq 2690312:2691276, ack 1621, win 320, length 964
04:06:15.500007 IP lamp-s-1vcpu-1gb-tor1-01.ssh > 64-137-147-206.beanfield.net.64554: Flags [P.], seq 2691276:2691464, ack 1621, win 320, length 188
04:06:15.500146 IP lamp-s-1vcpu-1gb-tor1-01.ssh > 64-137-147-206.beanfield.net.64554: Flags [P.], seq 2691464:2691652, ack 1621, win 320, length 188
04:06:15.500260 IP lamp-s-1vcpu-1gb-tor1-01.ssh > 64-137-147-206.beanfield.net.64554: Flags [P.], seq 2691652:2691840, ack 1621, win 320, length 188
04:06:15.500365 IP lamp-s-1vcpu-1gb-tor1-01.ssh > 64-137-147-206.beanfield.net.64554: Flags [P.], seq 2691840:2692028, ack 1621, win 320, length 188
04:06:15.500476 IP lamp-s-1vcpu-1gb-tor1-01.ssh > 64-137-147-206.beanfield.net.64554: Flags [P.], seq 2692028:2692216, ack 1621, win 320, length 188
04:06:15.500573 IP lamp-s-1vcpu-1gb-tor1-01.ssh > 64-137-147-206.beanfield.net.64554: Flags [P.], seq 2692216:2692404, ack 1621, win 320, length 188
04:06:15.500670 IP lamp-s-1vcpu-1gb-tor1-01.ssh > 64-137-147-206.beanfield.net.64554: Flags [P.], seq 2692404:2692592, ack 1621, win 320, length 188
04:06:15.500778 IP lamp-s-1vcpu-1gb-tor1-01.ssh > 64-137-147-206.beanfield.net.64554: Flags [P.], seq 2692592:2692780, ack 1621, win 320, length 188
04:06:15.500922 IP lamp-s-1vcpu-1gb-tor1-01.ssh > 64-137-147-206.beanfield.net.64554: Flags [P.], seq 2692780:2692968, ack 1621, win 320, length 188
04:06:15.501013 IP lamp-s-1vcpu-1gb-tor1-01.ssh > 64-137-147-206.beanfield.net.64554: Flags [P.], seq 2692968:2693156, ack 1621, win 320, length 188
04:06:15.501089 IP lamp-s-1vcpu-1gb-tor1-01.ssh > 64-137-147-206.beanfield.net.64554: Flags [P.], seq 2693156:2693344, ack 1621, win 320, length 188
04:06:15.501162 IP lamp-s-1vcpu-1gb-tor1-01.ssh > 64-137-147-206.beanfield.net.64554: Flags [P.], seq 2693344:2693532, ack 1621, win 320, length 188
04:06:15.501234 IP lamp-s-1vcpu-1gb-tor1-01.ssh > 64-137-147-206.beanfield.net.64554: Flags [P.], seq 2693532:2693720, ack 1621, win 320, length 188
04:06:15.501306 IP lamp-s-1vcpu-1gb-tor1-01.ssh > 64-137-147-206.beanfield.net.64554: Flags [P.], seq 2693720:2693908, ack 1621, win 320, length 188
04:06:15.501378 IP lamp-s-1vcpu-1gb-tor1-01.ssh > 64-137-147-206.beanfield.net.64554: Flags [P.], seq 2693908:2694096, ack 1621, win 320, length 188
04:06:15.501451 IP lamp-s-1vcpu-1gb-tor1-01.ssh > 64-137-147-206.beanfield.net.64554: Flags [P.], seq 2694096:2694284, ack 1621, win 320, length 188
04:06:15.501514 IP 64-137-147-206.beanfield.net.64554 > lamp-s-1vcpu-1gb-tor1-01.ssh: Flags [.], ack 2686528, win 511, length 0
04:06:15.501529 IP 64-137-147-206.beanfield.net.64554 > lamp-s-1vcpu-1gb-tor1-01.ssh: Flags [.], ack 2686904, win 510, length 0
04:06:15.501535 IP 64-137-147-206.beanfield.net.64554 > lamp-s-1vcpu-1gb-tor1-01.ssh: Flags [.], ack 2688056, win 513, length 0
04:06:15.501539 IP 64-137-147-206.beanfield.net.64554 > lamp-s-1vcpu-1gb-tor1-01.ssh: Flags [.], ack 2688432, win 511, length 0
04:06:15.501644 IP lamp-s-1vcpu-1gb-tor1-01.ssh > 64-137-147-206.beanfield.net.64554: Flags [P.], seq 2694284:2694984, ack 1621, win 320, length 700
04:06:15.501728 IP lamp-s-1vcpu-1gb-tor1-01.ssh > 64-137-147-206.beanfield.net.64554: Flags [P.], seq 2694984:2695172, ack 1621, win 320, length 188
04:06:15.501848 IP lamp-s-1vcpu-1gb-tor1-01.ssh > 64-137-147-206.beanfield.net.64554: Flags [P.], seq 2695172:2695360, ack 1621, win 320, length 188
04:06:15.501966 IP lamp-s-1vcpu-1gb-tor1-01.ssh > 64-137-147-206.beanfield.net.64554: Flags [P.], seq 2695360:2695548, ack 1621, win 320, length 188
04:06:15.502046 IP lamp-s-1vcpu-1gb-tor1-01.ssh > 64-137-147-206.beanfield.net.64554: Flags [P.], seq 2695548:2695736, ack 1621, win 320, length 188
04:06:15.502119 IP lamp-s-1vcpu-1gb-tor1-01.ssh > 64-137-147-206.beanfield.net.64554: Flags [P.], seq 2695736:2695924, ack 1621, win 320, length 188
04:06:15.502192 IP lamp-s-1vcpu-1gb-tor1-01.ssh > 64-137-147-206.beanfield.net.64554: Flags [P.], seq 2695924:2696112, ack 1621, win 320, length 188
04:06:15.502265 IP lamp-s-1vcpu-1gb-tor1-01.ssh > 64-137-147-206.beanfield.net.64554: Flags [P.], seq 2696112:2696300, ack 1621, win 320, length 188
04:06:15.502341 IP lamp-s-1vcpu-1gb-tor1-01.ssh > 64-137-147-206.beanfield.net.64554: Flags [P.], seq 2696300:2696488, ack 1621, win 320, length 188
04:06:15.502415 IP lamp-s-1vcpu-1gb-tor1-01.ssh > 64-137-147-206.beanfield.net.64554: Flags [P.], seq 2696488:2696676, ack 1621, win 320, length 188
04:06:15.502487 IP lamp-s-1vcpu-1gb-tor1-01.ssh > 64-137-147-206.beanfield.net.64554: Flags [P.], seq 2696676:2696864, ack 1621, win 320, length 188
04:06:15.502559 IP lamp-s-1vcpu-1gb-tor1-01.ssh > 64-137-147-206.beanfield.net.64554: Flags [P.], seq 2696864:2697052, ack 1621, win 320, length 188
04:06:15.502631 IP lamp-s-1vcpu-1gb-tor1-01.ssh > 64-137-147-206.beanfield.net.64554: Flags [P.], seq 2697052:2697240, ack 1621, win 320, length 188
04:06:15.502705 IP lamp-s-1vcpu-1gb-tor1-01.ssh > 64-137-147-206.beanfield.net.64554: Flags [P.], seq 2697240:2697428, ack 1621, win 320, length 188
04:06:15.502778 IP lamp-s-1vcpu-1gb-tor1-01.ssh > 64-137-147-206.beanfield.net.64554: Flags [P.], seq 2697428:2697616, ack 1621, win 320, length 188
04:06:15.502883 IP 64-137-147-206.beanfield.net.64554 > lamp-s-1vcpu-1gb-tor1-01.ssh: Flags [.], ack 2688808, win 510, length 0
04:06:15.502903 IP 64-137-147-206.beanfield.net.64554 > lamp-s-1vcpu-1gb-tor1-01.ssh: Flags [.], ack 2689184, win 508, length 0
04:06:15.502910 IP 64-137-147-206.beanfield.net.64554 > lamp-s-1vcpu-1gb-tor1-01.ssh: Flags [.], ack 2689560, win 513, length 0
04:06:15.502916 IP 64-137-147-206.beanfield.net.64554 > lamp-s-1vcpu-1gb-tor1-01.ssh: Flags [.], ack 2689936, win 511, length 0
04:06:15.502922 IP 64-137-147-206.beanfield.net.64554 > lamp-s-1vcpu-1gb-tor1-01.ssh: Flags [.], ack 2690312, win 510, length 0
04:06:15.502928 IP 64-137-147-206.beanfield.net.64554 > lamp-s-1vcpu-1gb-tor1-01.ssh: Flags [.], ack 2691464, win 513, length 0
04:06:15.502933 IP 64-137-147-206.beanfield.net.64554 > lamp-s-1vcpu-1gb-tor1-01.ssh: Flags [.], ack 2691840, win 511, length 0
04:06:15.503149 IP lamp-s-1vcpu-1gb-tor1-01.ssh > 64-137-147-206.beanfield.net.64554: Flags [P.], seq 2697616:2698708, ack 1621, win 320, length 1092
04:06:15.503243 IP lamp-s-1vcpu-1gb-tor1-01.ssh > 64-137-147-206.beanfield.net.64554: Flags [P.], seq 2698708:2698896, ack 1621, win 320, length 188
04:06:15.503321 IP lamp-s-1vcpu-1gb-tor1-01.ssh > 64-137-147-206.beanfield.net.64554: Flags [P.], seq 2698896:2699084, ack 1621, win 320, length 188
04:06:15.503396 IP lamp-s-1vcpu-1gb-tor1-01.ssh > 64-137-147-206.beanfield.net.64554: Flags [P.], seq 2699084:2699272, ack 1621, win 320, length 188
04:06:15.503471 IP lamp-s-1vcpu-1gb-tor1-01.ssh > 64-137-147-206.beanfield.net.64554: Flags [P.], seq 2699272:2699460, ack 1621, win 320, length 188
04:06:15.503585 IP lamp-s-1vcpu-1gb-tor1-01.ssh > 64-137-147-206.beanfield.net.64554: Flags [P.], seq 2699460:2699648, ack 1621, win 320, length 188
04:06:15.503682 IP lamp-s-1vcpu-1gb-tor1-01.ssh > 64-137-147-206.beanfield.net.64554: Flags [P.], seq 2699648:2699836, ack 1621, win 320, length 188
04:06:15.503759 IP lamp-s-1vcpu-1gb-tor1-01.ssh > 64-137-147-206.beanfield.net.64554: Flags [P.], seq 2699836:2700024, ack 1621, win 320, length 188
04:06:15.503832 IP lamp-s-1vcpu-1gb-tor1-01.ssh > 64-137-147-206.beanfield.net.64554: Flags [P.], seq 2700024:2700212, ack 1621, win 320, length 188
04:06:15.503929 IP lamp-s-1vcpu-1gb-tor1-01.ssh > 64-137-147-206.beanfield.net.64554: Flags [P.], seq 2700212:2700400, ack 1621, win 320, length 188
04:06:15.504049 IP lamp-s-1vcpu-1gb-tor1-01.ssh > 64-137-147-206.beanfield.net.64554: Flags [P.], seq 2700400:2700588, ack 1621, win 320, length 188
04:06:15.504190 IP lamp-s-1vcpu-1gb-tor1-01.ssh > 64-137-147-206.beanfield.net.64554: Flags [P.], seq 2700588:2700776, ack 1621, win 320, length 188
04:06:15.504322 IP lamp-s-1vcpu-1gb-tor1-01.ssh > 64-137-147-206.beanfield.net.64554: Flags [P.], seq 2700776:2700964, ack 1621, win 320, length 188
04:06:15.504444 IP lamp-s-1vcpu-1gb-tor1-01.ssh > 64-137-147-206.beanfield.net.64554: Flags [P.], seq 2700964:2701152, ack 1621, win 320, length 188
04:06:15.504536 IP lamp-s-1vcpu-1gb-tor1-01.ssh > 64-137-147-206.beanfield.net.64554: Flags [P.], seq 2701152:2701340, ack 1621, win 320, length 188
04:06:15.504611 IP lamp-s-1vcpu-1gb-tor1-01.ssh > 64-137-147-206.beanfield.net.64554: Flags [P.], seq 2701340:2701528, ack 1621, win 320, length 188
04:06:15.504683 IP lamp-s-1vcpu-1gb-tor1-01.ssh > 64-137-147-206.beanfield.net.64554: Flags [P.], seq 2701528:2701716, ack 1621, win 320, length 188
04:06:15.504758 IP lamp-s-1vcpu-1gb-tor1-01.ssh > 64-137-147-206.beanfield.net.64554: Flags [P.], seq 2701716:2701904, ack 1621, win 320, length 188
04:06:15.504830 IP lamp-s-1vcpu-1gb-tor1-01.ssh > 64-137-147-206.beanfield.net.64554: Flags [P.], seq 2701904:2702092, ack 1621, win 320, length 188
04:06:15.504901 IP lamp-s-1vcpu-1gb-tor1-01.ssh > 64-137-147-206.beanfield.net.64554: Flags [P.], seq 2702092:2702280, ack 1621, win 320, length 188
04:06:15.504976 IP lamp-s-1vcpu-1gb-tor1-01.ssh > 64-137-147-206.beanfield.net.64554: Flags [P.], seq 2702280:2702468, ack 1621, win 320, length 188
04:06:15.505049 IP lamp-s-1vcpu-1gb-tor1-01.ssh > 64-137-147-206.beanfield.net.64554: Flags [P.], seq 2702468:2702656, ack 1621, win 320, length 188
04:06:15.505108 IP 64-137-147-206.beanfield.net.64554 > lamp-s-1vcpu-1gb-tor1-01.ssh: Flags [.], ack 2693720, win 510, length 0
04:06:15.505121 IP 64-137-147-206.beanfield.net.64554 > lamp-s-1vcpu-1gb-tor1-01.ssh: Flags [.], ack 2694096, win 508, length 0
04:06:15.505126 IP 64-137-147-206.beanfield.net.64554 > lamp-s-1vcpu-1gb-tor1-01.ssh: Flags [.], ack 2694984, win 513, length 0
04:06:15.505130 IP 64-137-147-206.beanfield.net.64554 > lamp-s-1vcpu-1gb-tor1-01.ssh: Flags [.], ack 2695360, win 511, length 0
04:06:15.505134 IP 64-137-147-206.beanfield.net.64554 > lamp-s-1vcpu-1gb-tor1-01.ssh: Flags [.], ack 2695736, win 510, length 0
04:06:15.505138 IP 64-137-147-206.beanfield.net.64554 > lamp-s-1vcpu-1gb-tor1-01.ssh: Flags [.], ack 2696112, win 508, length 0
04:06:15.505142 IP 64-137-147-206.beanfield.net.64554 > lamp-s-1vcpu-1gb-tor1-01.ssh: Flags [.], ack 2696488, win 513, length 0
04:06:15.505284 IP lamp-s-1vcpu-1gb-tor1-01.ssh > 64-137-147-206.beanfield.net.64554: Flags [P.], seq 2702656:2703748, ack 1621, win 320, length 1092
04:06:15.505368 IP lamp-s-1vcpu-1gb-tor1-01.ssh > 64-137-147-206.beanfield.net.64554: Flags [P.], seq 2703748:2703936, ack 1621, win 320, length 188
04:06:15.505443 IP lamp-s-1vcpu-1gb-tor1-01.ssh > 64-137-147-206.beanfield.net.64554: Flags [P.], seq 2703936:2704124, ack 1621, win 320, length 188
04:06:15.505516 IP lamp-s-1vcpu-1gb-tor1-01.ssh > 64-137-147-206.beanfield.net.64554: Flags [P.], seq 2704124:2704312, ack 1621, win 320, length 188
04:06:15.505588 IP lamp-s-1vcpu-1gb-tor1-01.ssh > 64-137-147-206.beanfield.net.64554: Flags [P.], seq 2704312:2704500, ack 1621, win 320, length 188
04:06:15.505659 IP lamp-s-1vcpu-1gb-tor1-01.ssh > 64-137-147-206.beanfield.net.64554: Flags [P.], seq 2704500:2704688, ack 1621, win 320, length 188
04:06:15.505731 IP lamp-s-1vcpu-1gb-tor1-01.ssh > 64-137-147-206.beanfield.net.64554: Flags [P.], seq 2704688:2704876, ack 1621, win 320, length 188
04:06:15.505823 IP lamp-s-1vcpu-1gb-tor1-01.ssh > 64-137-147-206.beanfield.net.64554: Flags [P.], seq 2704876:2705064, ack 1621, win 320, length 188
04:06:15.505903 IP lamp-s-1vcpu-1gb-tor1-01.ssh > 64-137-147-206.beanfield.net.64554: Flags [P.], seq 2705064:2705252, ack 1621, win 320, length 188
04:06:15.505978 IP lamp-s-1vcpu-1gb-tor1-01.ssh > 64-137-147-206.beanfield.net.64554: Flags [P.], seq 2705252:2705440, ack 1621, win 320, length 188
04:06:15.506053 IP lamp-s-1vcpu-1gb-tor1-01.ssh > 64-137-147-206.beanfield.net.64554: Flags [P.], seq 2705440:2705628, ack 1621, win 320, length 188
04:06:15.506127 IP lamp-s-1vcpu-1gb-tor1-01.ssh > 64-137-147-206.beanfield.net.64554: Flags [P.], seq 2705628:2705816, ack 1621, win 320, length 188
04:06:15.506205 IP lamp-s-1vcpu-1gb-tor1-01.ssh > 64-137-147-206.beanfield.net.64554: Flags [P.], seq 2705816:2706004, ack 1621, win 320, length 188
04:06:15.506278 IP lamp-s-1vcpu-1gb-tor1-01.ssh > 64-137-147-206.beanfield.net.64554: Flags [P.], seq 2706004:2706192, ack 1621, win 320, length 188
04:06:15.506354 IP lamp-s-1vcpu-1gb-tor1-01.ssh > 64-137-147-206.beanfield.net.64554: Flags [P.], seq 2706192:2706380, ack 1621, win 320, length 188
04:06:15.506428 IP lamp-s-1vcpu-1gb-tor1-01.ssh > 64-137-147-206.beanfield.net.64554: Flags [P.], seq 2706380:2706568, ack 1621, win 320, length 188
04:06:15.506504 IP lamp-s-1vcpu-1gb-tor1-01.ssh > 64-137-147-206.beanfield.net.64554: Flags [P.], seq 2706568:2706756, ack 1621, win 320, length 188
04:06:15.506582 IP lamp-s-1vcpu-1gb-tor1-01.ssh > 64-137-147-206.beanfield.net.64554: Flags [P.], seq 2706756:2706944, ack 1621, win 320, length 188
04:06:15.506660 IP lamp-s-1vcpu-1gb-tor1-01.ssh > 64-137-147-206.beanfield.net.64554: Flags [P.], seq 2706944:2707132, ack 1621, win 320, length 188
04:06:15.506733 IP lamp-s-1vcpu-1gb-tor1-01.ssh > 64-137-147-206.beanfield.net.64554: Flags [P.], seq 2707132:2707320, ack 1621, win 320, length 188
04:06:15.506809 IP lamp-s-1vcpu-1gb-tor1-01.ssh > 64-137-147-206.beanfield.net.64554: Flags [P.], seq 2707320:2707508, ack 1621, win 320, length 188
04:06:15.506893 IP lamp-s-1vcpu-1gb-tor1-01.ssh > 64-137-147-206.beanfield.net.64554: Flags [P.], seq 2707508:2707696, ack 1621, win 320, length 188
04:06:15.507017 IP lamp-s-1vcpu-1gb-tor1-01.ssh > 64-137-147-206.beanfield.net.64554: Flags [P.], seq 2707696:2707884, ack 1621, win 320, length 188
04:06:15.507086 IP lamp-s-1vcpu-1gb-tor1-01.ssh > 64-137-147-206.beanfield.net.64554: Flags [P.], seq 2707884:2708072, ack 1621, win 320, length 188
04:06:15.507110 IP 64-137-147-206.beanfield.net.64554 > lamp-s-1vcpu-1gb-tor1-01.ssh: Flags [.], ack 2697240, win 510, length 0
04:06:15.507117 IP 64-137-147-206.beanfield.net.64554 > lamp-s-1vcpu-1gb-tor1-01.ssh: Flags [.], ack 2697616, win 508, length 0
04:06:15.507120 IP 64-137-147-206.beanfield.net.64554 > lamp-s-1vcpu-1gb-tor1-01.ssh: Flags [.], ack 2698896, win 513, length 0
04:06:15.507123 IP 64-137-147-206.beanfield.net.64554 > lamp-s-1vcpu-1gb-tor1-01.ssh: Flags [.], ack 2699272, win 511, length 0
04:06:15.507126 IP 64-137-147-206.beanfield.net.64554 > lamp-s-1vcpu-1gb-tor1-01.ssh: Flags [.], ack 2699648, win 510, length 0
04:06:15.507129 IP 64-137-147-206.beanfield.net.64554 > lamp-s-1vcpu-1gb-tor1-01.ssh: Flags [.], ack 2700024, win 508, length 0
04:06:15.507309 IP lamp-s-1vcpu-1gb-tor1-01.ssh > 64-137-147-206.beanfield.net.64554: Flags [P.], seq 2708072:2709036, ack 1621, win 320, length 964
04:06:15.507393 IP lamp-s-1vcpu-1gb-tor1-01.ssh > 64-137-147-206.beanfield.net.64554: Flags [P.], seq 2709036:2709224, ack 1621, win 320, length 188
04:06:15.507468 IP lamp-s-1vcpu-1gb-tor1-01.ssh > 64-137-147-206.beanfield.net.64554: Flags [P.], seq 2709224:2709412, ack 1621, win 320, length 188
04:06:15.507544 IP lamp-s-1vcpu-1gb-tor1-01.ssh > 64-137-147-206.beanfield.net.64554: Flags [P.], seq 2709412:2709600, ack 1621, win 320, length 188
04:06:15.507618 IP lamp-s-1vcpu-1gb-tor1-01.ssh > 64-137-147-206.beanfield.net.64554: Flags [P.], seq 2709600:2709788, ack 1621, win 320, length 188
04:06:15.507695 IP lamp-s-1vcpu-1gb-tor1-01.ssh > 64-137-147-206.beanfield.net.64554: Flags [P.], seq 2709788:2709976, ack 1621, win 320, length 188
04:06:15.507768 IP lamp-s-1vcpu-1gb-tor1-01.ssh > 64-137-147-206.beanfield.net.64554: Flags [P.], seq 2709976:2710164, ack 1621, win 320, length 188
04:06:15.507845 IP lamp-s-1vcpu-1gb-tor1-01.ssh > 64-137-147-206.beanfield.net.64554: Flags [P.], seq 2710164:2710352, ack 1621, win 320, length 188
04:06:15.507947 IP lamp-s-1vcpu-1gb-tor1-01.ssh > 64-137-147-206.beanfield.net.64554: Flags [P.], seq 2710352:2710540, ack 1621, win 320, length 188
04:06:15.508071 IP lamp-s-1vcpu-1gb-tor1-01.ssh > 64-137-147-206.beanfield.net.64554: Flags [P.], seq 2710540:2710728, ack 1621, win 320, length 188
04:06:15.508151 IP lamp-s-1vcpu-1gb-tor1-01.ssh > 64-137-147-206.beanfield.net.64554: Flags [P.], seq 2710728:2710916, ack 1621, win 320, length 188
04:06:15.508230 IP lamp-s-1vcpu-1gb-tor1-01.ssh > 64-137-147-206.beanfield.net.64554: Flags [P.], seq 2710916:2711104, ack 1621, win 320, length 188
04:06:15.508313 IP lamp-s-1vcpu-1gb-tor1-01.ssh > 64-137-147-206.beanfield.net.64554: Flags [P.], seq 2711104:2711292, ack 1621, win 320, length 188
04:06:15.508421 IP lamp-s-1vcpu-1gb-tor1-01.ssh > 64-137-147-206.beanfield.net.64554: Flags [P.], seq 2711292:2711480, ack 1621, win 320, length 188
04:06:15.508504 IP lamp-s-1vcpu-1gb-tor1-01.ssh > 64-137-147-206.beanfield.net.64554: Flags [P.], seq 2711480:2711668, ack 1621, win 320, length 188
04:06:15.508583 IP lamp-s-1vcpu-1gb-tor1-01.ssh > 64-137-147-206.beanfield.net.64554: Flags [P.], seq 2711668:2711856, ack 1621, win 320, length 188
04:06:15.508658 IP lamp-s-1vcpu-1gb-tor1-01.ssh > 64-137-147-206.beanfield.net.64554: Flags [P.], seq 2711856:2712044, ack 1621, win 320, length 188
04:06:15.508735 IP lamp-s-1vcpu-1gb-tor1-01.ssh > 64-137-147-206.beanfield.net.64554: Flags [P.], seq 2712044:2712232, ack 1621, win 320, length 188
04:06:15.508810 IP lamp-s-1vcpu-1gb-tor1-01.ssh > 64-137-147-206.beanfield.net.64554: Flags [P.], seq 2712232:2712420, ack 1621, win 320, length 188
04:06:15.508860 IP 64-137-147-206.beanfield.net.64554 > lamp-s-1vcpu-1gb-tor1-01.ssh: Flags [.], ack 2702280, win 511, length 0
04:06:15.508873 IP 64-137-147-206.beanfield.net.64554 > lamp-s-1vcpu-1gb-tor1-01.ssh: Flags [.], ack 2702656, win 510, length 0
04:06:15.508877 IP 64-137-147-206.beanfield.net.64554 > lamp-s-1vcpu-1gb-tor1-01.ssh: Flags [.], ack 2703936, win 513, length 0
04:06:15.508881 IP 64-137-147-206.beanfield.net.64554 > lamp-s-1vcpu-1gb-tor1-01.ssh: Flags [.], ack 2704312, win 511, length 0
04:06:15.508886 IP 64-137-147-206.beanfield.net.64554 > lamp-s-1vcpu-1gb-tor1-01.ssh: Flags [.], ack 2704688, win 510, length 0
04:06:15.508889 IP 64-137-147-206.beanfield.net.64554 > lamp-s-1vcpu-1gb-tor1-01.ssh: Flags [.], ack 2705064, win 508, length 0
04:06:15.509016 IP lamp-s-1vcpu-1gb-tor1-01.ssh > 64-137-147-206.beanfield.net.64554: Flags [P.], seq 2712420:2713384, ack 1621, win 320, length 964
04:06:15.509098 IP lamp-s-1vcpu-1gb-tor1-01.ssh > 64-137-147-206.beanfield.net.64554: Flags [P.], seq 2713384:2713572, ack 1621, win 320, length 188
04:06:15.509176 IP lamp-s-1vcpu-1gb-tor1-01.ssh > 64-137-147-206.beanfield.net.64554: Flags [P.], seq 2713572:2713760, ack 1621, win 320, length 188
04:06:15.509251 IP lamp-s-1vcpu-1gb-tor1-01.ssh > 64-137-147-206.beanfield.net.64554: Flags [P.], seq 2713760:2713948, ack 1621, win 320, length 188
04:06:15.509331 IP lamp-s-1vcpu-1gb-tor1-01.ssh > 64-137-147-206.beanfield.net.64554: Flags [P.], seq 2713948:2714136, ack 1621, win 320, length 188
04:06:15.509420 IP lamp-s-1vcpu-1gb-tor1-01.ssh > 64-137-147-206.beanfield.net.64554: Flags [P.], seq 2714136:2714324, ack 1621, win 320, length 188
04:06:15.509508 IP lamp-s-1vcpu-1gb-tor1-01.ssh > 64-137-147-206.beanfield.net.64554: Flags [P.], seq 2714324:2714512, ack 1621, win 320, length 188
04:06:15.509583 IP lamp-s-1vcpu-1gb-tor1-01.ssh > 64-137-147-206.beanfield.net.64554: Flags [P.], seq 2714512:2714700, ack 1621, win 320, length 188
04:06:15.509661 IP lamp-s-1vcpu-1gb-tor1-01.ssh > 64-137-147-206.beanfield.net.64554: Flags [P.], seq 2714700:2714888, ack 1621, win 320, length 188
04:06:15.509735 IP lamp-s-1vcpu-1gb-tor1-01.ssh > 64-137-147-206.beanfield.net.64554: Flags [P.], seq 2714888:2715076, ack 1621, win 320, length 188
04:06:15.509827 IP lamp-s-1vcpu-1gb-tor1-01.ssh > 64-137-147-206.beanfield.net.64554: Flags [P.], seq 2715076:2715264, ack 1621, win 320, length 188
04:06:15.509920 IP lamp-s-1vcpu-1gb-tor1-01.ssh > 64-137-147-206.beanfield.net.64554: Flags [P.], seq 2715264:2715452, ack 1621, win 320, length 188
04:06:15.510037 IP lamp-s-1vcpu-1gb-tor1-01.ssh > 64-137-147-206.beanfield.net.64554: Flags [P.], seq 2715452:2715640, ack 1621, win 320, length 188
04:06:15.510120 IP lamp-s-1vcpu-1gb-tor1-01.ssh > 64-137-147-206.beanfield.net.64554: Flags [P.], seq 2715640:2715828, ack 1621, win 320, length 188
04:06:15.510239 IP lamp-s-1vcpu-1gb-tor1-01.ssh > 64-137-147-206.beanfield.net.64554: Flags [P.], seq 2715828:2716016, ack 1621, win 320, length 188
04:06:15.510329 IP 64-137-147-206.beanfield.net.64554 > lamp-s-1vcpu-1gb-tor1-01.ssh: Flags [.], ack 2705440, win 513, length 0
04:06:15.510348 IP 64-137-147-206.beanfield.net.64554 > lamp-s-1vcpu-1gb-tor1-01.ssh: Flags [.], ack 2705816, win 511, length 0
04:06:15.510355 IP 64-137-147-206.beanfield.net.64554 > lamp-s-1vcpu-1gb-tor1-01.ssh: Flags [.], ack 2706192, win 510, length 0
04:06:15.510362 IP 64-137-147-206.beanfield.net.64554 > lamp-s-1vcpu-1gb-tor1-01.ssh: Flags [.], ack 2706568, win 508, length 0
04:06:15.510368 IP 64-137-147-206.beanfield.net.64554 > lamp-s-1vcpu-1gb-tor1-01.ssh: Flags [.], ack 2706944, win 513, length 0
04:06:15.510374 IP 64-137-147-206.beanfield.net.64554 > lamp-s-1vcpu-1gb-tor1-01.ssh: Flags [.], ack 2707320, win 511, length 0
04:06:15.510629 IP lamp-s-1vcpu-1gb-tor1-01.ssh > 64-137-147-206.beanfield.net.64554: Flags [P.], seq 2716016:2716980, ack 1657, win 320, length 964
04:06:15.510719 IP lamp-s-1vcpu-1gb-tor1-01.ssh > 64-137-147-206.beanfield.net.64554: Flags [P.], seq 2716980:2717168, ack 1657, win 320, length 188
04:06:15.510796 IP lamp-s-1vcpu-1gb-tor1-01.ssh > 64-137-147-206.beanfield.net.64554: Flags [P.], seq 2717168:2717356, ack 1657, win 320, length 188
04:06:15.510871 IP lamp-s-1vcpu-1gb-tor1-01.ssh > 64-137-147-206.beanfield.net.64554: Flags [P.], seq 2717356:2717544, ack 1657, win 320, length 188
04:06:15.510953 IP lamp-s-1vcpu-1gb-tor1-01.ssh > 64-137-147-206.beanfield.net.64554: Flags [P.], seq 2717544:2717732, ack 1657, win 320, length 188
04:06:15.511017 IP lamp-s-1vcpu-1gb-tor1-01.ssh > 64-137-147-206.beanfield.net.64554: Flags [P.], seq 2717732:2717920, ack 1657, win 320, length 188
04:06:15.511091 IP lamp-s-1vcpu-1gb-tor1-01.ssh > 64-137-147-206.beanfield.net.64554: Flags [P.], seq 2717920:2718108, ack 1657, win 320, length 188
04:06:15.511196 IP lamp-s-1vcpu-1gb-tor1-01.ssh > 64-137-147-206.beanfield.net.64554: Flags [P.], seq 2718108:2718296, ack 1657, win 320, length 188
04:06:15.511282 IP lamp-s-1vcpu-1gb-tor1-01.ssh > 64-137-147-206.beanfield.net.64554: Flags [P.], seq 2718296:2718484, ack 1657, win 320, length 188
04:06:15.511366 IP lamp-s-1vcpu-1gb-tor1-01.ssh > 64-137-147-206.beanfield.net.64554: Flags [P.], seq 2718484:2718672, ack 1657, win 320, length 188
04:06:15.511441 IP lamp-s-1vcpu-1gb-tor1-01.ssh > 64-137-147-206.beanfield.net.64554: Flags [P.], seq 2718672:2718860, ack 1657, win 320, length 188
04:06:15.511519 IP lamp-s-1vcpu-1gb-tor1-01.ssh > 64-137-147-206.beanfield.net.64554: Flags [P.], seq 2718860:2719048, ack 1657, win 320, length 188
04:06:15.511593 IP lamp-s-1vcpu-1gb-tor1-01.ssh > 64-137-147-206.beanfield.net.64554: Flags [P.], seq 2719048:2719236, ack 1657, win 320, length 188
04:06:15.511670 IP lamp-s-1vcpu-1gb-tor1-01.ssh > 64-137-147-206.beanfield.net.64554: Flags [P.], seq 2719236:2719424, ack 1657, win 320, length 188
04:06:15.511744 IP lamp-s-1vcpu-1gb-tor1-01.ssh > 64-137-147-206.beanfield.net.64554: Flags [P.], seq 2719424:2719612, ack 1657, win 320, length 188
04:06:15.511827 IP lamp-s-1vcpu-1gb-tor1-01.ssh > 64-137-147-206.beanfield.net.64554: Flags [P.], seq 2719612:2719800, ack 1657, win 320, length 188
04:06:15.511904 IP lamp-s-1vcpu-1gb-tor1-01.ssh > 64-137-147-206.beanfield.net.64554: Flags [P.], seq 2719800:2719988, ack 1657, win 320, length 188
04:06:15.512009 IP lamp-s-1vcpu-1gb-tor1-01.ssh > 64-137-147-206.beanfield.net.64554: Flags [P.], seq 2719988:2720176, ack 1657, win 320, length 188
04:06:15.512168 IP lamp-s-1vcpu-1gb-tor1-01.ssh > 64-137-147-206.beanfield.net.64554: Flags [P.], seq 2720176:2720364, ack 1657, win 320, length 188
04:06:15.512301 IP lamp-s-1vcpu-1gb-tor1-01.ssh > 64-137-147-206.beanfield.net.64554: Flags [P.], seq 2720364:2720552, ack 1657, win 320, length 188
04:06:15.512331 IP 64-137-147-206.beanfield.net.64554 > lamp-s-1vcpu-1gb-tor1-01.ssh: Flags [.], ack 2712420, win 511, length 0
04:06:15.512339 IP 64-137-147-206.beanfield.net.64554 > lamp-s-1vcpu-1gb-tor1-01.ssh: Flags [.], ack 2713572, win 513, length 0
04:06:15.512342 IP 64-137-147-206.beanfield.net.64554 > lamp-s-1vcpu-1gb-tor1-01.ssh: Flags [.], ack 2713948, win 511, length 0
04:06:15.512479 IP lamp-s-1vcpu-1gb-tor1-01.ssh > 64-137-147-206.beanfield.net.64554: Flags [P.], seq 2720552:2721124, ack 1657, win 320, length 572
04:06:15.512630 IP lamp-s-1vcpu-1gb-tor1-01.ssh > 64-137-147-206.beanfield.net.64554: Flags [P.], seq 2721124:2721312, ack 1657, win 320, length 188
04:06:15.512766 IP lamp-s-1vcpu-1gb-tor1-01.ssh > 64-137-147-206.beanfield.net.64554: Flags [P.], seq 2721312:2721500, ack 1657, win 320, length 188
04:06:15.512897 IP lamp-s-1vcpu-1gb-tor1-01.ssh > 64-137-147-206.beanfield.net.64554: Flags [P.], seq 2721500:2721688, ack 1657, win 320, length 188
04:06:15.512992 IP lamp-s-1vcpu-1gb-tor1-01.ssh > 64-137-147-206.beanfield.net.64554: Flags [P.], seq 2721688:2721876, ack 1657, win 320, length 188
04:06:15.513073 IP lamp-s-1vcpu-1gb-tor1-01.ssh > 64-137-147-206.beanfield.net.64554: Flags [P.], seq 2721876:2722064, ack 1657, win 320, length 188
04:06:15.513149 IP lamp-s-1vcpu-1gb-tor1-01.ssh > 64-137-147-206.beanfield.net.64554: Flags [P.], seq 2722064:2722252, ack 1657, win 320, length 188
04:06:15.513227 IP lamp-s-1vcpu-1gb-tor1-01.ssh > 64-137-147-206.beanfield.net.64554: Flags [P.], seq 2722252:2722440, ack 1657, win 320, length 188
04:06:15.513306 IP lamp-s-1vcpu-1gb-tor1-01.ssh > 64-137-147-206.beanfield.net.64554: Flags [P.], seq 2722440:2722628, ack 1657, win 320, length 188
04:06:15.513390 IP lamp-s-1vcpu-1gb-tor1-01.ssh > 64-137-147-206.beanfield.net.64554: Flags [P.], seq 2722628:2722816, ack 1657, win 320, length 188
04:06:15.513466 IP lamp-s-1vcpu-1gb-tor1-01.ssh > 64-137-147-206.beanfield.net.64554: Flags [P.], seq 2722816:2723004, ack 1657, win 320, length 188
04:06:15.513543 IP lamp-s-1vcpu-1gb-tor1-01.ssh > 64-137-147-206.beanfield.net.64554: Flags [P.], seq 2723004:2723192, ack 1657, win 320, length 188
04:06:15.513619 IP lamp-s-1vcpu-1gb-tor1-01.ssh > 64-137-147-206.beanfield.net.64554: Flags [P.], seq 2723192:2723380, ack 1657, win 320, length 188
04:06:15.513697 IP lamp-s-1vcpu-1gb-tor1-01.ssh > 64-137-147-206.beanfield.net.64554: Flags [P.], seq 2723380:2723568, ack 1657, win 320, length 188
04:06:15.513820 IP lamp-s-1vcpu-1gb-tor1-01.ssh > 64-137-147-206.beanfield.net.64554: Flags [P.], seq 2723568:2723756, ack 1657, win 320, length 188
04:06:15.513961 IP lamp-s-1vcpu-1gb-tor1-01.ssh > 64-137-147-206.beanfield.net.64554: Flags [P.], seq 2723756:2723944, ack 1657, win 320, length 188
04:06:15.513992 IP 64-137-147-206.beanfield.net.64554 > lamp-s-1vcpu-1gb-tor1-01.ssh: Flags [.], ack 2714324, win 510, length 0
04:06:15.514004 IP 64-137-147-206.beanfield.net.64554 > lamp-s-1vcpu-1gb-tor1-01.ssh: Flags [.], ack 2714700, win 508, length 0
04:06:15.514009 IP 64-137-147-206.beanfield.net.64554 > lamp-s-1vcpu-1gb-tor1-01.ssh: Flags [.], ack 2715076, win 513, length 0
04:06:15.514013 IP 64-137-147-206.beanfield.net.64554 > lamp-s-1vcpu-1gb-tor1-01.ssh: Flags [.], ack 2715452, win 511, length 0
04:06:15.514017 IP 64-137-147-206.beanfield.net.64554 > lamp-s-1vcpu-1gb-tor1-01.ssh: Flags [.], ack 2715828, win 510, length 0
04:06:15.514021 IP 64-137-147-206.beanfield.net.64554 > lamp-s-1vcpu-1gb-tor1-01.ssh: Flags [.], ack 2716980, win 513, length 0
04:06:15.514315 IP lamp-s-1vcpu-1gb-tor1-01.ssh > 64-137-147-206.beanfield.net.64554: Flags [P.], seq 2723944:2724908, ack 1657, win 320, length 964
04:06:15.514464 IP lamp-s-1vcpu-1gb-tor1-01.ssh > 64-137-147-206.beanfield.net.64554: Flags [P.], seq 2724908:2725096, ack 1657, win 320, length 188
04:06:15.514594 IP lamp-s-1vcpu-1gb-tor1-01.ssh > 64-137-147-206.beanfield.net.64554: Flags [P.], seq 2725096:2725284, ack 1657, win 320, length 188
04:06:15.514715 IP lamp-s-1vcpu-1gb-tor1-01.ssh > 64-137-147-206.beanfield.net.64554: Flags [P.], seq 2725284:2725472, ack 1657, win 320, length 188
04:06:15.514797 IP lamp-s-1vcpu-1gb-tor1-01.ssh > 64-137-147-206.beanfield.net.64554: Flags [P.], seq 2725472:2725660, ack 1657, win 320, length 188
04:06:15.514875 IP lamp-s-1vcpu-1gb-tor1-01.ssh > 64-137-147-206.beanfield.net.64554: Flags [P.], seq 2725660:2725848, ack 1657, win 320, length 188
