tcpdump -c 5 -i eth0
tcpdump: verbose output suppressed, use -v or -vv for full protocol decode
listening on eth0, link-type EN10MB (Ethernet), capture size 262144 bytes
18:38:52.648525 IP lamp-s-1vcpu-1gb-tor1-01.ssh > 198.96.84.204.32005: Flags [P.], seq 3061352399:3061352507, ack 2678948522, win 313, length 108
18:38:52.648628 IP lamp-s-1vcpu-1gb-tor1-01.ssh > 198.96.84.204.32005: Flags [P.], seq 108:144, ack 1, win 313, length 36
18:38:52.648724 IP lamp-s-1vcpu-1gb-tor1-01.ssh > 198.96.84.204.32005: Flags [P.], seq 144:252, ack 1, win 313, length 108
18:38:52.648799 IP lamp-s-1vcpu-1gb-tor1-01.ssh > 198.96.84.204.32005: Flags [P.], seq 252:288, ack 1, win 313, length 36
18:38:52.650840 IP lamp-s-1vcpu-1gb-tor1-01.ssh > 198.96.84.204.32005: Flags [P.], seq 288:468, ack 1, win 313, length 180
5 packets captured
9 packets received by filter
0 packets dropped by kernel
