18:43:51.121648 IP 198.96.84.204.15419 > 138.197.140.18.22: Flags [.], ack 2717932, win 511, length 0
18:43:51.121654 IP 198.96.84.204.15419 > 138.197.140.18.22: Flags [.], ack 2718260, win 510, length 0
18:43:51.121660 IP 198.96.84.204.15419 > 138.197.140.18.22: Flags [.], ack 2718588, win 509, length 0
18:43:51.121664 IP 198.96.84.204.15419 > 138.197.140.18.22: Flags [.], ack 2718916, win 512, length 0
18:43:51.121827 IP 138.197.140.18.22 > 198.96.84.204.15419: Flags [P.], seq 2734516:2735296, ack 1549, win 313, length 780
18:43:51.121931 IP 138.197.140.18.22 > 198.96.84.204.15419: Flags [P.], seq 2735296:2735460, ack 1549, win 313, length 164
18:43:51.122030 IP 138.197.140.18.22 > 198.96.84.204.15419: Flags [P.], seq 2735460:2735624, ack 1549, win 313, length 164
18:43:51.122122 IP 138.197.140.18.22 > 198.96.84.204.15419: Flags [P.], seq 2735624:2735788, ack 1549, win 313, length 164
18:43:51.122217 IP 138.197.140.18.22 > 198.96.84.204.15419: Flags [P.], seq 2735788:2735952, ack 1549, win 313, length 164
18:43:51.122311 IP 138.197.140.18.22 > 198.96.84.204.15419: Flags [P.], seq 2735952:2736116, ack 1549, win 313, length 164
18:43:51.122408 IP 138.197.140.18.22 > 198.96.84.204.15419: Flags [P.], seq 2736116:2736280, ack 1549, win 313, length 164
18:43:51.122499 IP 138.197.140.18.22 > 198.96.84.204.15419: Flags [P.], seq 2736280:2736444, ack 1549, win 313, length 164
18:43:51.122595 IP 138.197.140.18.22 > 198.96.84.204.15419: Flags [P.], seq 2736444:2736608, ack 1549, win 313, length 164
18:43:51.122688 IP 138.197.140.18.22 > 198.96.84.204.15419: Flags [P.], seq 2736608:2736772, ack 1549, win 313, length 164
18:43:51.122786 IP 138.197.140.18.22 > 198.96.84.204.15419: Flags [P.], seq 2736772:2736936, ack 1549, win 313, length 164
18:43:51.122877 IP 138.197.140.18.22 > 198.96.84.204.15419: Flags [P.], seq 2736936:2737100, ack 1549, win 313, length 164
18:43:51.122973 IP 138.197.140.18.22 > 198.96.84.204.15419: Flags [P.], seq 2737100:2737264, ack 1549, win 313, length 164
18:43:51.123068 IP 138.197.140.18.22 > 198.96.84.204.15419: Flags [P.], seq 2737264:2737428, ack 1549, win 313, length 164
18:43:51.123182 IP 138.197.140.18.22 > 198.96.84.204.15419: Flags [P.], seq 2737428:2737592, ack 1549, win 313, length 164
18:43:51.123289 IP 138.197.140.18.22 > 198.96.84.204.15419: Flags [P.], seq 2737592:2737756, ack 1549, win 313, length 164
18:43:51.123371 IP 138.197.140.18.22 > 198.96.84.204.15419: Flags [P.], seq 2737756:2737920, ack 1549, win 313, length 164
18:43:51.123451 IP 138.197.140.18.22 > 198.96.84.204.15419: Flags [P.], seq 2737920:2738084, ack 1549, win 313, length 164
18:43:51.123526 IP 138.197.140.18.22 > 198.96.84.204.15419: Flags [P.], seq 2738084:2738248, ack 1549, win 313, length 164
18:43:51.123604 IP 138.197.140.18.22 > 198.96.84.204.15419: Flags [P.], seq 2738248:2738412, ack 1549, win 313, length 164
18:43:51.123678 IP 138.197.140.18.22 > 198.96.84.204.15419: Flags [P.], seq 2738412:2738576, ack 1549, win 313, length 164
18:43:51.123754 IP 138.197.140.18.22 > 198.96.84.204.15419: Flags [P.], seq 2738576:2738740, ack 1549, win 313, length 164
18:43:51.123832 IP 138.197.140.18.22 > 198.96.84.204.15419: Flags [P.], seq 2738740:2738904, ack 1549, win 313, length 164
18:43:51.123883 IP 198.96.84.204.15419 > 138.197.140.18.22: Flags [.], ack 2719572, win 510, length 0
18:43:51.123898 IP 198.96.84.204.15419 > 138.197.140.18.22: Flags [.], ack 2720204, win 507, length 0
18:43:51.123903 IP 198.96.84.204.15419 > 138.197.140.18.22: Flags [.], ack 2721044, win 512, length 0
18:43:51.123907 IP 198.96.84.204.15419 > 138.197.140.18.22: Flags [.], ack 2721372, win 511, length 0
18:43:51.123924 IP 198.96.84.204.15419 > 138.197.140.18.22: Flags [.], ack 2721700, win 510, length 0
18:43:51.123932 IP 198.96.84.204.15419 > 138.197.140.18.22: Flags [.], ack 2722028, win 509, length 0
18:43:51.123964 IP 198.96.84.204.15419 > 138.197.140.18.22: Flags [.], ack 2723612, win 507, length 0
18:43:51.123998 IP 198.96.84.204.15419 > 138.197.140.18.22: Flags [.], ack 2723940, win 512, length 0
18:43:51.124050 IP 198.96.84.204.15419 > 138.197.140.18.22: Flags [.], ack 2724596, win 510, length 0
18:43:51.124209 IP 138.197.140.18.22 > 198.96.84.204.15419: Flags [P.], seq 2738904:2739996, ack 1549, win 313, length 1092
18:43:51.124298 IP 138.197.140.18.22 > 198.96.84.204.15419: Flags [P.], seq 2739996:2740160, ack 1549, win 313, length 164
18:43:51.124377 IP 138.197.140.18.22 > 198.96.84.204.15419: Flags [P.], seq 2740160:2740324, ack 1549, win 313, length 164
18:43:51.124456 IP 138.197.140.18.22 > 198.96.84.204.15419: Flags [P.], seq 2740324:2740488, ack 1549, win 313, length 164
18:43:51.124534 IP 138.197.140.18.22 > 198.96.84.204.15419: Flags [P.], seq 2740488:2740652, ack 1549, win 313, length 164
18:43:51.124616 IP 138.197.140.18.22 > 198.96.84.204.15419: Flags [P.], seq 2740652:2740816, ack 1549, win 313, length 164
18:43:51.124699 IP 138.197.140.18.22 > 198.96.84.204.15419: Flags [P.], seq 2740816:2740980, ack 1549, win 313, length 164
18:43:51.124778 IP 138.197.140.18.22 > 198.96.84.204.15419: Flags [P.], seq 2740980:2741144, ack 1549, win 313, length 164
18:43:51.124861 IP 138.197.140.18.22 > 198.96.84.204.15419: Flags [P.], seq 2741144:2741308, ack 1549, win 313, length 164
18:43:51.124936 IP 138.197.140.18.22 > 198.96.84.204.15419: Flags [P.], seq 2741308:2741472, ack 1549, win 313, length 164
18:43:51.125013 IP 138.197.140.18.22 > 198.96.84.204.15419: Flags [P.], seq 2741472:2741636, ack 1549, win 313, length 164
18:43:51.125088 IP 138.197.140.18.22 > 198.96.84.204.15419: Flags [P.], seq 2741636:2741800, ack 1549, win 313, length 164
18:43:51.125165 IP 138.197.140.18.22 > 198.96.84.204.15419: Flags [P.], seq 2741800:2741964, ack 1549, win 313, length 164
18:43:51.125238 IP 138.197.140.18.22 > 198.96.84.204.15419: Flags [P.], seq 2741964:2742128, ack 1549, win 313, length 164
18:43:51.125314 IP 138.197.140.18.22 > 198.96.84.204.15419: Flags [P.], seq 2742128:2742292, ack 1549, win 313, length 164
18:43:51.125388 IP 138.197.140.18.22 > 198.96.84.204.15419: Flags [P.], seq 2742292:2742456, ack 1549, win 313, length 164
18:43:51.125465 IP 138.197.140.18.22 > 198.96.84.204.15419: Flags [P.], seq 2742456:2742620, ack 1549, win 313, length 164
18:43:51.125538 IP 138.197.140.18.22 > 198.96.84.204.15419: Flags [P.], seq 2742620:2742784, ack 1549, win 313, length 164
18:43:51.125620 IP 138.197.140.18.22 > 198.96.84.204.15419: Flags [P.], seq 2742784:2742948, ack 1549, win 313, length 164
18:43:51.125701 IP 138.197.140.18.22 > 198.96.84.204.15419: Flags [P.], seq 2742948:2743112, ack 1549, win 313, length 164
18:43:51.125769 IP 198.96.84.204.15419 > 138.197.140.18.22: Flags [.], ack 2725908, win 510, length 0
18:43:51.125784 IP 198.96.84.204.15419 > 138.197.140.18.22: Flags [.], ack 2726236, win 509, length 0
18:43:51.125789 IP 198.96.84.204.15419 > 138.197.140.18.22: Flags [.], ack 2726564, win 512, length 0
18:43:51.125877 IP 138.197.140.18.22 > 198.96.84.204.15419: Flags [P.], seq 2743112:2743580, ack 1549, win 313, length 468
18:43:51.125973 IP 138.197.140.18.22 > 198.96.84.204.15419: Flags [P.], seq 2743580:2743744, ack 1549, win 313, length 164
18:43:51.126033 IP 138.197.140.18.22 > 198.96.84.204.15419: Flags [P.], seq 2743744:2743908, ack 1549, win 313, length 164
18:43:51.126101 IP 138.197.140.18.22 > 198.96.84.204.15419: Flags [P.], seq 2743908:2744072, ack 1549, win 313, length 164
18:43:51.126163 IP 138.197.140.18.22 > 198.96.84.204.15419: Flags [P.], seq 2744072:2744236, ack 1549, win 313, length 164
18:43:51.126222 IP 138.197.140.18.22 > 198.96.84.204.15419: Flags [P.], seq 2744236:2744400, ack 1549, win 313, length 164
18:43:51.126249 IP 198.96.84.204.15419 > 138.197.140.18.22: Flags [.], ack 2726892, win 511, length 0
18:43:51.126262 IP 198.96.84.204.15419 > 138.197.140.18.22: Flags [.], ack 2727220, win 510, length 0
18:43:51.126266 IP 198.96.84.204.15419 > 138.197.140.18.22: Flags [.], ack 2727956, win 512, length 0
18:43:51.126364 IP 138.197.140.18.22 > 198.96.84.204.15419: Flags [P.], seq 2744400:2744868, ack 1549, win 313, length 468
18:43:51.126446 IP 138.197.140.18.22 > 198.96.84.204.15419: Flags [P.], seq 2744868:2745032, ack 1549, win 313, length 164
18:43:51.126519 IP 138.197.140.18.22 > 198.96.84.204.15419: Flags [P.], seq 2745032:2745196, ack 1549, win 313, length 164
18:43:51.126591 IP 138.197.140.18.22 > 198.96.84.204.15419: Flags [P.], seq 2745196:2745360, ack 1549, win 313, length 164
18:43:51.126662 IP 138.197.140.18.22 > 198.96.84.204.15419: Flags [P.], seq 2745360:2745524, ack 1549, win 313, length 164
18:43:51.126733 IP 138.197.140.18.22 > 198.96.84.204.15419: Flags [P.], seq 2745524:2745688, ack 1549, win 313, length 164
18:43:51.126805 IP 138.197.140.18.22 > 198.96.84.204.15419: Flags [P.], seq 2745688:2745852, ack 1549, win 313, length 164
18:43:51.126877 IP 138.197.140.18.22 > 198.96.84.204.15419: Flags [P.], seq 2745852:2746016, ack 1549, win 313, length 164
18:43:51.126944 IP 198.96.84.204.15419 > 138.197.140.18.22: Flags [.], ack 2728284, win 511, length 0
18:43:51.126956 IP 198.96.84.204.15419 > 138.197.140.18.22: Flags [.], ack 2728612, win 510, length 0
18:43:51.127026 IP 198.96.84.204.15419 > 138.197.140.18.22: Flags [.], ack 2728940, win 509, length 0
18:43:51.127036 IP 198.96.84.204.15419 > 138.197.140.18.22: Flags [.], ack 2729268, win 512, length 0
18:43:51.127068 IP 198.96.84.204.15419 > 138.197.140.18.22: Flags [.], ack 2729596, win 511, length 0
18:43:51.127076 IP 198.96.84.204.15419 > 138.197.140.18.22: Flags [.], ack 2729924, win 510, length 0
18:43:51.127081 IP 198.96.84.204.15419 > 138.197.140.18.22: Flags [.], ack 2730252, win 509, length 0
18:43:51.127084 IP 198.96.84.204.15419 > 138.197.140.18.22: Flags [.], ack 2730580, win 512, length 0
18:43:51.127088 IP 198.96.84.204.15419 > 138.197.140.18.22: Flags [.], ack 2730908, win 511, length 0
18:43:51.127200 IP 198.96.84.204.15419 > 138.197.140.18.22: Flags [.], ack 2732548, win 510, length 0
18:43:51.127274 IP 138.197.140.18.22 > 198.96.84.204.15419: Flags [P.], seq 2746016:2746180, ack 1549, win 313, length 164
18:43:51.127335 IP 138.197.140.18.22 > 198.96.84.204.15419: Flags [P.], seq 2746180:2747248, ack 1549, win 313, length 1068
18:43:51.127426 IP 138.197.140.18.22 > 198.96.84.204.15419: Flags [P.], seq 2747248:2747532, ack 1549, win 313, length 284
18:43:51.127524 IP 138.197.140.18.22 > 198.96.84.204.15419: Flags [P.], seq 2747532:2747696, ack 1549, win 313, length 164
18:43:51.127601 IP 138.197.140.18.22 > 198.96.84.204.15419: Flags [P.], seq 2747696:2747860, ack 1549, win 313, length 164
18:43:51.127679 IP 138.197.140.18.22 > 198.96.84.204.15419: Flags [P.], seq 2747860:2748024, ack 1549, win 313, length 164
18:43:51.127756 IP 138.197.140.18.22 > 198.96.84.204.15419: Flags [P.], seq 2748024:2748188, ack 1549, win 313, length 164
18:43:51.127833 IP 138.197.140.18.22 > 198.96.84.204.15419: Flags [P.], seq 2748188:2748352, ack 1549, win 313, length 164
18:43:51.127910 IP 138.197.140.18.22 > 198.96.84.204.15419: Flags [P.], seq 2748352:2748516, ack 1549, win 313, length 164
18:43:51.127987 IP 138.197.140.18.22 > 198.96.84.204.15419: Flags [P.], seq 2748516:2748680, ack 1549, win 313, length 164
18:43:51.128107 IP 138.197.140.18.22 > 198.96.84.204.15419: Flags [P.], seq 2748680:2748844, ack 1549, win 313, length 164
18:43:51.128186 IP 138.197.140.18.22 > 198.96.84.204.15419: Flags [P.], seq 2748844:2749008, ack 1549, win 313, length 164
18:43:51.128261 IP 138.197.140.18.22 > 198.96.84.204.15419: Flags [P.], seq 2749008:2749172, ack 1549, win 313, length 164
18:43:51.128329 IP 198.96.84.204.15419 > 138.197.140.18.22: Flags [P.], seq 1549:1585, ack 2732548, win 510, length 36
18:43:51.128340 IP 198.96.84.204.15419 > 138.197.140.18.22: Flags [.], ack 2732876, win 509, length 0
18:43:51.128346 IP 198.96.84.204.15419 > 138.197.140.18.22: Flags [.], ack 2733204, win 512, length 0
18:43:51.128351 IP 198.96.84.204.15419 > 138.197.140.18.22: Flags [.], ack 2733532, win 511, length 0
18:43:51.128355 IP 198.96.84.204.15419 > 138.197.140.18.22: Flags [.], ack 2733860, win 510, length 0
18:43:51.128360 IP 198.96.84.204.15419 > 138.197.140.18.22: Flags [.], ack 2734188, win 509, length 0
18:43:51.128381 IP 198.96.84.204.15419 > 138.197.140.18.22: Flags [.], ack 2734516, win 512, length 0
18:43:51.128450 IP 198.96.84.204.15419 > 138.197.140.18.22: Flags [.], ack 2736116, win 512, length 0
18:43:51.128577 IP 138.197.140.18.22 > 198.96.84.204.15419: Flags [P.], seq 2749172:2749336, ack 1585, win 313, length 164
18:43:51.128627 IP 138.197.140.18.22 > 198.96.84.204.15419: Flags [P.], seq 2749336:2750212, ack 1585, win 313, length 876
18:43:51.128716 IP 138.197.140.18.22 > 198.96.84.204.15419: Flags [P.], seq 2750212:2750496, ack 1585, win 313, length 284
18:43:51.128791 IP 138.197.140.18.22 > 198.96.84.204.15419: Flags [P.], seq 2750496:2750660, ack 1585, win 313, length 164
18:43:51.128866 IP 138.197.140.18.22 > 198.96.84.204.15419: Flags [P.], seq 2750660:2750824, ack 1585, win 313, length 164
18:43:51.128938 IP 138.197.140.18.22 > 198.96.84.204.15419: Flags [P.], seq 2750824:2750988, ack 1585, win 313, length 164
18:43:51.129009 IP 138.197.140.18.22 > 198.96.84.204.15419: Flags [P.], seq 2750988:2751152, ack 1585, win 313, length 164
18:43:51.129105 IP 138.197.140.18.22 > 198.96.84.204.15419: Flags [P.], seq 2751152:2751316, ack 1585, win 313, length 164
18:43:51.129222 IP 138.197.140.18.22 > 198.96.84.204.15419: Flags [P.], seq 2751316:2751480, ack 1585, win 313, length 164
18:43:51.129304 IP 138.197.140.18.22 > 198.96.84.204.15419: Flags [P.], seq 2751480:2751644, ack 1585, win 313, length 164
18:43:51.129378 IP 138.197.140.18.22 > 198.96.84.204.15419: Flags [P.], seq 2751644:2751808, ack 1585, win 313, length 164
18:43:51.129451 IP 138.197.140.18.22 > 198.96.84.204.15419: Flags [P.], seq 2751808:2751972, ack 1585, win 313, length 164
18:43:51.129523 IP 138.197.140.18.22 > 198.96.84.204.15419: Flags [P.], seq 2751972:2752136, ack 1585, win 313, length 164
18:43:51.129594 IP 138.197.140.18.22 > 198.96.84.204.15419: Flags [P.], seq 2752136:2752300, ack 1585, win 313, length 164
18:43:51.129666 IP 138.197.140.18.22 > 198.96.84.204.15419: Flags [P.], seq 2752300:2752464, ack 1585, win 313, length 164
18:43:51.129719 IP 198.96.84.204.15419 > 138.197.140.18.22: Flags [.], ack 2737100, win 508, length 0
18:43:51.129732 IP 198.96.84.204.15419 > 138.197.140.18.22: Flags [.], ack 2737264, win 512, length 0
18:43:51.129764 IP 198.96.84.204.15419 > 138.197.140.18.22: Flags [.], ack 2737428, win 512, length 0
18:43:51.129833 IP 198.96.84.204.15419 > 138.197.140.18.22: Flags [.], ack 2737756, win 510, length 0
18:43:51.129846 IP 198.96.84.204.15419 > 138.197.140.18.22: Flags [.], ack 2738084, win 509, length 0
18:43:51.129850 IP 198.96.84.204.15419 > 138.197.140.18.22: Flags [.], ack 2738412, win 508, length 0
18:43:51.129854 IP 198.96.84.204.15419 > 138.197.140.18.22: Flags [.], ack 2738576, win 512, length 0
18:43:51.129860 IP 198.96.84.204.15419 > 138.197.140.18.22: Flags [.], ack 2738740, win 512, length 0
18:43:51.129890 IP 198.96.84.204.15419 > 138.197.140.18.22: Flags [.], ack 2739996, win 512, length 0
18:43:51.129894 IP 198.96.84.204.15419 > 138.197.140.18.22: Flags [.], ack 2740324, win 511, length 0
18:43:51.130088 IP 138.197.140.18.22 > 198.96.84.204.15419: Flags [P.], seq 2752932:2753688, ack 1585, win 313, length 756
18:43:51.130165 IP 138.197.140.18.22 > 198.96.84.204.15419: Flags [P.], seq 2753688:2753852, ack 1585, win 313, length 164
18:43:51.130242 IP 138.197.140.18.22 > 198.96.84.204.15419: Flags [P.], seq 2753852:2754016, ack 1585, win 313, length 164
18:43:51.130315 IP 138.197.140.18.22 > 198.96.84.204.15419: Flags [P.], seq 2754016:2754180, ack 1585, win 313, length 164
18:43:51.130391 IP 138.197.140.18.22 > 198.96.84.204.15419: Flags [P.], seq 2754180:2754344, ack 1585, win 313, length 164
18:43:51.130464 IP 138.197.140.18.22 > 198.96.84.204.15419: Flags [P.], seq 2754344:2754508, ack 1585, win 313, length 164
18:43:51.130540 IP 138.197.140.18.22 > 198.96.84.204.15419: Flags [P.], seq 2754508:2754672, ack 1585, win 313, length 164
18:43:51.130614 IP 138.197.140.18.22 > 198.96.84.204.15419: Flags [P.], seq 2754672:2754836, ack 1585, win 313, length 164
18:43:51.130710 IP 138.197.140.18.22 > 198.96.84.204.15419: Flags [P.], seq 2754836:2755000, ack 1585, win 313, length 164
18:43:51.130785 IP 138.197.140.18.22 > 198.96.84.204.15419: Flags [P.], seq 2755000:2755164, ack 1585, win 313, length 164
18:43:51.130862 IP 138.197.140.18.22 > 198.96.84.204.15419: Flags [P.], seq 2755164:2755328, ack 1585, win 313, length 164
18:43:51.130935 IP 138.197.140.18.22 > 198.96.84.204.15419: Flags [P.], seq 2755328:2755492, ack 1585, win 313, length 164
18:43:51.131012 IP 138.197.140.18.22 > 198.96.84.204.15419: Flags [P.], seq 2755492:2755656, ack 1585, win 313, length 164
18:43:51.131085 IP 138.197.140.18.22 > 198.96.84.204.15419: Flags [P.], seq 2755656:2755820, ack 1585, win 313, length 164
18:43:51.131164 IP 138.197.140.18.22 > 198.96.84.204.15419: Flags [P.], seq 2755820:2755984, ack 1585, win 313, length 164
18:43:51.131238 IP 138.197.140.18.22 > 198.96.84.204.15419: Flags [P.], seq 2755984:2756148, ack 1585, win 313, length 164
18:43:51.131315 IP 138.197.140.18.22 > 198.96.84.204.15419: Flags [P.], seq 2756148:2756312, ack 1585, win 313, length 164
18:43:51.131388 IP 138.197.140.18.22 > 198.96.84.204.15419: Flags [P.], seq 2756312:2756476, ack 1585, win 313, length 164
18:43:51.131465 IP 138.197.140.18.22 > 198.96.84.204.15419: Flags [P.], seq 2756476:2756640, ack 1585, win 313, length 164
18:43:51.131538 IP 138.197.140.18.22 > 198.96.84.204.15419: Flags [P.], seq 2756640:2756804, ack 1585, win 313, length 164
18:43:51.131563 IP 198.96.84.204.15419 > 138.197.140.18.22: Flags [.], ack 2741964, win 510, length 0
18:43:51.131574 IP 198.96.84.204.15419 > 138.197.140.18.22: Flags [.], ack 2742292, win 509, length 0
18:43:51.131579 IP 198.96.84.204.15419 > 138.197.140.18.22: Flags [.], ack 2742620, win 512, length 0
18:43:51.131689 IP 138.197.140.18.22 > 198.96.84.204.15419: Flags [P.], seq 2756804:2757272, ack 1585, win 313, length 468
18:43:51.131769 IP 138.197.140.18.22 > 198.96.84.204.15419: Flags [P.], seq 2757272:2757436, ack 1585, win 313, length 164
18:43:51.131846 IP 138.197.140.18.22 > 198.96.84.204.15419: Flags [P.], seq 2757436:2757600, ack 1585, win 313, length 164
18:43:51.131920 IP 138.197.140.18.22 > 198.96.84.204.15419: Flags [P.], seq 2757600:2757764, ack 1585, win 313, length 164
18:43:51.131999 IP 138.197.140.18.22 > 198.96.84.204.15419: Flags [P.], seq 2757764:2757928, ack 1585, win 313, length 164
18:43:51.132143 IP 138.197.140.18.22 > 198.96.84.204.15419: Flags [P.], seq 2757928:2758092, ack 1585, win 313, length 164
18:43:51.132227 IP 138.197.140.18.22 > 198.96.84.204.15419: Flags [P.], seq 2758092:2758256, ack 1585, win 313, length 164
18:43:51.132303 IP 138.197.140.18.22 > 198.96.84.204.15419: Flags [P.], seq 2758256:2758420, ack 1585, win 313, length 164
18:43:51.132381 IP 138.197.140.18.22 > 198.96.84.204.15419: Flags [P.], seq 2758420:2758584, ack 1585, win 313, length 164
18:43:51.132455 IP 138.197.140.18.22 > 198.96.84.204.15419: Flags [P.], seq 2758584:2758748, ack 1585, win 313, length 164
18:43:51.132532 IP 138.197.140.18.22 > 198.96.84.204.15419: Flags [P.], seq 2758748:2758912, ack 1585, win 313, length 164
18:43:51.132607 IP 138.197.140.18.22 > 198.96.84.204.15419: Flags [P.], seq 2758912:2759076, ack 1585, win 313, length 164
18:43:51.132683 IP 138.197.140.18.22 > 198.96.84.204.15419: Flags [P.], seq 2759076:2759240, ack 1585, win 313, length 164
18:43:51.132758 IP 138.197.140.18.22 > 198.96.84.204.15419: Flags [P.], seq 2759240:2759404, ack 1585, win 313, length 164
18:43:51.132834 IP 138.197.140.18.22 > 198.96.84.204.15419: Flags [P.], seq 2759404:2759568, ack 1585, win 313, length 164
18:43:51.132908 IP 138.197.140.18.22 > 198.96.84.204.15419: Flags [P.], seq 2759568:2759732, ack 1585, win 313, length 164
18:43:51.132953 IP 198.96.84.204.15419 > 138.197.140.18.22: Flags [.], ack 2742948, win 511, length 0
18:43:51.132966 IP 198.96.84.204.15419 > 138.197.140.18.22: Flags [.], ack 2743580, win 509, length 0
18:43:51.132970 IP 198.96.84.204.15419 > 138.197.140.18.22: Flags [.], ack 2743908, win 507, length 0
18:43:51.132974 IP 198.96.84.204.15419 > 138.197.140.18.22: Flags [.], ack 2744072, win 512, length 0
18:43:51.132978 IP 198.96.84.204.15419 > 138.197.140.18.22: Flags [.], ack 2744236, win 512, length 0
18:43:51.132981 IP 198.96.84.204.15419 > 138.197.140.18.22: Flags [.], ack 2744868, win 509, length 0
18:43:51.133020 IP 198.96.84.204.15419 > 138.197.140.18.22: Flags [.], ack 2745852, win 511, length 0
18:43:51.133053 IP 198.96.84.204.15419 > 138.197.140.18.22: Flags [.], ack 2747248, win 512, length 0
18:43:51.133197 IP 138.197.140.18.22 > 198.96.84.204.15419: Flags [P.], seq 2759732:2760720, ack 1585, win 313, length 988
18:43:51.133312 IP 138.197.140.18.22 > 198.96.84.204.15419: Flags [P.], seq 2760720:2760884, ack 1585, win 313, length 164
18:43:51.133398 IP 138.197.140.18.22 > 198.96.84.204.15419: Flags [P.], seq 2760884:2761048, ack 1585, win 313, length 164
18:43:51.133474 IP 138.197.140.18.22 > 198.96.84.204.15419: Flags [P.], seq 2761048:2761212, ack 1585, win 313, length 164
18:43:51.133560 IP 138.197.140.18.22 > 198.96.84.204.15419: Flags [P.], seq 2761212:2761376, ack 1585, win 313, length 164
18:43:51.133658 IP 198.96.84.204.15419 > 138.197.140.18.22: Flags [.], ack 2747860, win 510, length 0
18:43:51.133672 IP 198.96.84.204.15419 > 138.197.140.18.22: Flags [.], ack 2748188, win 509, length 0
18:43:51.133676 IP 198.96.84.204.15419 > 138.197.140.18.22: Flags [.], ack 2748516, win 507, length 0
18:43:51.133694 IP 198.96.84.204.15419 > 138.197.140.18.22: Flags [.], ack 2748680, win 512, length 0
18:43:51.133701 IP 198.96.84.204.15419 > 138.197.140.18.22: Flags [.], ack 2748844, win 512, length 0
18:43:51.133706 IP 198.96.84.204.15419 > 138.197.140.18.22: Flags [.], ack 2749172, win 510, length 0
18:43:51.133860 IP 138.197.140.18.22 > 198.96.84.204.15419: Flags [P.], seq 2761376:2761540, ack 1585, win 313, length 164
18:43:51.133944 IP 138.197.140.18.22 > 198.96.84.204.15419: Flags [P.], seq 2761540:2762192, ack 1585, win 313, length 652
18:43:51.134013 IP 138.197.140.18.22 > 198.96.84.204.15419: Flags [P.], seq 2762192:2762356, ack 1585, win 313, length 164
18:43:51.134096 IP 138.197.140.18.22 > 198.96.84.204.15419: Flags [P.], seq 2762356:2762520, ack 1585, win 313, length 164
18:43:51.134170 IP 138.197.140.18.22 > 198.96.84.204.15419: Flags [P.], seq 2762520:2762684, ack 1585, win 313, length 164
18:43:51.134251 IP 138.197.140.18.22 > 198.96.84.204.15419: Flags [P.], seq 2762684:2762848, ack 1585, win 313, length 164
18:43:51.134347 IP 138.197.140.18.22 > 198.96.84.204.15419: Flags [P.], seq 2762848:2763012, ack 1585, win 313, length 164
18:43:51.134420 IP 138.197.140.18.22 > 198.96.84.204.15419: Flags [P.], seq 2763012:2763176, ack 1585, win 313, length 164
18:43:51.134487 IP 138.197.140.18.22 > 198.96.84.204.15419: Flags [P.], seq 2763176:2763340, ack 1585, win 313, length 164
18:43:51.134517 IP 138.197.140.18.22 > 198.96.84.204.15419: Flags [P.], seq 2763340:2763504, ack 1585, win 313, length 164
18:43:51.134602 IP 138.197.140.18.22 > 198.96.84.204.15419: Flags [P.], seq 2763504:2763788, ack 1585, win 313, length 284
18:43:51.134676 IP 138.197.140.18.22 > 198.96.84.204.15419: Flags [P.], seq 2763788:2763952, ack 1585, win 313, length 164
18:43:51.134750 IP 138.197.140.18.22 > 198.96.84.204.15419: Flags [P.], seq 2763952:2764116, ack 1585, win 313, length 164
18:43:51.134822 IP 138.197.140.18.22 > 198.96.84.204.15419: Flags [P.], seq 2764116:2764280, ack 1585, win 313, length 164
18:43:51.134880 IP 198.96.84.204.15419 > 138.197.140.18.22: Flags [.], ack 2750212, win 512, length 0
18:43:51.134892 IP 198.96.84.204.15419 > 138.197.140.18.22: Flags [.], ack 2750660, win 511, length 0
18:43:51.134896 IP 198.96.84.204.15419 > 138.197.140.18.22: Flags [.], ack 2750988, win 509, length 0
18:43:51.134991 IP 198.96.84.204.15419 > 138.197.140.18.22: Flags [.], ack 2751316, win 508, length 0
18:43:51.135001 IP 198.96.84.204.15419 > 138.197.140.18.22: Flags [.], ack 2751644, win 512, length 0
18:43:51.135004 IP 198.96.84.204.15419 > 138.197.140.18.22: Flags [.], ack 2751972, win 511, length 0
18:43:51.135006 IP 198.96.84.204.15419 > 138.197.140.18.22: Flags [.], ack 2752300, win 510, length 0
18:43:51.135009 IP 198.96.84.204.15419 > 138.197.140.18.22: Flags [.], ack 2752932, win 507, length 0
18:43:51.135011 IP 198.96.84.204.15419 > 138.197.140.18.22: Flags [.], ack 2753852, win 512, length 0
18:43:51.135020 IP 138.197.140.18.22 > 198.96.84.204.15419: Flags [P.], seq 2764280:2764748, ack 1585, win 313, length 468
18:43:51.135191 IP 138.197.140.18.22 > 198.96.84.204.15419: Flags [P.], seq 2764748:2765528, ack 1585, win 313, length 780
18:43:51.135274 IP 138.197.140.18.22 > 198.96.84.204.15419: Flags [P.], seq 2765528:2765692, ack 1585, win 313, length 164
18:43:51.135350 IP 138.197.140.18.22 > 198.96.84.204.15419: Flags [P.], seq 2765692:2765856, ack 1585, win 313, length 164
18:43:51.135423 IP 138.197.140.18.22 > 198.96.84.204.15419: Flags [P.], seq 2765856:2766020, ack 1585, win 313, length 164
18:43:51.135499 IP 138.197.140.18.22 > 198.96.84.204.15419: Flags [P.], seq 2766020:2766184, ack 1585, win 313, length 164
18:43:51.135571 IP 138.197.140.18.22 > 198.96.84.204.15419: Flags [P.], seq 2766184:2766348, ack 1585, win 313, length 164
18:43:51.135642 IP 138.197.140.18.22 > 198.96.84.204.15419: Flags [P.], seq 2766348:2766512, ack 1585, win 313, length 164
18:43:51.135712 IP 138.197.140.18.22 > 198.96.84.204.15419: Flags [P.], seq 2766512:2766676, ack 1585, win 313, length 164
18:43:51.135783 IP 138.197.140.18.22 > 198.96.84.204.15419: Flags [P.], seq 2766676:2766840, ack 1585, win 313, length 164
18:43:51.135854 IP 138.197.140.18.22 > 198.96.84.204.15419: Flags [P.], seq 2766840:2767004, ack 1585, win 313, length 164
18:43:51.135924 IP 138.197.140.18.22 > 198.96.84.204.15419: Flags [P.], seq 2767004:2767168, ack 1585, win 313, length 164
18:43:51.135995 IP 138.197.140.18.22 > 198.96.84.204.15419: Flags [P.], seq 2767168:2767332, ack 1585, win 313, length 164
18:43:51.136109 IP 138.197.140.18.22 > 198.96.84.204.15419: Flags [P.], seq 2767332:2767496, ack 1585, win 313, length 164
18:43:51.136204 IP 138.197.140.18.22 > 198.96.84.204.15419: Flags [P.], seq 2767496:2767660, ack 1585, win 313, length 164
18:43:51.136283 IP 138.197.140.18.22 > 198.96.84.204.15419: Flags [P.], seq 2767660:2767824, ack 1585, win 313, length 164
18:43:51.136303 IP 198.96.84.204.15419 > 138.197.140.18.22: Flags [.], ack 2754508, win 510, length 0
18:43:51.136310 IP 198.96.84.204.15419 > 138.197.140.18.22: Flags [.], ack 2754836, win 509, length 0
18:43:51.136419 IP 138.197.140.18.22 > 198.96.84.204.15419: Flags [P.], seq 2767824:2768188, ack 1585, win 313, length 364
18:43:51.136500 IP 138.197.140.18.22 > 198.96.84.204.15419: Flags [P.], seq 2768188:2768352, ack 1585, win 313, length 164
18:43:51.136578 IP 138.197.140.18.22 > 198.96.84.204.15419: Flags [P.], seq 2768352:2768516, ack 1585, win 313, length 164
18:43:51.136653 IP 138.197.140.18.22 > 198.96.84.204.15419: Flags [P.], seq 2768516:2768680, ack 1585, win 313, length 164
18:43:51.136730 IP 138.197.140.18.22 > 198.96.84.204.15419: Flags [P.], seq 2768680:2768844, ack 1585, win 313, length 164
18:43:51.136805 IP 138.197.140.18.22 > 198.96.84.204.15419: Flags [P.], seq 2768844:2769008, ack 1585, win 313, length 164
18:43:51.136882 IP 138.197.140.18.22 > 198.96.84.204.15419: Flags [P.], seq 2769008:2769172, ack 1585, win 313, length 164
18:43:51.136957 IP 138.197.140.18.22 > 198.96.84.204.15419: Flags [P.], seq 2769172:2769336, ack 1585, win 313, length 164
18:43:51.137034 IP 138.197.140.18.22 > 198.96.84.204.15419: Flags [P.], seq 2769336:2769500, ack 1585, win 313, length 164
18:43:51.137119 IP 138.197.140.18.22 > 198.96.84.204.15419: Flags [P.], seq 2769500:2769664, ack 1585, win 313, length 164
18:43:51.137203 IP 138.197.140.18.22 > 198.96.84.204.15419: Flags [P.], seq 2769664:2769828, ack 1585, win 313, length 164
18:43:51.137279 IP 138.197.140.18.22 > 198.96.84.204.15419: Flags [P.], seq 2769828:2769992, ack 1585, win 313, length 164
18:43:51.137357 IP 138.197.140.18.22 > 198.96.84.204.15419: Flags [P.], seq 2769992:2770156, ack 1585, win 313, length 164
18:43:51.137432 IP 138.197.140.18.22 > 198.96.84.204.15419: Flags [P.], seq 2770156:2770320, ack 1585, win 313, length 164
18:43:51.137509 IP 138.197.140.18.22 > 198.96.84.204.15419: Flags [P.], seq 2770320:2770484, ack 1585, win 313, length 164
18:43:51.137584 IP 138.197.140.18.22 > 198.96.84.204.15419: Flags [P.], seq 2770484:2770648, ack 1585, win 313, length 164
18:43:51.137660 IP 138.197.140.18.22 > 198.96.84.204.15419: Flags [P.], seq 2770648:2770812, ack 1585, win 313, length 164
18:43:51.137735 IP 138.197.140.18.22 > 198.96.84.204.15419: Flags [P.], seq 2770812:2770976, ack 1585, win 313, length 164
18:43:51.137812 IP 138.197.140.18.22 > 198.96.84.204.15419: Flags [P.], seq 2770976:2771140, ack 1585, win 313, length 164
18:43:51.137887 IP 138.197.140.18.22 > 198.96.84.204.15419: Flags [P.], seq 2771140:2771304, ack 1585, win 313, length 164
18:43:51.137963 IP 138.197.140.18.22 > 198.96.84.204.15419: Flags [P.], seq 2771304:2771468, ack 1585, win 313, length 164
18:43:51.138041 IP 138.197.140.18.22 > 198.96.84.204.15419: Flags [P.], seq 2771468:2771632, ack 1585, win 313, length 164
18:43:51.138120 IP 138.197.140.18.22 > 198.96.84.204.15419: Flags [P.], seq 2771632:2771796, ack 1585, win 313, length 164
18:43:51.138197 IP 138.197.140.18.22 > 198.96.84.204.15419: Flags [P.], seq 2771796:2771960, ack 1585, win 313, length 164
18:43:51.138276 IP 138.197.140.18.22 > 198.96.84.204.15419: Flags [P.], seq 2771960:2772124, ack 1585, win 313, length 164
18:43:51.138350 IP 138.197.140.18.22 > 198.96.84.204.15419: Flags [P.], seq 2772124:2772288, ack 1585, win 313, length 164
18:43:51.138427 IP 138.197.140.18.22 > 198.96.84.204.15419: Flags [P.], seq 2772288:2772452, ack 1585, win 313, length 164
18:43:51.138502 IP 138.197.140.18.22 > 198.96.84.204.15419: Flags [P.], seq 2772452:2772616, ack 1585, win 313, length 164
18:43:51.138579 IP 138.197.140.18.22 > 198.96.84.204.15419: Flags [P.], seq 2772616:2772780, ack 1585, win 313, length 164
18:43:51.138654 IP 138.197.140.18.22 > 198.96.84.204.15419: Flags [P.], seq 2772780:2772944, ack 1585, win 313, length 164
18:43:51.138732 IP 138.197.140.18.22 > 198.96.84.204.15419: Flags [P.], seq 2772944:2773108, ack 1585, win 313, length 164
18:43:51.138809 IP 138.197.140.18.22 > 198.96.84.204.15419: Flags [P.], seq 2773108:2773272, ack 1585, win 313, length 164
18:43:51.138887 IP 138.197.140.18.22 > 198.96.84.204.15419: Flags [P.], seq 2773272:2773436, ack 1585, win 313, length 164
18:43:51.138961 IP 138.197.140.18.22 > 198.96.84.204.15419: Flags [P.], seq 2773436:2773600, ack 1585, win 313, length 164
18:43:51.139043 IP 138.197.140.18.22 > 198.96.84.204.15419: Flags [P.], seq 2773600:2773764, ack 1585, win 313, length 164
18:43:51.139118 IP 138.197.140.18.22 > 198.96.84.204.15419: Flags [P.], seq 2773764:2773928, ack 1585, win 313, length 164
18:43:51.139196 IP 138.197.140.18.22 > 198.96.84.204.15419: Flags [P.], seq 2773928:2774092, ack 1585, win 313, length 164
18:43:51.139273 IP 138.197.140.18.22 > 198.96.84.204.15419: Flags [P.], seq 2774092:2774256, ack 1585, win 313, length 164
18:43:51.139361 IP 138.197.140.18.22 > 198.96.84.204.15419: Flags [P.], seq 2774256:2774420, ack 1585, win 313, length 164
18:43:51.139445 IP 138.197.140.18.22 > 198.96.84.204.15419: Flags [P.], seq 2774420:2774584, ack 1585, win 313, length 164
18:43:51.139528 IP 138.197.140.18.22 > 198.96.84.204.15419: Flags [P.], seq 2774584:2774748, ack 1585, win 313, length 164
18:43:51.139605 IP 138.197.140.18.22 > 198.96.84.204.15419: Flags [P.], seq 2774748:2774912, ack 1585, win 313, length 164
18:43:51.139682 IP 138.197.140.18.22 > 198.96.84.204.15419: Flags [P.], seq 2774912:2775076, ack 1585, win 313, length 164
18:43:51.139757 IP 138.197.140.18.22 > 198.96.84.204.15419: Flags [P.], seq 2775076:2775240, ack 1585, win 313, length 164
18:43:51.139834 IP 138.197.140.18.22 > 198.96.84.204.15419: Flags [P.], seq 2775240:2775404, ack 1585, win 313, length 164
18:43:51.139910 IP 138.197.140.18.22 > 198.96.84.204.15419: Flags [P.], seq 2775404:2775568, ack 1585, win 313, length 164
18:43:51.139989 IP 138.197.140.18.22 > 198.96.84.204.15419: Flags [P.], seq 2775568:2775732, ack 1585, win 313, length 164
18:43:51.140096 IP 198.96.84.204.15419 > 138.197.140.18.22: Flags [.], ack 2755164, win 512, length 0
18:43:51.140119 IP 198.96.84.204.15419 > 138.197.140.18.22: Flags [.], ack 2755492, win 511, length 0
18:43:51.140127 IP 198.96.84.204.15419 > 138.197.140.18.22: Flags [.], ack 2755820, win 510, length 0
18:43:51.140133 IP 198.96.84.204.15419 > 138.197.140.18.22: Flags [.], ack 2756148, win 509, length 0
18:43:51.140140 IP 198.96.84.204.15419 > 138.197.140.18.22: Flags [.], ack 2756476, win 512, length 0
18:43:51.140145 IP 198.96.84.204.15419 > 138.197.140.18.22: Flags [.], ack 2756804, win 511, length 0
18:43:51.140152 IP 198.96.84.204.15419 > 138.197.140.18.22: Flags [.], ack 2757436, win 509, length 0
18:43:51.140308 IP 138.197.140.18.22 > 198.96.84.204.15419: Flags [P.], seq 2775732:2776616, ack 1585, win 313, length 884
18:43:51.140402 IP 138.197.140.18.22 > 198.96.84.204.15419: Flags [P.], seq 2776616:2776780, ack 1585, win 313, length 164
18:43:51.140513 IP 138.197.140.18.22 > 198.96.84.204.15419: Flags [P.], seq 2776780:2776944, ack 1585, win 313, length 164
18:43:51.140602 IP 138.197.140.18.22 > 198.96.84.204.15419: Flags [P.], seq 2776944:2777108, ack 1585, win 313, length 164
18:43:51.140682 IP 138.197.140.18.22 > 198.96.84.204.15419: Flags [P.], seq 2777108:2777272, ack 1585, win 313, length 164
18:43:51.140756 IP 138.197.140.18.22 > 198.96.84.204.15419: Flags [P.], seq 2777272:2777436, ack 1585, win 313, length 164
18:43:51.140826 IP 138.197.140.18.22 > 198.96.84.204.15419: Flags [P.], seq 2777436:2777600, ack 1585, win 313, length 164
18:43:51.140900 IP 138.197.140.18.22 > 198.96.84.204.15419: Flags [P.], seq 2777600:2777764, ack 1585, win 313, length 164
18:43:51.140987 IP 138.197.140.18.22 > 198.96.84.204.15419: Flags [P.], seq 2777764:2777928, ack 1585, win 313, length 164
18:43:51.141078 IP 138.197.140.18.22 > 198.96.84.204.15419: Flags [P.], seq 2777928:2778092, ack 1585, win 313, length 164
18:43:51.141174 IP 138.197.140.18.22 > 198.96.84.204.15419: Flags [P.], seq 2778092:2778256, ack 1585, win 313, length 164
18:43:51.141250 IP 138.197.140.18.22 > 198.96.84.204.15419: Flags [P.], seq 2778256:2778420, ack 1585, win 313, length 164
18:43:51.141324 IP 138.197.140.18.22 > 198.96.84.204.15419: Flags [P.], seq 2778420:2778584, ack 1585, win 313, length 164
18:43:51.141384 IP 198.96.84.204.15419 > 138.197.140.18.22: Flags [.], ack 2757764, win 507, length 0
18:43:51.141420 IP 198.96.84.204.15419 > 138.197.140.18.22: Flags [.], ack 2758092, win 512, length 0
18:43:51.141430 IP 198.96.84.204.15419 > 138.197.140.18.22: Flags [.], ack 2758420, win 511, length 0
18:43:51.141434 IP 198.96.84.204.15419 > 138.197.140.18.22: Flags [.], ack 2758748, win 510, length 0
18:43:51.141438 IP 198.96.84.204.15419 > 138.197.140.18.22: Flags [.], ack 2759076, win 509, length 0
18:43:51.141442 IP 198.96.84.204.15419 > 138.197.140.18.22: Flags [.], ack 2759404, win 512, length 0
18:43:51.141480 IP 198.96.84.204.15419 > 138.197.140.18.22: Flags [.], ack 2759732, win 511, length 0
18:43:51.141487 IP 198.96.84.204.15419 > 138.197.140.18.22: Flags [.], ack 2760884, win 512, length 0
18:43:51.141523 IP 198.96.84.204.15419 > 138.197.140.18.22: Flags [.], ack 2762356, win 512, length 0
18:43:51.141530 IP 198.96.84.204.15419 > 138.197.140.18.22: Flags [.], ack 2762684, win 511, length 0
18:43:51.141570 IP 198.96.84.204.15419 > 138.197.140.18.22: Flags [.], ack 2763012, win 510, length 0
18:43:51.141576 IP 198.96.84.204.15419 > 138.197.140.18.22: Flags [.], ack 2763340, win 509, length 0
18:43:51.141717 IP 138.197.140.18.22 > 198.96.84.204.15419: Flags [P.], seq 2778584:2779980, ack 1585, win 313, length 1396
18:43:51.141803 IP 138.197.140.18.22 > 198.96.84.204.15419: Flags [P.], seq 2779980:2780144, ack 1585, win 313, length 164
18:43:51.141879 IP 138.197.140.18.22 > 198.96.84.204.15419: Flags [P.], seq 2780144:2780308, ack 1585, win 313, length 164
18:43:51.141951 IP 138.197.140.18.22 > 198.96.84.204.15419: Flags [P.], seq 2780308:2780472, ack 1585, win 313, length 164
18:43:51.142022 IP 138.197.140.18.22 > 198.96.84.204.15419: Flags [P.], seq 2780472:2780636, ack 1585, win 313, length 164
18:43:51.142094 IP 138.197.140.18.22 > 198.96.84.204.15419: Flags [P.], seq 2780636:2780800, ack 1585, win 313, length 164
18:43:51.142165 IP 138.197.140.18.22 > 198.96.84.204.15419: Flags [P.], seq 2780800:2780964, ack 1585, win 313, length 164
18:43:51.142236 IP 138.197.140.18.22 > 198.96.84.204.15419: Flags [P.], seq 2780964:2781128, ack 1585, win 313, length 164
18:43:51.142307 IP 138.197.140.18.22 > 198.96.84.204.15419: Flags [P.], seq 2781128:2781292, ack 1585, win 313, length 164
18:43:51.142378 IP 138.197.140.18.22 > 198.96.84.204.15419: Flags [P.], seq 2781292:2781456, ack 1585, win 313, length 164
18:43:51.142449 IP 138.197.140.18.22 > 198.96.84.204.15419: Flags [P.], seq 2781456:2781620, ack 1585, win 313, length 164
18:43:51.142521 IP 138.197.140.18.22 > 198.96.84.204.15419: Flags [P.], seq 2781620:2781784, ack 1585, win 313, length 164
18:43:51.142595 IP 138.197.140.18.22 > 198.96.84.204.15419: Flags [P.], seq 2781784:2781948, ack 1585, win 313, length 164
18:43:51.143063 IP 198.96.84.204.15419 > 138.197.140.18.22: Flags [.], ack 2763952, win 512, options [nop,nop,sack 1 {2764116:2764280}], length 0
18:43:51.143091 IP 198.96.84.204.15419 > 138.197.140.18.22: Flags [.], ack 2763952, win 512, options [nop,nop,sack 1 {2764116:2764748}], length 0
18:43:51.143097 IP 198.96.84.204.15419 > 138.197.140.18.22: Flags [.], ack 2763952, win 512, options [nop,nop,sack 1 {2764116:2765528}], length 0
18:43:51.143108 IP 138.197.140.18.22 > 198.96.84.204.15419: Flags [P.], seq 2763952:2764116, ack 1585, win 313, length 164
18:43:51.143120 IP 198.96.84.204.15419 > 138.197.140.18.22: Flags [.], ack 2763952, win 512, options [nop,nop,sack 1 {2764116:2765692}], length 0
18:43:51.143126 IP 198.96.84.204.15419 > 138.197.140.18.22: Flags [.], ack 2763952, win 512, options [nop,nop,sack 1 {2764116:2765856}], length 0
18:43:51.143132 IP 198.96.84.204.15419 > 138.197.140.18.22: Flags [.], ack 2763952, win 512, options [nop,nop,sack 1 {2764116:2766020}], length 0
18:43:51.144577 IP 198.96.84.204.15419 > 138.197.140.18.22: Flags [.], ack 2763952, win 512, options [nop,nop,sack 1 {2764116:2767824}], length 0
18:43:51.144608 IP 138.197.140.18.22 > 198.96.84.204.15419: Flags [P.], seq 2782112:2783156, ack 1585, win 313, length 1044
18:43:51.144625 IP 198.96.84.204.15419 > 138.197.140.18.22: Flags [.], ack 2763952, win 512, options [nop,nop,sack 1 {2764116:2768188}], length 0
18:43:51.144632 IP 198.96.84.204.15419 > 138.197.140.18.22: Flags [.], ack 2763952, win 512, options [nop,nop,sack 1 {2764116:2768352}], length 0
18:43:51.144667 IP 198.96.84.204.15419 > 138.197.140.18.22: Flags [.], ack 2763952, win 512, options [nop,nop,sack 1 {2764116:2768516}], length 0
18:43:51.144678 IP 198.96.84.204.15419 > 138.197.140.18.22: Flags [.], ack 2763952, win 512, options [nop,nop,sack 1 {2764116:2768680}], length 0
18:43:51.144685 IP 198.96.84.204.15419 > 138.197.140.18.22: Flags [.], ack 2763952, win 512, options [nop,nop,sack 1 {2764116:2768844}], length 0
18:43:51.144928 IP 138.197.140.18.22 > 198.96.84.204.15419: Flags [P.], seq 2783156:2784200, ack 1585, win 313, length 1044
