18:44:48.130724 IP lamp-s-1vcpu-1gb-tor1-01.ssh > 198.96.84.204.15419: Flags [P.], seq 922668:922840, ack 541, win 313, length 172
18:44:48.130888 IP lamp-s-1vcpu-1gb-tor1-01.ssh > 198.96.84.204.15419: Flags [P.], seq 922840:923012, ack 541, win 313, length 172
18:44:48.131071 IP 198.96.84.204.15419 > lamp-s-1vcpu-1gb-tor1-01.ssh: Flags [.], ack 919768, win 511, length 0
18:44:48.131094 IP lamp-s-1vcpu-1gb-tor1-01.ssh > 198.96.84.204.15419: Flags [P.], seq 923012:923184, ack 541, win 313, length 172
18:44:48.131304 IP lamp-s-1vcpu-1gb-tor1-01.ssh > 198.96.84.204.15419: Flags [P.], seq 923184:923468, ack 541, win 313, length 284
18:44:48.131472 IP lamp-s-1vcpu-1gb-tor1-01.ssh > 198.96.84.204.15419: Flags [P.], seq 923468:923640, ack 541, win 313, length 172
18:44:48.131636 IP lamp-s-1vcpu-1gb-tor1-01.ssh > 198.96.84.204.15419: Flags [P.], seq 923640:923812, ack 541, win 313, length 172
18:44:48.131798 IP lamp-s-1vcpu-1gb-tor1-01.ssh > 198.96.84.204.15419: Flags [P.], seq 923812:923984, ack 541, win 313, length 172
18:44:48.131960 IP lamp-s-1vcpu-1gb-tor1-01.ssh > 198.96.84.204.15419: Flags [P.], seq 923984:924156, ack 541, win 313, length 172
18:44:48.132668 IP 198.96.84.204.15419 > lamp-s-1vcpu-1gb-tor1-01.ssh: Flags [.], ack 920448, win 508, length 0
18:44:48.132710 IP lamp-s-1vcpu-1gb-tor1-01.ssh > 198.96.84.204.15419: Flags [P.], seq 924156:924328, ack 541, win 313, length 172
18:44:48.132738 IP 198.96.84.204.15419 > lamp-s-1vcpu-1gb-tor1-01.ssh: Flags [.], ack 920792, win 512, length 0
18:44:48.132753 IP 198.96.84.204.15419 > lamp-s-1vcpu-1gb-tor1-01.ssh: Flags [.], ack 921136, win 511, length 0
18:44:48.132763 IP 198.96.84.204.15419 > lamp-s-1vcpu-1gb-tor1-01.ssh: Flags [.], ack 922152, win 512, length 0
18:44:48.133057 IP lamp-s-1vcpu-1gb-tor1-01.ssh > 198.96.84.204.15419: Flags [P.], seq 924328:924948, ack 541, win 313, length 620
18:44:48.133240 IP lamp-s-1vcpu-1gb-tor1-01.ssh > 198.96.84.204.15419: Flags [P.], seq 924948:925120, ack 541, win 313, length 172
18:44:48.133417 IP lamp-s-1vcpu-1gb-tor1-01.ssh > 198.96.84.204.15419: Flags [P.], seq 925120:925292, ack 541, win 313, length 172
18:44:48.133590 IP lamp-s-1vcpu-1gb-tor1-01.ssh > 198.96.84.204.15419: Flags [P.], seq 925292:925464, ack 541, win 313, length 172
18:44:48.133753 IP lamp-s-1vcpu-1gb-tor1-01.ssh > 198.96.84.204.15419: Flags [P.], seq 925464:925636, ack 541, win 313, length 172
18:44:48.133914 IP lamp-s-1vcpu-1gb-tor1-01.ssh > 198.96.84.204.15419: Flags [P.], seq 925636:925808, ack 541, win 313, length 172
18:44:48.134065 IP 198.96.84.204.15419 > lamp-s-1vcpu-1gb-tor1-01.ssh: Flags [.], ack 922496, win 511, length 0
18:44:48.134090 IP 198.96.84.204.15419 > lamp-s-1vcpu-1gb-tor1-01.ssh: Flags [.], ack 922840, win 510, length 0
18:44:48.134100 IP 198.96.84.204.15419 > lamp-s-1vcpu-1gb-tor1-01.ssh: Flags [.], ack 923184, win 508, length 0
18:44:48.134110 IP 198.96.84.204.15419 > lamp-s-1vcpu-1gb-tor1-01.ssh: Flags [.], ack 923640, win 512, length 0
18:44:48.134121 IP 198.96.84.204.15419 > lamp-s-1vcpu-1gb-tor1-01.ssh: Flags [.], ack 923984, win 511, length 0
18:44:48.134361 IP lamp-s-1vcpu-1gb-tor1-01.ssh > 198.96.84.204.15419: Flags [P.], seq 925808:925980, ack 541, win 313, length 172
18:44:48.134444 IP lamp-s-1vcpu-1gb-tor1-01.ssh > 198.96.84.204.15419: Flags [P.], seq 925980:926584, ack 541, win 313, length 604
18:44:48.134647 IP lamp-s-1vcpu-1gb-tor1-01.ssh > 198.96.84.204.15419: Flags [P.], seq 926584:926884, ack 541, win 313, length 300
18:44:48.134811 IP lamp-s-1vcpu-1gb-tor1-01.ssh > 198.96.84.204.15419: Flags [P.], seq 926884:927056, ack 541, win 313, length 172
18:44:48.134972 IP lamp-s-1vcpu-1gb-tor1-01.ssh > 198.96.84.204.15419: Flags [P.], seq 927056:927228, ack 541, win 313, length 172
18:44:48.135169 IP lamp-s-1vcpu-1gb-tor1-01.ssh > 198.96.84.204.15419: Flags [P.], seq 927228:927400, ack 541, win 313, length 172
18:44:48.135335 IP lamp-s-1vcpu-1gb-tor1-01.ssh > 198.96.84.204.15419: Flags [P.], seq 927400:927572, ack 541, win 313, length 172
18:44:48.135499 IP lamp-s-1vcpu-1gb-tor1-01.ssh > 198.96.84.204.15419: Flags [P.], seq 927572:927744, ack 541, win 313, length 172
18:44:48.135662 IP lamp-s-1vcpu-1gb-tor1-01.ssh > 198.96.84.204.15419: Flags [P.], seq 927744:927916, ack 541, win 313, length 172
18:44:48.135729 IP 198.96.84.204.15419 > lamp-s-1vcpu-1gb-tor1-01.ssh: Flags [.], ack 924328, win 510, length 0
18:44:48.135923 IP lamp-s-1vcpu-1gb-tor1-01.ssh > 198.96.84.204.15419: Flags [P.], seq 927916:928200, ack 541, win 313, length 284
18:44:48.136195 IP lamp-s-1vcpu-1gb-tor1-01.ssh > 198.96.84.204.15419: Flags [P.], seq 928200:928372, ack 541, win 313, length 172
18:44:48.136366 IP lamp-s-1vcpu-1gb-tor1-01.ssh > 198.96.84.204.15419: Flags [P.], seq 928372:928544, ack 541, win 313, length 172
18:44:48.136532 IP lamp-s-1vcpu-1gb-tor1-01.ssh > 198.96.84.204.15419: Flags [P.], seq 928544:928716, ack 541, win 313, length 172
18:44:48.137263 IP 198.96.84.204.15419 > lamp-s-1vcpu-1gb-tor1-01.ssh: Flags [.], ack 925120, win 512, length 0
18:44:48.137314 IP lamp-s-1vcpu-1gb-tor1-01.ssh > 198.96.84.204.15419: Flags [P.], seq 928716:928888, ack 541, win 313, length 172
18:44:48.137346 IP 198.96.84.204.15419 > lamp-s-1vcpu-1gb-tor1-01.ssh: Flags [.], ack 925464, win 511, length 0
18:44:48.137362 IP 198.96.84.204.15419 > lamp-s-1vcpu-1gb-tor1-01.ssh: Flags [.], ack 925808, win 510, length 0
18:44:48.137607 IP lamp-s-1vcpu-1gb-tor1-01.ssh > 198.96.84.204.15419: Flags [P.], seq 928888:929396, ack 541, win 313, length 508
18:44:48.137745 IP lamp-s-1vcpu-1gb-tor1-01.ssh > 198.96.84.204.15419: Flags [P.], seq 929396:929568, ack 541, win 313, length 172
18:44:48.137907 IP lamp-s-1vcpu-1gb-tor1-01.ssh > 198.96.84.204.15419: Flags [P.], seq 929568:929740, ack 541, win 313, length 172
18:44:48.138079 IP lamp-s-1vcpu-1gb-tor1-01.ssh > 198.96.84.204.15419: Flags [P.], seq 929740:929912, ack 541, win 313, length 172
18:44:48.138245 IP lamp-s-1vcpu-1gb-tor1-01.ssh > 198.96.84.204.15419: Flags [P.], seq 929912:930084, ack 541, win 313, length 172
18:44:48.141138 IP 198.96.84.204.15419 > lamp-s-1vcpu-1gb-tor1-01.ssh: Flags [.], ack 926584, win 512, length 0
18:44:48.141189 IP lamp-s-1vcpu-1gb-tor1-01.ssh > 198.96.84.204.15419: Flags [P.], seq 930084:930256, ack 541, win 313, length 172
18:44:48.141222 IP 198.96.84.204.15419 > lamp-s-1vcpu-1gb-tor1-01.ssh: Flags [.], ack 927056, win 511, length 0
18:44:48.141236 IP 198.96.84.204.15419 > lamp-s-1vcpu-1gb-tor1-01.ssh: Flags [.], ack 927400, win 509, length 0
18:44:48.141244 IP 198.96.84.204.15419 > lamp-s-1vcpu-1gb-tor1-01.ssh: Flags [.], ack 927744, win 508, length 0
18:44:48.141251 IP 198.96.84.204.15419 > lamp-s-1vcpu-1gb-tor1-01.ssh: Flags [.], ack 928200, win 512, length 0
18:44:48.141259 IP 198.96.84.204.15419 > lamp-s-1vcpu-1gb-tor1-01.ssh: Flags [.], ack 928544, win 511, length 0
18:44:48.141440 IP 198.96.84.204.15419 > lamp-s-1vcpu-1gb-tor1-01.ssh: Flags [.], ack 929912, win 511, length 0
18:44:48.141615 IP lamp-s-1vcpu-1gb-tor1-01.ssh > 198.96.84.204.15419: Flags [P.], seq 930256:931220, ack 541, win 313, length 964
18:44:48.141751 IP lamp-s-1vcpu-1gb-tor1-01.ssh > 198.96.84.204.15419: Flags [P.], seq 931220:931392, ack 541, win 313, length 172
18:44:48.141880 IP lamp-s-1vcpu-1gb-tor1-01.ssh > 198.96.84.204.15419: Flags [P.], seq 931392:931564, ack 541, win 313, length 172
18:44:48.142009 IP lamp-s-1vcpu-1gb-tor1-01.ssh > 198.96.84.204.15419: Flags [P.], seq 931564:931736, ack 541, win 313, length 172
18:44:48.142172 IP lamp-s-1vcpu-1gb-tor1-01.ssh > 198.96.84.204.15419: Flags [P.], seq 931736:931908, ack 541, win 313, length 172
18:44:48.142295 IP lamp-s-1vcpu-1gb-tor1-01.ssh > 198.96.84.204.15419: Flags [P.], seq 931908:932080, ack 541, win 313, length 172
18:44:48.142380 IP lamp-s-1vcpu-1gb-tor1-01.ssh > 198.96.84.204.15419: Flags [P.], seq 932080:932252, ack 541, win 313, length 172
18:44:48.142471 IP lamp-s-1vcpu-1gb-tor1-01.ssh > 198.96.84.204.15419: Flags [P.], seq 932252:932424, ack 541, win 313, length 172
18:44:48.142555 IP lamp-s-1vcpu-1gb-tor1-01.ssh > 198.96.84.204.15419: Flags [P.], seq 932424:932596, ack 541, win 313, length 172
18:44:48.142639 IP lamp-s-1vcpu-1gb-tor1-01.ssh > 198.96.84.204.15419: Flags [P.], seq 932596:932768, ack 541, win 313, length 172
18:44:48.142723 IP lamp-s-1vcpu-1gb-tor1-01.ssh > 198.96.84.204.15419: Flags [P.], seq 932768:932940, ack 541, win 313, length 172
18:44:48.142812 IP lamp-s-1vcpu-1gb-tor1-01.ssh > 198.96.84.204.15419: Flags [P.], seq 932940:933112, ack 541, win 313, length 172
18:44:48.142930 IP lamp-s-1vcpu-1gb-tor1-01.ssh > 198.96.84.204.15419: Flags [P.], seq 933112:933284, ack 541, win 313, length 172
18:44:48.143037 IP lamp-s-1vcpu-1gb-tor1-01.ssh > 198.96.84.204.15419: Flags [P.], seq 933284:933456, ack 541, win 313, length 172
18:44:48.143142 IP lamp-s-1vcpu-1gb-tor1-01.ssh > 198.96.84.204.15419: Flags [P.], seq 933456:933628, ack 541, win 313, length 172
18:44:48.143246 IP lamp-s-1vcpu-1gb-tor1-01.ssh > 198.96.84.204.15419: Flags [P.], seq 933628:933800, ack 541, win 313, length 172
18:44:48.143349 IP lamp-s-1vcpu-1gb-tor1-01.ssh > 198.96.84.204.15419: Flags [P.], seq 933800:933972, ack 541, win 313, length 172
18:44:48.144205 IP 198.96.84.204.15419 > lamp-s-1vcpu-1gb-tor1-01.ssh: Flags [.], ack 930256, win 510, length 0
18:44:48.144236 IP lamp-s-1vcpu-1gb-tor1-01.ssh > 198.96.84.204.15419: Flags [P.], seq 933972:934144, ack 541, win 313, length 172
18:44:48.144255 IP 198.96.84.204.15419 > lamp-s-1vcpu-1gb-tor1-01.ssh: Flags [.], ack 931392, win 512, length 0
18:44:48.144427 IP lamp-s-1vcpu-1gb-tor1-01.ssh > 198.96.84.204.15419: Flags [P.], seq 934144:934540, ack 541, win 313, length 396
18:44:48.144540 IP lamp-s-1vcpu-1gb-tor1-01.ssh > 198.96.84.204.15419: Flags [P.], seq 934540:934712, ack 541, win 313, length 172
18:44:48.144650 IP lamp-s-1vcpu-1gb-tor1-01.ssh > 198.96.84.204.15419: Flags [P.], seq 934712:934884, ack 541, win 313, length 172
18:44:48.145635 IP 198.96.84.204.15419 > lamp-s-1vcpu-1gb-tor1-01.ssh: Flags [.], ack 931736, win 511, length 0
18:44:48.145667 IP lamp-s-1vcpu-1gb-tor1-01.ssh > 198.96.84.204.15419: Flags [P.], seq 934884:935056, ack 541, win 313, length 172
18:44:48.145839 IP lamp-s-1vcpu-1gb-tor1-01.ssh > 198.96.84.204.15419: Flags [P.], seq 935056:935340, ack 541, win 313, length 284
18:44:48.147008 IP 198.96.84.204.15419 > lamp-s-1vcpu-1gb-tor1-01.ssh: Flags [.], ack 932080, win 510, length 0
18:44:48.147049 IP lamp-s-1vcpu-1gb-tor1-01.ssh > 198.96.84.204.15419: Flags [P.], seq 935340:935512, ack 541, win 313, length 172
18:44:48.147072 IP 198.96.84.204.15419 > lamp-s-1vcpu-1gb-tor1-01.ssh: Flags [.], ack 932424, win 508, length 0
18:44:48.147081 IP 198.96.84.204.15419 > lamp-s-1vcpu-1gb-tor1-01.ssh: Flags [.], ack 932768, win 512, length 0
18:44:48.147087 IP 198.96.84.204.15419 > lamp-s-1vcpu-1gb-tor1-01.ssh: Flags [.], ack 933112, win 511, length 0
18:44:48.147094 IP 198.96.84.204.15419 > lamp-s-1vcpu-1gb-tor1-01.ssh: Flags [.], ack 933456, win 510, length 0
18:44:48.147100 IP 198.96.84.204.15419 > lamp-s-1vcpu-1gb-tor1-01.ssh: Flags [.], ack 933800, win 508, length 0
18:44:48.147357 IP lamp-s-1vcpu-1gb-tor1-01.ssh > 198.96.84.204.15419: Flags [P.], seq 935512:936356, ack 541, win 313, length 844
18:44:48.147489 IP lamp-s-1vcpu-1gb-tor1-01.ssh > 198.96.84.204.15419: Flags [P.], seq 936356:936528, ack 541, win 313, length 172
18:44:48.147602 IP lamp-s-1vcpu-1gb-tor1-01.ssh > 198.96.84.204.15419: Flags [P.], seq 936528:936700, ack 541, win 313, length 172
18:44:48.147713 IP lamp-s-1vcpu-1gb-tor1-01.ssh > 198.96.84.204.15419: Flags [P.], seq 936700:936872, ack 541, win 313, length 172
18:44:48.147819 IP lamp-s-1vcpu-1gb-tor1-01.ssh > 198.96.84.204.15419: Flags [P.], seq 936872:937044, ack 541, win 313, length 172
18:44:48.147929 IP lamp-s-1vcpu-1gb-tor1-01.ssh > 198.96.84.204.15419: Flags [P.], seq 937044:937216, ack 541, win 313, length 172
18:44:48.148101 IP lamp-s-1vcpu-1gb-tor1-01.ssh > 198.96.84.204.15419: Flags [P.], seq 937216:937388, ack 541, win 313, length 172
18:44:48.148222 IP lamp-s-1vcpu-1gb-tor1-01.ssh > 198.96.84.204.15419: Flags [P.], seq 937388:937560, ack 541, win 313, length 172
18:44:48.148328 IP lamp-s-1vcpu-1gb-tor1-01.ssh > 198.96.84.204.15419: Flags [P.], seq 937560:937732, ack 541, win 313, length 172
18:44:48.148438 IP lamp-s-1vcpu-1gb-tor1-01.ssh > 198.96.84.204.15419: Flags [P.], seq 937732:937904, ack 541, win 313, length 172
18:44:48.148544 IP lamp-s-1vcpu-1gb-tor1-01.ssh > 198.96.84.204.15419: Flags [P.], seq 937904:938076, ack 541, win 313, length 172
18:44:48.148665 IP lamp-s-1vcpu-1gb-tor1-01.ssh > 198.96.84.204.15419: Flags [P.], seq 938076:938248, ack 541, win 313, length 172
18:44:48.148775 IP lamp-s-1vcpu-1gb-tor1-01.ssh > 198.96.84.204.15419: Flags [P.], seq 938248:938420, ack 541, win 313, length 172
18:44:48.148860 IP 198.96.84.204.15419 > lamp-s-1vcpu-1gb-tor1-01.ssh: Flags [.], ack 935056, win 509, length 0
18:44:48.149024 IP lamp-s-1vcpu-1gb-tor1-01.ssh > 198.96.84.204.15419: Flags [P.], seq 938420:938704, ack 541, win 313, length 284
18:44:48.149210 IP lamp-s-1vcpu-1gb-tor1-01.ssh > 198.96.84.204.15419: Flags [P.], seq 938704:938876, ack 541, win 313, length 172
18:44:48.149326 IP lamp-s-1vcpu-1gb-tor1-01.ssh > 198.96.84.204.15419: Flags [P.], seq 938876:939048, ack 541, win 313, length 172
18:44:48.149439 IP lamp-s-1vcpu-1gb-tor1-01.ssh > 198.96.84.204.15419: Flags [P.], seq 939048:939220, ack 541, win 313, length 172
18:44:48.151669 IP 198.96.84.204.15419 > lamp-s-1vcpu-1gb-tor1-01.ssh: Flags [.], ack 935512, win 512, length 0
18:44:48.151707 IP lamp-s-1vcpu-1gb-tor1-01.ssh > 198.96.84.204.15419: Flags [P.], seq 939220:939392, ack 541, win 313, length 172
18:44:48.151730 IP 198.96.84.204.15419 > lamp-s-1vcpu-1gb-tor1-01.ssh: Flags [.], ack 936528, win 508, length 0
18:44:48.151739 IP 198.96.84.204.15419 > lamp-s-1vcpu-1gb-tor1-01.ssh: Flags [.], ack 936872, win 512, length 0
18:44:48.151746 IP 198.96.84.204.15419 > lamp-s-1vcpu-1gb-tor1-01.ssh: Flags [.], ack 937216, win 511, length 0
18:44:48.151979 IP lamp-s-1vcpu-1gb-tor1-01.ssh > 198.96.84.204.15419: Flags [P.], seq 939392:940012, ack 541, win 313, length 620
18:44:48.152219 IP lamp-s-1vcpu-1gb-tor1-01.ssh > 198.96.84.204.15419: Flags [P.], seq 940012:940184, ack 541, win 313, length 172
18:44:48.152353 IP lamp-s-1vcpu-1gb-tor1-01.ssh > 198.96.84.204.15419: Flags [P.], seq 940184:940356, ack 541, win 313, length 172
18:44:48.152462 IP lamp-s-1vcpu-1gb-tor1-01.ssh > 198.96.84.204.15419: Flags [P.], seq 940356:940528, ack 541, win 313, length 172
18:44:48.152574 IP lamp-s-1vcpu-1gb-tor1-01.ssh > 198.96.84.204.15419: Flags [P.], seq 940528:940700, ack 541, win 313, length 172
18:44:48.152717 IP lamp-s-1vcpu-1gb-tor1-01.ssh > 198.96.84.204.15419: Flags [P.], seq 940700:940872, ack 541, win 313, length 172
18:44:48.152832 IP lamp-s-1vcpu-1gb-tor1-01.ssh > 198.96.84.204.15419: Flags [P.], seq 940872:941044, ack 541, win 313, length 172
18:44:48.152993 IP 198.96.84.204.15419 > lamp-s-1vcpu-1gb-tor1-01.ssh: Flags [.], ack 937560, win 510, length 0
18:44:48.153021 IP lamp-s-1vcpu-1gb-tor1-01.ssh > 198.96.84.204.15419: Flags [P.], seq 941044:941216, ack 541, win 313, length 172
18:44:48.153044 IP 198.96.84.204.15419 > lamp-s-1vcpu-1gb-tor1-01.ssh: Flags [.], ack 937904, win 508, length 0
18:44:48.153052 IP 198.96.84.204.15419 > lamp-s-1vcpu-1gb-tor1-01.ssh: Flags [.], ack 938248, win 512, length 0
18:44:48.153059 IP 198.96.84.204.15419 > lamp-s-1vcpu-1gb-tor1-01.ssh: Flags [.], ack 938704, win 511, length 0
18:44:48.153065 IP 198.96.84.204.15419 > lamp-s-1vcpu-1gb-tor1-01.ssh: Flags [.], ack 939048, win 509, length 0
18:44:48.153291 IP lamp-s-1vcpu-1gb-tor1-01.ssh > 198.96.84.204.15419: Flags [P.], seq 941216:941948, ack 541, win 313, length 732
18:44:48.153411 IP lamp-s-1vcpu-1gb-tor1-01.ssh > 198.96.84.204.15419: Flags [P.], seq 941948:942120, ack 541, win 313, length 172
18:44:48.153542 IP lamp-s-1vcpu-1gb-tor1-01.ssh > 198.96.84.204.15419: Flags [P.], seq 942120:942292, ack 541, win 313, length 172
18:44:48.153652 IP lamp-s-1vcpu-1gb-tor1-01.ssh > 198.96.84.204.15419: Flags [P.], seq 942292:942464, ack 541, win 313, length 172
18:44:48.153758 IP lamp-s-1vcpu-1gb-tor1-01.ssh > 198.96.84.204.15419: Flags [P.], seq 942464:942636, ack 541, win 313, length 172
18:44:48.153862 IP lamp-s-1vcpu-1gb-tor1-01.ssh > 198.96.84.204.15419: Flags [P.], seq 942636:942808, ack 541, win 313, length 172
18:44:48.153967 IP lamp-s-1vcpu-1gb-tor1-01.ssh > 198.96.84.204.15419: Flags [P.], seq 942808:942980, ack 541, win 313, length 172
18:44:48.154088 IP lamp-s-1vcpu-1gb-tor1-01.ssh > 198.96.84.204.15419: Flags [P.], seq 942980:943152, ack 541, win 313, length 172
18:44:48.154223 IP lamp-s-1vcpu-1gb-tor1-01.ssh > 198.96.84.204.15419: Flags [P.], seq 943152:943324, ack 541, win 313, length 172
18:44:48.154355 IP lamp-s-1vcpu-1gb-tor1-01.ssh > 198.96.84.204.15419: Flags [P.], seq 943324:943496, ack 541, win 313, length 172
18:44:48.154551 IP lamp-s-1vcpu-1gb-tor1-01.ssh > 198.96.84.204.15419: Flags [P.], seq 943496:943668, ack 541, win 313, length 172
18:44:48.154698 IP lamp-s-1vcpu-1gb-tor1-01.ssh > 198.96.84.204.15419: Flags [P.], seq 943668:943840, ack 541, win 313, length 172
18:44:48.154784 IP 198.96.84.204.15419 > lamp-s-1vcpu-1gb-tor1-01.ssh: Flags [.], ack 939392, win 508, length 0
18:44:48.154897 IP lamp-s-1vcpu-1gb-tor1-01.ssh > 198.96.84.204.15419: Flags [P.], seq 943840:944124, ack 541, win 313, length 284
18:44:48.155010 IP lamp-s-1vcpu-1gb-tor1-01.ssh > 198.96.84.204.15419: Flags [P.], seq 944124:944296, ack 541, win 313, length 172
18:44:48.155115 IP lamp-s-1vcpu-1gb-tor1-01.ssh > 198.96.84.204.15419: Flags [P.], seq 944296:944468, ack 541, win 313, length 172
18:44:48.157444 IP 198.96.84.204.15419 > lamp-s-1vcpu-1gb-tor1-01.ssh: Flags [.], ack 940184, win 512, length 0
18:44:48.157483 IP lamp-s-1vcpu-1gb-tor1-01.ssh > 198.96.84.204.15419: Flags [P.], seq 944468:944640, ack 541, win 313, length 172
18:44:48.157507 IP 198.96.84.204.15419 > lamp-s-1vcpu-1gb-tor1-01.ssh: Flags [.], ack 940528, win 511, length 0
18:44:48.157517 IP 198.96.84.204.15419 > lamp-s-1vcpu-1gb-tor1-01.ssh: Flags [.], ack 940872, win 510, length 0
18:44:48.157523 IP 198.96.84.204.15419 > lamp-s-1vcpu-1gb-tor1-01.ssh: Flags [.], ack 941216, win 508, length 0
18:44:48.157530 IP 198.96.84.204.15419 > lamp-s-1vcpu-1gb-tor1-01.ssh: Flags [.], ack 942120, win 512, length 0
18:44:48.157536 IP 198.96.84.204.15419 > lamp-s-1vcpu-1gb-tor1-01.ssh: Flags [.], ack 942464, win 511, length 0
18:44:48.157803 IP lamp-s-1vcpu-1gb-tor1-01.ssh > 198.96.84.204.15419: Flags [P.], seq 944640:945484, ack 541, win 313, length 844
18:44:48.157927 IP lamp-s-1vcpu-1gb-tor1-01.ssh > 198.96.84.204.15419: Flags [P.], seq 945484:945656, ack 541, win 313, length 172
18:44:48.158040 IP lamp-s-1vcpu-1gb-tor1-01.ssh > 198.96.84.204.15419: Flags [P.], seq 945656:945828, ack 541, win 313, length 172
18:44:48.158144 IP lamp-s-1vcpu-1gb-tor1-01.ssh > 198.96.84.204.15419: Flags [P.], seq 945828:946000, ack 541, win 313, length 172
18:44:48.158247 IP lamp-s-1vcpu-1gb-tor1-01.ssh > 198.96.84.204.15419: Flags [P.], seq 946000:946172, ack 541, win 313, length 172
18:44:48.158350 IP lamp-s-1vcpu-1gb-tor1-01.ssh > 198.96.84.204.15419: Flags [P.], seq 946172:946344, ack 541, win 313, length 172
18:44:48.158454 IP lamp-s-1vcpu-1gb-tor1-01.ssh > 198.96.84.204.15419: Flags [P.], seq 946344:946516, ack 541, win 313, length 172
18:44:48.158556 IP lamp-s-1vcpu-1gb-tor1-01.ssh > 198.96.84.204.15419: Flags [P.], seq 946516:946688, ack 541, win 313, length 172
18:44:48.158664 IP lamp-s-1vcpu-1gb-tor1-01.ssh > 198.96.84.204.15419: Flags [P.], seq 946688:946860, ack 541, win 313, length 172
18:44:48.158768 IP 198.96.84.204.15419 > lamp-s-1vcpu-1gb-tor1-01.ssh: Flags [.], ack 942808, win 510, length 0
18:44:48.158787 IP 198.96.84.204.15419 > lamp-s-1vcpu-1gb-tor1-01.ssh: Flags [.], ack 943152, win 508, length 0
18:44:48.158794 IP 198.96.84.204.15419 > lamp-s-1vcpu-1gb-tor1-01.ssh: Flags [.], ack 943496, win 512, length 0
18:44:48.158801 IP 198.96.84.204.15419 > lamp-s-1vcpu-1gb-tor1-01.ssh: Flags [.], ack 943840, win 511, length 0
18:44:48.158807 IP 198.96.84.204.15419 > lamp-s-1vcpu-1gb-tor1-01.ssh: Flags [.], ack 944296, win 509, length 0
18:44:48.158954 IP lamp-s-1vcpu-1gb-tor1-01.ssh > 198.96.84.204.15419: Flags [P.], seq 946860:947032, ack 541, win 313, length 172
18:44:48.159063 IP lamp-s-1vcpu-1gb-tor1-01.ssh > 198.96.84.204.15419: Flags [P.], seq 947032:947636, ack 541, win 313, length 604
18:44:48.159160 IP lamp-s-1vcpu-1gb-tor1-01.ssh > 198.96.84.204.15419: Flags [P.], seq 947636:947808, ack 541, win 313, length 172
18:44:48.159255 IP lamp-s-1vcpu-1gb-tor1-01.ssh > 198.96.84.204.15419: Flags [P.], seq 947808:947980, ack 541, win 313, length 172
18:44:48.159348 IP lamp-s-1vcpu-1gb-tor1-01.ssh > 198.96.84.204.15419: Flags [P.], seq 947980:948152, ack 541, win 313, length 172
18:44:48.159391 IP lamp-s-1vcpu-1gb-tor1-01.ssh > 198.96.84.204.15419: Flags [P.], seq 948152:948324, ack 541, win 313, length 172
18:44:48.159586 IP lamp-s-1vcpu-1gb-tor1-01.ssh > 198.96.84.204.15419: Flags [P.], seq 948324:948624, ack 541, win 313, length 300
18:44:48.159713 IP lamp-s-1vcpu-1gb-tor1-01.ssh > 198.96.84.204.15419: Flags [P.], seq 948624:948796, ack 541, win 313, length 172
18:44:48.159824 IP lamp-s-1vcpu-1gb-tor1-01.ssh > 198.96.84.204.15419: Flags [P.], seq 948796:948968, ack 541, win 313, length 172
18:44:48.159931 IP lamp-s-1vcpu-1gb-tor1-01.ssh > 198.96.84.204.15419: Flags [P.], seq 948968:949140, ack 541, win 313, length 172
18:44:48.160096 IP lamp-s-1vcpu-1gb-tor1-01.ssh > 198.96.84.204.15419: Flags [P.], seq 949140:949312, ack 541, win 313, length 172
18:44:48.160209 IP lamp-s-1vcpu-1gb-tor1-01.ssh > 198.96.84.204.15419: Flags [P.], seq 949312:949484, ack 541, win 313, length 172
18:44:48.160651 IP 198.96.84.204.15419 > lamp-s-1vcpu-1gb-tor1-01.ssh: Flags [.], ack 944640, win 508, length 0
18:44:48.160682 IP lamp-s-1vcpu-1gb-tor1-01.ssh > 198.96.84.204.15419: Flags [P.], seq 949484:949656, ack 541, win 313, length 172
18:44:48.160842 IP lamp-s-1vcpu-1gb-tor1-01.ssh > 198.96.84.204.15419: Flags [P.], seq 949656:949940, ack 541, win 313, length 284
18:44:48.163899 IP 198.96.84.204.15419 > lamp-s-1vcpu-1gb-tor1-01.ssh: Flags [.], ack 945656, win 512, length 0
18:44:48.163940 IP lamp-s-1vcpu-1gb-tor1-01.ssh > 198.96.84.204.15419: Flags [P.], seq 949940:950112, ack 541, win 313, length 172
18:44:48.163965 IP 198.96.84.204.15419 > lamp-s-1vcpu-1gb-tor1-01.ssh: Flags [.], ack 946000, win 511, length 0
18:44:48.163974 IP 198.96.84.204.15419 > lamp-s-1vcpu-1gb-tor1-01.ssh: Flags [.], ack 946344, win 510, length 0
18:44:48.163981 IP 198.96.84.204.15419 > lamp-s-1vcpu-1gb-tor1-01.ssh: Flags [.], ack 946688, win 508, length 0
18:44:48.163987 IP 198.96.84.204.15419 > lamp-s-1vcpu-1gb-tor1-01.ssh: Flags [.], ack 947032, win 512, length 0
18:44:48.163993 IP 198.96.84.204.15419 > lamp-s-1vcpu-1gb-tor1-01.ssh: Flags [.], ack 947808, win 509, length 0
18:44:48.164351 IP lamp-s-1vcpu-1gb-tor1-01.ssh > 198.96.84.204.15419: Flags [P.], seq 950112:950956, ack 541, win 313, length 844
18:44:48.164478 IP lamp-s-1vcpu-1gb-tor1-01.ssh > 198.96.84.204.15419: Flags [P.], seq 950956:951128, ack 541, win 313, length 172
18:44:48.164587 IP lamp-s-1vcpu-1gb-tor1-01.ssh > 198.96.84.204.15419: Flags [P.], seq 951128:951300, ack 541, win 313, length 172
18:44:48.164691 IP lamp-s-1vcpu-1gb-tor1-01.ssh > 198.96.84.204.15419: Flags [P.], seq 951300:951472, ack 541, win 313, length 172
18:44:48.164832 IP lamp-s-1vcpu-1gb-tor1-01.ssh > 198.96.84.204.15419: Flags [P.], seq 951472:951644, ack 541, win 313, length 172
18:44:48.164950 IP lamp-s-1vcpu-1gb-tor1-01.ssh > 198.96.84.204.15419: Flags [P.], seq 951644:951816, ack 541, win 313, length 172
18:44:48.165057 IP lamp-s-1vcpu-1gb-tor1-01.ssh > 198.96.84.204.15419: Flags [P.], seq 951816:951988, ack 541, win 313, length 172
18:44:48.165167 IP 198.96.84.204.15419 > lamp-s-1vcpu-1gb-tor1-01.ssh: Flags [P.], seq 541:577, ack 949940, win 512, length 36
18:44:48.165254 IP lamp-s-1vcpu-1gb-tor1-01.ssh > 198.96.84.204.15419: Flags [P.], seq 951988:952160, ack 577, win 313, length 172
18:44:48.165381 IP lamp-s-1vcpu-1gb-tor1-01.ssh > 198.96.84.204.15419: Flags [P.], seq 952160:952460, ack 577, win 313, length 300
18:44:48.165487 IP lamp-s-1vcpu-1gb-tor1-01.ssh > 198.96.84.204.15419: Flags [P.], seq 952460:952632, ack 577, win 313, length 172
18:44:48.165611 IP lamp-s-1vcpu-1gb-tor1-01.ssh > 198.96.84.204.15419: Flags [P.], seq 952632:952804, ack 577, win 313, length 172
18:44:48.165777 IP lamp-s-1vcpu-1gb-tor1-01.ssh > 198.96.84.204.15419: Flags [P.], seq 952804:952976, ack 577, win 313, length 172
18:44:48.165949 IP lamp-s-1vcpu-1gb-tor1-01.ssh > 198.96.84.204.15419: Flags [P.], seq 952976:953148, ack 577, win 313, length 172
18:44:48.166076 IP lamp-s-1vcpu-1gb-tor1-01.ssh > 198.96.84.204.15419: Flags [P.], seq 953148:953320, ack 577, win 313, length 172
18:44:48.166187 IP lamp-s-1vcpu-1gb-tor1-01.ssh > 198.96.84.204.15419: Flags [P.], seq 953320:953492, ack 577, win 313, length 172
18:44:48.166291 IP lamp-s-1vcpu-1gb-tor1-01.ssh > 198.96.84.204.15419: Flags [P.], seq 953492:953664, ack 577, win 313, length 172
18:44:48.166395 IP lamp-s-1vcpu-1gb-tor1-01.ssh > 198.96.84.204.15419: Flags [P.], seq 953664:953836, ack 577, win 313, length 172
18:44:48.166497 IP lamp-s-1vcpu-1gb-tor1-01.ssh > 198.96.84.204.15419: Flags [P.], seq 953836:954008, ack 577, win 313, length 172
18:44:48.166599 IP lamp-s-1vcpu-1gb-tor1-01.ssh > 198.96.84.204.15419: Flags [P.], seq 954008:954180, ack 577, win 313, length 172
18:44:48.166710 IP lamp-s-1vcpu-1gb-tor1-01.ssh > 198.96.84.204.15419: Flags [P.], seq 954180:954352, ack 577, win 313, length 172
18:44:48.166870 IP lamp-s-1vcpu-1gb-tor1-01.ssh > 198.96.84.204.15419: Flags [P.], seq 954352:954524, ack 577, win 313, length 172
18:44:48.166991 IP lamp-s-1vcpu-1gb-tor1-01.ssh > 198.96.84.204.15419: Flags [P.], seq 954524:954696, ack 577, win 313, length 172
18:44:48.171329 IP 198.96.84.204.15419 > lamp-s-1vcpu-1gb-tor1-01.ssh: Flags [.], ack 950956, win 508, length 0
18:44:48.171383 IP lamp-s-1vcpu-1gb-tor1-01.ssh > 198.96.84.204.15419: Flags [P.], seq 954696:954868, ack 577, win 313, length 172
18:44:48.171407 IP 198.96.84.204.15419 > lamp-s-1vcpu-1gb-tor1-01.ssh: Flags [.], ack 951300, win 512, length 0
18:44:48.171417 IP 198.96.84.204.15419 > lamp-s-1vcpu-1gb-tor1-01.ssh: Flags [.], ack 951644, win 511, length 0
18:44:48.171424 IP 198.96.84.204.15419 > lamp-s-1vcpu-1gb-tor1-01.ssh: Flags [.], ack 951988, win 510, length 0
18:44:48.171430 IP 198.96.84.204.15419 > lamp-s-1vcpu-1gb-tor1-01.ssh: Flags [.], ack 952460, win 508, length 0
18:44:48.171437 IP 198.96.84.204.15419 > lamp-s-1vcpu-1gb-tor1-01.ssh: Flags [.], ack 952804, win 512, length 0
18:44:48.171781 IP lamp-s-1vcpu-1gb-tor1-01.ssh > 198.96.84.204.15419: Flags [P.], seq 954868:955712, ack 577, win 313, length 844
18:44:48.171927 IP lamp-s-1vcpu-1gb-tor1-01.ssh > 198.96.84.204.15419: Flags [P.], seq 955712:955884, ack 577, win 313, length 172
18:44:48.172109 IP lamp-s-1vcpu-1gb-tor1-01.ssh > 198.96.84.204.15419: Flags [P.], seq 955884:956056, ack 577, win 313, length 172
18:44:48.172221 IP lamp-s-1vcpu-1gb-tor1-01.ssh > 198.96.84.204.15419: Flags [P.], seq 956056:956228, ack 577, win 313, length 172
18:44:48.172327 IP lamp-s-1vcpu-1gb-tor1-01.ssh > 198.96.84.204.15419: Flags [P.], seq 956228:956400, ack 577, win 313, length 172
18:44:48.172431 IP lamp-s-1vcpu-1gb-tor1-01.ssh > 198.96.84.204.15419: Flags [P.], seq 956400:956572, ack 577, win 313, length 172
18:44:48.172535 IP lamp-s-1vcpu-1gb-tor1-01.ssh > 198.96.84.204.15419: Flags [P.], seq 956572:956744, ack 577, win 313, length 172
18:44:48.172856 IP lamp-s-1vcpu-1gb-tor1-01.ssh > 198.96.84.204.15419: Flags [P.], seq 956744:956916, ack 577, win 313, length 172
18:44:48.172993 IP lamp-s-1vcpu-1gb-tor1-01.ssh > 198.96.84.204.15419: Flags [P.], seq 956916:957088, ack 577, win 313, length 172
18:44:48.173099 IP lamp-s-1vcpu-1gb-tor1-01.ssh > 198.96.84.204.15419: Flags [P.], seq 957088:957260, ack 577, win 313, length 172
18:44:48.173204 IP lamp-s-1vcpu-1gb-tor1-01.ssh > 198.96.84.204.15419: Flags [P.], seq 957260:957432, ack 577, win 313, length 172
18:44:48.173307 IP lamp-s-1vcpu-1gb-tor1-01.ssh > 198.96.84.204.15419: Flags [P.], seq 957432:957604, ack 577, win 313, length 172
18:44:48.173426 IP lamp-s-1vcpu-1gb-tor1-01.ssh > 198.96.84.204.15419: Flags [P.], seq 957604:957776, ack 577, win 313, length 172
18:44:48.173531 IP lamp-s-1vcpu-1gb-tor1-01.ssh > 198.96.84.204.15419: Flags [P.], seq 957776:957948, ack 577, win 313, length 172
18:44:48.173649 IP lamp-s-1vcpu-1gb-tor1-01.ssh > 198.96.84.204.15419: Flags [P.], seq 957948:958120, ack 577, win 313, length 172
18:44:48.173813 IP lamp-s-1vcpu-1gb-tor1-01.ssh > 198.96.84.204.15419: Flags [P.], seq 958120:958292, ack 577, win 313, length 172
18:44:48.173934 IP lamp-s-1vcpu-1gb-tor1-01.ssh > 198.96.84.204.15419: Flags [P.], seq 958292:958464, ack 577, win 313, length 172
18:44:48.174039 IP lamp-s-1vcpu-1gb-tor1-01.ssh > 198.96.84.204.15419: Flags [P.], seq 958464:958636, ack 577, win 313, length 172
18:44:48.174143 IP lamp-s-1vcpu-1gb-tor1-01.ssh > 198.96.84.204.15419: Flags [P.], seq 958636:958808, ack 577, win 313, length 172
18:44:48.174264 IP lamp-s-1vcpu-1gb-tor1-01.ssh > 198.96.84.204.15419: Flags [P.], seq 958808:958980, ack 577, win 313, length 172
18:44:48.174390 IP lamp-s-1vcpu-1gb-tor1-01.ssh > 198.96.84.204.15419: Flags [P.], seq 958980:959152, ack 577, win 313, length 172
18:44:48.175228 IP 198.96.84.204.15419 > lamp-s-1vcpu-1gb-tor1-01.ssh: Flags [.], ack 954868, win 510, length 0
18:44:48.175263 IP lamp-s-1vcpu-1gb-tor1-01.ssh > 198.96.84.204.15419: Flags [P.], seq 959152:959324, ack 577, win 313, length 172
18:44:48.175287 IP 198.96.84.204.15419 > lamp-s-1vcpu-1gb-tor1-01.ssh: Flags [.], ack 955884, win 512, length 0
18:44:48.175300 IP 198.96.84.204.15419 > lamp-s-1vcpu-1gb-tor1-01.ssh: Flags [.], ack 956228, win 511, length 0
18:44:48.175309 IP 198.96.84.204.15419 > lamp-s-1vcpu-1gb-tor1-01.ssh: Flags [.], ack 956572, win 510, length 0
18:44:48.175528 IP lamp-s-1vcpu-1gb-tor1-01.ssh > 198.96.84.204.15419: Flags [P.], seq 959324:959944, ack 577, win 313, length 620
18:44:48.175667 IP lamp-s-1vcpu-1gb-tor1-01.ssh > 198.96.84.204.15419: Flags [P.], seq 959944:960116, ack 577, win 313, length 172
18:44:48.175839 IP lamp-s-1vcpu-1gb-tor1-01.ssh > 198.96.84.204.15419: Flags [P.], seq 960116:960288, ack 577, win 313, length 172
18:44:48.175970 IP lamp-s-1vcpu-1gb-tor1-01.ssh > 198.96.84.204.15419: Flags [P.], seq 960288:960460, ack 577, win 313, length 172
18:44:48.176193 IP lamp-s-1vcpu-1gb-tor1-01.ssh > 198.96.84.204.15419: Flags [P.], seq 960460:960632, ack 577, win 313, length 172
18:44:48.176323 IP lamp-s-1vcpu-1gb-tor1-01.ssh > 198.96.84.204.15419: Flags [P.], seq 960632:960804, ack 577, win 313, length 172
18:44:48.176480 IP lamp-s-1vcpu-1gb-tor1-01.ssh > 198.96.84.204.15419: Flags [P.], seq 960804:960976, ack 577, win 313, length 172
18:44:48.177978 IP 198.96.84.204.15419 > lamp-s-1vcpu-1gb-tor1-01.ssh: Flags [.], ack 956916, win 508, length 0
18:44:48.178024 IP lamp-s-1vcpu-1gb-tor1-01.ssh > 198.96.84.204.15419: Flags [P.], seq 960976:961148, ack 577, win 313, length 172
18:44:48.178045 IP 198.96.84.204.15419 > lamp-s-1vcpu-1gb-tor1-01.ssh: Flags [.], ack 957260, win 512, length 0
18:44:48.178277 IP 198.96.84.204.15419 > lamp-s-1vcpu-1gb-tor1-01.ssh: Flags [.], ack 957604, win 511, length 0
18:44:48.178292 IP 198.96.84.204.15419 > lamp-s-1vcpu-1gb-tor1-01.ssh: Flags [.], ack 957948, win 510, length 0
18:44:48.178297 IP 198.96.84.204.15419 > lamp-s-1vcpu-1gb-tor1-01.ssh: Flags [.], ack 958292, win 508, length 0
18:44:48.178301 IP 198.96.84.204.15419 > lamp-s-1vcpu-1gb-tor1-01.ssh: Flags [.], ack 958636, win 512, length 0
18:44:48.178305 IP 198.96.84.204.15419 > lamp-s-1vcpu-1gb-tor1-01.ssh: Flags [.], ack 958980, win 511, length 0
18:44:48.178309 IP 198.96.84.204.15419 > lamp-s-1vcpu-1gb-tor1-01.ssh: Flags [.], ack 959324, win 510, length 0
18:44:48.178313 IP 198.96.84.204.15419 > lamp-s-1vcpu-1gb-tor1-01.ssh: Flags [.], ack 960116, win 512, length 0
18:44:48.178612 IP lamp-s-1vcpu-1gb-tor1-01.ssh > 198.96.84.204.15419: Flags [P.], seq 961544:962372, ack 577, win 313, length 828
18:44:48.178755 IP lamp-s-1vcpu-1gb-tor1-01.ssh > 198.96.84.204.15419: Flags [P.], seq 962372:962544, ack 577, win 313, length 172
18:44:48.178886 IP lamp-s-1vcpu-1gb-tor1-01.ssh > 198.96.84.204.15419: Flags [P.], seq 962544:962716, ack 577, win 313, length 172
18:44:48.179015 IP lamp-s-1vcpu-1gb-tor1-01.ssh > 198.96.84.204.15419: Flags [P.], seq 962716:962888, ack 577, win 313, length 172
18:44:48.179144 IP lamp-s-1vcpu-1gb-tor1-01.ssh > 198.96.84.204.15419: Flags [P.], seq 962888:963060, ack 577, win 313, length 172
18:44:48.179274 IP lamp-s-1vcpu-1gb-tor1-01.ssh > 198.96.84.204.15419: Flags [P.], seq 963060:963232, ack 577, win 313, length 172
18:44:48.179416 IP lamp-s-1vcpu-1gb-tor1-01.ssh > 198.96.84.204.15419: Flags [P.], seq 963232:963404, ack 577, win 313, length 172
18:44:48.179558 IP lamp-s-1vcpu-1gb-tor1-01.ssh > 198.96.84.204.15419: Flags [P.], seq 963404:963576, ack 577, win 313, length 172
18:44:48.179690 IP lamp-s-1vcpu-1gb-tor1-01.ssh > 198.96.84.204.15419: Flags [P.], seq 963576:963748, ack 577, win 313, length 172
18:44:48.179819 IP lamp-s-1vcpu-1gb-tor1-01.ssh > 198.96.84.204.15419: Flags [P.], seq 963748:963920, ack 577, win 313, length 172
18:44:48.179947 IP lamp-s-1vcpu-1gb-tor1-01.ssh > 198.96.84.204.15419: Flags [P.], seq 963920:964092, ack 577, win 313, length 172
18:44:48.180135 IP lamp-s-1vcpu-1gb-tor1-01.ssh > 198.96.84.204.15419: Flags [P.], seq 964092:964264, ack 577, win 313, length 172
18:44:48.180277 IP lamp-s-1vcpu-1gb-tor1-01.ssh > 198.96.84.204.15419: Flags [P.], seq 964264:964436, ack 577, win 313, length 172
18:44:48.180406 IP lamp-s-1vcpu-1gb-tor1-01.ssh > 198.96.84.204.15419: Flags [P.], seq 964436:964608, ack 577, win 313, length 172
18:44:48.180552 IP lamp-s-1vcpu-1gb-tor1-01.ssh > 198.96.84.204.15419: Flags [P.], seq 964608:964780, ack 577, win 313, length 172
18:44:48.180706 IP lamp-s-1vcpu-1gb-tor1-01.ssh > 198.96.84.204.15419: Flags [P.], seq 964780:964952, ack 577, win 313, length 172
18:44:48.183632 IP 198.96.84.204.15419 > lamp-s-1vcpu-1gb-tor1-01.ssh: Flags [.], ack 960460, win 511, length 0
18:44:48.183671 IP lamp-s-1vcpu-1gb-tor1-01.ssh > 198.96.84.204.15419: Flags [P.], seq 964952:965124, ack 577, win 313, length 172
18:44:48.183696 IP 198.96.84.204.15419 > lamp-s-1vcpu-1gb-tor1-01.ssh: Flags [.], ack 960804, win 510, length 0
18:44:48.183710 IP 198.96.84.204.15419 > lamp-s-1vcpu-1gb-tor1-01.ssh: Flags [.], ack 961148, win 508, length 0
18:44:48.183721 IP 198.96.84.204.15419 > lamp-s-1vcpu-1gb-tor1-01.ssh: Flags [.], ack 962372, win 512, length 0
18:44:48.183947 IP lamp-s-1vcpu-1gb-tor1-01.ssh > 198.96.84.204.15419: Flags [P.], seq 965124:965744, ack 577, win 313, length 620
18:44:48.184150 IP lamp-s-1vcpu-1gb-tor1-01.ssh > 198.96.84.204.15419: Flags [P.], seq 965744:965916, ack 577, win 313, length 172
18:44:48.184290 IP lamp-s-1vcpu-1gb-tor1-01.ssh > 198.96.84.204.15419: Flags [P.], seq 965916:966088, ack 577, win 313, length 172
18:44:48.184424 IP lamp-s-1vcpu-1gb-tor1-01.ssh > 198.96.84.204.15419: Flags [P.], seq 966088:966260, ack 577, win 313, length 172
18:44:48.184558 IP lamp-s-1vcpu-1gb-tor1-01.ssh > 198.96.84.204.15419: Flags [P.], seq 966260:966432, ack 577, win 313, length 172
18:44:48.184700 IP lamp-s-1vcpu-1gb-tor1-01.ssh > 198.96.84.204.15419: Flags [P.], seq 966432:966604, ack 577, win 313, length 172
18:44:48.184832 IP lamp-s-1vcpu-1gb-tor1-01.ssh > 198.96.84.204.15419: Flags [P.], seq 966604:966776, ack 577, win 313, length 172
18:44:48.184986 IP 198.96.84.204.15419 > lamp-s-1vcpu-1gb-tor1-01.ssh: Flags [.], ack 962716, win 511, length 0
18:44:48.185008 IP 198.96.84.204.15419 > lamp-s-1vcpu-1gb-tor1-01.ssh: Flags [.], ack 963060, win 510, length 0
18:44:48.185018 IP 198.96.84.204.15419 > lamp-s-1vcpu-1gb-tor1-01.ssh: Flags [.], ack 963404, win 508, length 0
18:44:48.185025 IP 198.96.84.204.15419 > lamp-s-1vcpu-1gb-tor1-01.ssh: Flags [.], ack 963748, win 512, length 0
18:44:48.185032 IP 198.96.84.204.15419 > lamp-s-1vcpu-1gb-tor1-01.ssh: Flags [.], ack 964092, win 511, length 0
18:44:48.185038 IP 198.96.84.204.15419 > lamp-s-1vcpu-1gb-tor1-01.ssh: Flags [.], ack 964436, win 510, length 0
18:44:48.185048 IP 198.96.84.204.15419 > lamp-s-1vcpu-1gb-tor1-01.ssh: Flags [.], ack 964780, win 508, length 0
18:44:48.185233 IP lamp-s-1vcpu-1gb-tor1-01.ssh > 198.96.84.204.15419: Flags [P.], seq 966776:966948, ack 577, win 313, length 172
18:44:48.185325 IP lamp-s-1vcpu-1gb-tor1-01.ssh > 198.96.84.204.15419: Flags [P.], seq 966948:967776, ack 577, win 313, length 828
18:44:48.185480 IP lamp-s-1vcpu-1gb-tor1-01.ssh > 198.96.84.204.15419: Flags [P.], seq 967776:968076, ack 577, win 313, length 300
18:44:48.185613 IP lamp-s-1vcpu-1gb-tor1-01.ssh > 198.96.84.204.15419: Flags [P.], seq 968076:968248, ack 577, win 313, length 172
18:44:48.185744 IP lamp-s-1vcpu-1gb-tor1-01.ssh > 198.96.84.204.15419: Flags [P.], seq 968248:968420, ack 577, win 313, length 172
18:44:48.185875 IP lamp-s-1vcpu-1gb-tor1-01.ssh > 198.96.84.204.15419: Flags [P.], seq 968420:968592, ack 577, win 313, length 172
18:44:48.186005 IP lamp-s-1vcpu-1gb-tor1-01.ssh > 198.96.84.204.15419: Flags [P.], seq 968592:968764, ack 577, win 313, length 172
18:44:48.186133 IP lamp-s-1vcpu-1gb-tor1-01.ssh > 198.96.84.204.15419: Flags [P.], seq 968764:968936, ack 577, win 313, length 172
18:44:48.186261 IP lamp-s-1vcpu-1gb-tor1-01.ssh > 198.96.84.204.15419: Flags [P.], seq 968936:969108, ack 577, win 313, length 172
18:44:48.186389 IP lamp-s-1vcpu-1gb-tor1-01.ssh > 198.96.84.204.15419: Flags [P.], seq 969108:969280, ack 577, win 313, length 172
18:44:48.186517 IP lamp-s-1vcpu-1gb-tor1-01.ssh > 198.96.84.204.15419: Flags [P.], seq 969280:969452, ack 577, win 313, length 172
18:44:48.186645 IP lamp-s-1vcpu-1gb-tor1-01.ssh > 198.96.84.204.15419: Flags [P.], seq 969452:969624, ack 577, win 313, length 172
18:44:48.186780 IP lamp-s-1vcpu-1gb-tor1-01.ssh > 198.96.84.204.15419: Flags [P.], seq 969624:969796, ack 577, win 313, length 172
18:44:48.186913 IP 198.96.84.204.15419 > lamp-s-1vcpu-1gb-tor1-01.ssh: Flags [.], ack 965124, win 512, length 0
18:44:48.187018 IP lamp-s-1vcpu-1gb-tor1-01.ssh > 198.96.84.204.15419: Flags [P.], seq 969796:969968, ack 577, win 313, length 172
18:44:48.187143 IP lamp-s-1vcpu-1gb-tor1-01.ssh > 198.96.84.204.15419: Flags [P.], seq 969968:970116, ack 577, win 313, length 148
18:44:48.187263 IP lamp-s-1vcpu-1gb-tor1-01.ssh > 198.96.84.204.15419: Flags [P.], seq 970116:970288, ack 577, win 313, length 172
18:44:48.188394 IP 198.96.84.204.15419 > lamp-s-1vcpu-1gb-tor1-01.ssh: Flags [.], ack 965916, win 509, length 0
18:44:48.188428 IP lamp-s-1vcpu-1gb-tor1-01.ssh > 198.96.84.204.15419: Flags [P.], seq 970288:970632, ack 577, win 313, length 344
18:44:48.188451 IP 198.96.84.204.15419 > lamp-s-1vcpu-1gb-tor1-01.ssh: Flags [.], ack 966260, win 508, length 0
18:44:48.188464 IP 198.96.84.204.15419 > lamp-s-1vcpu-1gb-tor1-01.ssh: Flags [.], ack 966604, win 512, length 0
18:44:48.188474 IP 198.96.84.204.15419 > lamp-s-1vcpu-1gb-tor1-01.ssh: Flags [.], ack 966948, win 511, length 0
18:44:48.188689 IP lamp-s-1vcpu-1gb-tor1-01.ssh > 198.96.84.204.15419: Flags [P.], seq 970632:971252, ack 577, win 313, length 620
18:44:48.188825 IP lamp-s-1vcpu-1gb-tor1-01.ssh > 198.96.84.204.15419: Flags [P.], seq 971252:971424, ack 577, win 313, length 172
18:44:48.188973 IP lamp-s-1vcpu-1gb-tor1-01.ssh > 198.96.84.204.15419: Flags [P.], seq 971424:971596, ack 577, win 313, length 172
18:44:48.189194 IP lamp-s-1vcpu-1gb-tor1-01.ssh > 198.96.84.204.15419: Flags [P.], seq 971596:971768, ack 577, win 313, length 172
18:44:48.189356 IP lamp-s-1vcpu-1gb-tor1-01.ssh > 198.96.84.204.15419: Flags [P.], seq 971768:971940, ack 577, win 313, length 172
