tcpdump -r 0001.pcap
reading from file 0001.pcap, link-type EN10MB (Ethernet)
18:41:48.416223 IP lamp-s-1vcpu-1gb-tor1-01.ssh > 198.96.84.204.32005: Flags [P.], seq 3072276939:3072276983, ack 2678958482, win 313, length 44
18:41:48.416338 IP lamp-s-1vcpu-1gb-tor1-01.ssh > 198.96.84.204.32005: Flags [P.], seq 44:152, ack 1, win 313, length 108
18:41:48.416414 IP lamp-s-1vcpu-1gb-tor1-01.ssh > 198.96.84.204.32005: Flags [P.], seq 152:188, ack 1, win 313, length 36
18:41:48.419688 IP 198.96.84.204.32005 > lamp-s-1vcpu-1gb-tor1-01.ssh: Flags [.], ack 44, win 508, length 0
18:41:48.419731 IP 198.96.84.204.32005 > lamp-s-1vcpu-1gb-tor1-01.ssh: Flags [.], ack 188, win 507, length 0
18:41:49.218368 IP 218.92.0.200.28222 > lamp-s-1vcpu-1gb-tor1-01.ssh: Flags [S], seq 4263963106, win 29200, options [mss 1460,sackOK,TS val 315472117 ecr 0,nop,wscale 7], length 0
18:41:49.218433 IP lamp-s-1vcpu-1gb-tor1-01.ssh > 218.92.0.200.28222: Flags [S.], seq 894549785, ack 4263963107, win 28960, options [mss 1460,sackOK,TS val 1721350479 ecr 315471867,nop,wscale 7], length 0
18:41:50.248162 IP lamp-s-1vcpu-1gb-tor1-01.ssh > 218.92.0.200.28222: Flags [S.], seq 894549785, ack 4263963107, win 28960, options [mss 1460,sackOK,TS val 1721351509 ecr 315471867,nop,wscale 7], length 0
18:41:51.222391 IP 218.92.0.200.28222 > lamp-s-1vcpu-1gb-tor1-01.ssh: Flags [S], seq 4263963106, win 29200, options [mss 1460,sackOK,TS val 315472618 ecr 0,nop,wscale 7], length 0
18:41:51.222456 IP lamp-s-1vcpu-1gb-tor1-01.ssh > 218.92.0.200.28222: Flags [S.], seq 894549785, ack 4263963107, win 28960, options [mss 1460,sackOK,TS val 1721352483 ecr 315471867,nop,wscale 7], length 0
18:41:52.488168 IP lamp-s-1vcpu-1gb-tor1-01.ssh > 218.92.0.200.42589: Flags [S.], seq 2893434309, ack 2117763379, win 28960, options [mss 1460,sackOK,TS val 1721353749 ecr 315470616,nop,wscale 7], length 0
18:41:53.224172 IP lamp-s-1vcpu-1gb-tor1-01.ssh > 218.92.0.200.28222: Flags [S.], seq 894549785, ack 4263963107, win 28960, options [mss 1460,sackOK,TS val 1721354485 ecr 315471867,nop,wscale 7], length 0
18:41:53.225455 IP 218.92.0.200.16639 > lamp-s-1vcpu-1gb-tor1-01.ssh: Flags [S], seq 4238385495, win 29200, options [mss 1460,sackOK,TS val 315473118 ecr 0,nop,wscale 7], length 0
18:41:53.225515 IP lamp-s-1vcpu-1gb-tor1-01.ssh > 218.92.0.200.16639: Flags [S.], seq 4034883239, ack 4238385496, win 28960, options [mss 1460,sackOK,TS val 1721354486 ecr 315473118,nop,wscale 7], length 0
18:41:53.470426 IP 218.92.0.200.16639 > lamp-s-1vcpu-1gb-tor1-01.ssh: Flags [.], ack 1, win 229, options [nop,nop,TS val 315473179 ecr 1721354486], length 0
18:41:53.470515 IP 218.92.0.200.16639 > lamp-s-1vcpu-1gb-tor1-01.ssh: Flags [P.], seq 1:16, ack 1, win 229, options [nop,nop,TS val 315473179 ecr 1721354486], length 15
18:41:53.482897 IP lamp-s-1vcpu-1gb-tor1-01.ssh > 218.92.0.200.16639: Flags [P.], seq 1:42, ack 1, win 227, options [nop,nop,TS val 1721354743 ecr 315473179], length 41
18:41:53.714351 IP 218.92.0.200.16639 > lamp-s-1vcpu-1gb-tor1-01.ssh: Flags [.], ack 42, win 229, options [nop,nop,TS val 315473240 ecr 1721354743], length 0
18:41:54.208916 IP 218.92.0.200.16639 > lamp-s-1vcpu-1gb-tor1-01.ssh: Flags [P.], seq 16:872, ack 42, win 229, options [nop,nop,TS val 315473364 ecr 1721354743], length 856
18:41:54.948940 IP 218.92.0.200.16639 > lamp-s-1vcpu-1gb-tor1-01.ssh: Flags [P.], seq 1:872, ack 42, win 229, options [nop,nop,TS val 315473549 ecr 1721354743], length 871
18:41:56.436949 IP 218.92.0.200.16639 > lamp-s-1vcpu-1gb-tor1-01.ssh: Flags [P.], seq 1:872, ack 42, win 229, options [nop,nop,TS val 315473921 ecr 1721354743], length 871
18:41:57.352188 IP lamp-s-1vcpu-1gb-tor1-01.ssh > 218.92.0.200.28222: Flags [S.], seq 894549785, ack 4263963107, win 28960, options [mss 1460,sackOK,TS val 1721358613 ecr 315471867,nop,wscale 7], length 0
18:41:58.719010 IP 218.92.0.200.16639 > lamp-s-1vcpu-1gb-tor1-01.ssh: Flags [FP.], seq 872:896, ack 42, win 229, options [nop,nop,TS val 315474491 ecr 1721354743], length 24
18:41:59.737781 IP 185.209.0.91.57162 > lamp-s-1vcpu-1gb-tor1-01.3364: Flags [S], seq 1539821289, win 1024, length 0
18:42:00.680147 IP lamp-s-1vcpu-1gb-tor1-01.ssh > 218.92.0.200.42589: Flags [S.], seq 2893434309, ack 2117763379, win 28960, options [mss 1460,sackOK,TS val 1721361941 ecr 315470616,nop,wscale 7], length 0
18:42:02.597918 IP 198.96.84.204.32005 > lamp-s-1vcpu-1gb-tor1-01.ssh: Flags [P.], seq 1:69, ack 188, win 507, length 68
18:42:02.640177 IP lamp-s-1vcpu-1gb-tor1-01.ssh > 198.96.84.204.32005: Flags [.], ack 69, win 313, length 0
18:42:05.475059 IP lamp-s-1vcpu-1gb-tor1-01.ssh > 218.92.0.200.33871: Flags [F.], seq 711594746, ack 2682940731, win 227, options [nop,nop,TS val 1721366736 ecr 315446179], length 0
18:42:05.544132 IP lamp-s-1vcpu-1gb-tor1-01.ssh > 218.92.0.200.28222: Flags [S.], seq 894549785, ack 4263963107, win 28960, options [mss 1460,sackOK,TS val 1721366805 ecr 315471867,nop,wscale 7], length 0
18:42:05.701085 IP 218.92.0.200.33871 > lamp-s-1vcpu-1gb-tor1-01.ssh: Flags [R], seq 2682940731, win 0, length 0
root@lamp-s-1vcpu-1gb-tor1-01:~#
