], seq 702416:702588, ack 433, win 313, length 172
18:38:00.010252 IP lamp-s-1vcpu-1gb-tor1-01.ssh > 198.96.84.204.32005: Flags [P.], seq 702588:702760, ack 433, win 313, length 172
18:38:00.010378 IP lamp-s-1vcpu-1gb-tor1-01.ssh > 198.96.84.204.32005: Flags [P.], seq 702760:702932, ack 433, win 313, length 172
18:38:00.010546 IP 198.96.84.204.32005 > lamp-s-1vcpu-1gb-tor1-01.ssh: Flags [.], ack 697168, win 508, length 0
18:38:00.010570 IP 198.96.84.204.32005 > lamp-s-1vcpu-1gb-tor1-01.ssh: Flags [.], ack 697512, win 512, length 0
18:38:00.010578 IP 198.96.84.204.32005 > lamp-s-1vcpu-1gb-tor1-01.ssh: Flags [.], ack 697856, win 511, length 0
18:38:00.010585 IP 198.96.84.204.32005 > lamp-s-1vcpu-1gb-tor1-01.ssh: Flags [.], ack 698200, win 510, length 0
18:38:00.010591 IP 198.96.84.204.32005 > lamp-s-1vcpu-1gb-tor1-01.ssh: Flags [.], ack 698544, win 508, length 0
18:38:00.010596 IP 198.96.84.204.32005 > lamp-s-1vcpu-1gb-tor1-01.ssh: Flags [.], ack 698888, win 512, length 0
18:38:00.010602 IP 198.96.84.204.32005 > lamp-s-1vcpu-1gb-tor1-01.ssh: Flags [.], ack 699232, win 511, length 0
18:38:00.010837 IP lamp-s-1vcpu-1gb-tor1-01.ssh > 198.96.84.204.32005: Flags [P.], seq 702932:703896, ack 433, win 313, length 964
18:38:00.011025 IP lamp-s-1vcpu-1gb-tor1-01.ssh > 198.96.84.204.32005: Flags [P.], seq 703896:704068, ack 433, win 313, length 172
18:38:00.011147 IP lamp-s-1vcpu-1gb-tor1-01.ssh > 198.96.84.204.32005: Flags [P.], seq 704068:704240, ack 433, win 313, length 172
18:38:00.011277 IP lamp-s-1vcpu-1gb-tor1-01.ssh > 198.96.84.204.32005: Flags [P.], seq 704240:704412, ack 433, win 313, length 172
18:38:00.011450 IP lamp-s-1vcpu-1gb-tor1-01.ssh > 198.96.84.204.32005: Flags [P.], seq 704412:704584, ack 433, win 313, length 172
18:38:00.011569 IP lamp-s-1vcpu-1gb-tor1-01.ssh > 198.96.84.204.32005: Flags [P.], seq 704584:704756, ack 433, win 313, length 172
18:38:00.011676 IP lamp-s-1vcpu-1gb-tor1-01.ssh > 198.96.84.204.32005: Flags [P.], seq 704756:704928, ack 433, win 313, length 172
18:38:00.011782 IP lamp-s-1vcpu-1gb-tor1-01.ssh > 198.96.84.204.32005: Flags [P.], seq 704928:705100, ack 433, win 313, length 172
18:38:00.011886 IP lamp-s-1vcpu-1gb-tor1-01.ssh > 198.96.84.204.32005: Flags [P.], seq 705100:705272, ack 433, win 313, length 172
18:38:00.011990 IP lamp-s-1vcpu-1gb-tor1-01.ssh > 198.96.84.204.32005: Flags [P.], seq 705272:705444, ack 433, win 313, length 172
18:38:00.012220 IP lamp-s-1vcpu-1gb-tor1-01.ssh > 198.96.84.204.32005: Flags [P.], seq 705444:705616, ack 433, win 313, length 172
18:38:00.012761 IP lamp-s-1vcpu-1gb-tor1-01.ssh > 198.96.84.204.32005: Flags [P.], seq 705616:705788, ack 433, win 313, length 172
18:38:00.012816 IP 198.96.84.204.32005 > lamp-s-1vcpu-1gb-tor1-01.ssh: Flags [.], ack 700248, win 512, length 0
18:38:00.012841 IP 198.96.84.204.32005 > lamp-s-1vcpu-1gb-tor1-01.ssh: Flags [.], ack 700592, win 511, length 0
18:38:00.013064 IP lamp-s-1vcpu-1gb-tor1-01.ssh > 198.96.84.204.32005: Flags [P.], seq 705788:706184, ack 433, win 313, length 396
18:38:00.013191 IP lamp-s-1vcpu-1gb-tor1-01.ssh > 198.96.84.204.32005: Flags [P.], seq 706184:706356, ack 433, win 313, length 172
18:38:00.013317 IP lamp-s-1vcpu-1gb-tor1-01.ssh > 198.96.84.204.32005: Flags [P.], seq 706356:706528, ack 433, win 313, length 172
18:38:00.013484 IP lamp-s-1vcpu-1gb-tor1-01.ssh > 198.96.84.204.32005: Flags [P.], seq 706528:706700, ack 433, win 313, length 172
18:38:00.013604 IP lamp-s-1vcpu-1gb-tor1-01.ssh > 198.96.84.204.32005: Flags [P.], seq 706700:706872, ack 433, win 313, length 172
18:38:00.013711 IP lamp-s-1vcpu-1gb-tor1-01.ssh > 198.96.84.204.32005: Flags [P.], seq 706872:707044, ack 433, win 313, length 172
18:38:00.013816 IP lamp-s-1vcpu-1gb-tor1-01.ssh > 198.96.84.204.32005: Flags [P.], seq 707044:707216, ack 433, win 313, length 172
18:38:00.013968 IP lamp-s-1vcpu-1gb-tor1-01.ssh > 198.96.84.204.32005: Flags [P.], seq 707216:707388, ack 433, win 313, length 172
18:38:00.014163 IP lamp-s-1vcpu-1gb-tor1-01.ssh > 198.96.84.204.32005: Flags [P.], seq 707388:707560, ack 433, win 313, length 172
18:38:00.014276 IP 198.96.84.204.32005 > lamp-s-1vcpu-1gb-tor1-01.ssh: Flags [.], ack 701728, win 512, length 0
18:38:00.014296 IP 198.96.84.204.32005 > lamp-s-1vcpu-1gb-tor1-01.ssh: Flags [.], ack 702072, win 511, length 0
18:38:00.014303 IP 198.96.84.204.32005 > lamp-s-1vcpu-1gb-tor1-01.ssh: Flags [.], ack 702416, win 510, length 0
18:38:00.014309 IP 198.96.84.204.32005 > lamp-s-1vcpu-1gb-tor1-01.ssh: Flags [.], ack 702760, win 508, length 0
18:38:00.014472 IP lamp-s-1vcpu-1gb-tor1-01.ssh > 198.96.84.204.32005: Flags [P.], seq 707560:708180, ack 433, win 313, length 620
18:38:00.014655 IP lamp-s-1vcpu-1gb-tor1-01.ssh > 198.96.84.204.32005: Flags [P.], seq 708180:708352, ack 433, win 313, length 172
18:38:00.014839 IP lamp-s-1vcpu-1gb-tor1-01.ssh > 198.96.84.204.32005: Flags [P.], seq 708352:708524, ack 433, win 313, length 172
18:38:00.014967 IP lamp-s-1vcpu-1gb-tor1-01.ssh > 198.96.84.204.32005: Flags [P.], seq 708524:708696, ack 433, win 313, length 172
18:38:00.015075 IP lamp-s-1vcpu-1gb-tor1-01.ssh > 198.96.84.204.32005: Flags [P.], seq 708696:708868, ack 433, win 313, length 172
18:38:00.015181 IP lamp-s-1vcpu-1gb-tor1-01.ssh > 198.96.84.204.32005: Flags [P.], seq 708868:709040, ack 433, win 313, length 172
18:38:00.015284 IP lamp-s-1vcpu-1gb-tor1-01.ssh > 198.96.84.204.32005: Flags [P.], seq 709040:709212, ack 433, win 313, length 172
18:38:00.015388 IP lamp-s-1vcpu-1gb-tor1-01.ssh > 198.96.84.204.32005: Flags [P.], seq 709212:709384, ack 433, win 313, length 172
18:38:00.015498 IP lamp-s-1vcpu-1gb-tor1-01.ssh > 198.96.84.204.32005: Flags [P.], seq 709384:709556, ack 433, win 313, length 172
18:38:00.015604 IP lamp-s-1vcpu-1gb-tor1-01.ssh > 198.96.84.204.32005: Flags [P.], seq 709556:709728, ack 433, win 313, length 172
18:38:00.015640 IP 198.96.84.204.32005 > lamp-s-1vcpu-1gb-tor1-01.ssh: Flags [.], ack 703896, win 512, length 0
18:38:00.015658 IP 198.96.84.204.32005 > lamp-s-1vcpu-1gb-tor1-01.ssh: Flags [.], ack 704240, win 511, length 0
18:38:00.015664 IP 198.96.84.204.32005 > lamp-s-1vcpu-1gb-tor1-01.ssh: Flags [.], ack 704584, win 510, length 0
18:38:00.015670 IP 198.96.84.204.32005 > lamp-s-1vcpu-1gb-tor1-01.ssh: Flags [.], ack 704928, win 508, length 0
18:38:00.015676 IP 198.96.84.204.32005 > lamp-s-1vcpu-1gb-tor1-01.ssh: Flags [.], ack 705272, win 512, length 0
18:38:00.015683 IP 198.96.84.204.32005 > lamp-s-1vcpu-1gb-tor1-01.ssh: Flags [.], ack 705616, win 511, length 0
18:38:00.015896 IP lamp-s-1vcpu-1gb-tor1-01.ssh > 198.96.84.204.32005: Flags [P.], seq 709728:710572, ack 433, win 313, length 844
18:38:00.016011 IP lamp-s-1vcpu-1gb-tor1-01.ssh > 198.96.84.204.32005: Flags [P.], seq 710572:710744, ack 433, win 313, length 172
18:38:00.016160 IP lamp-s-1vcpu-1gb-tor1-01.ssh > 198.96.84.204.32005: Flags [P.], seq 710744:710916, ack 433, win 313, length 172
18:38:00.016335 IP lamp-s-1vcpu-1gb-tor1-01.ssh > 198.96.84.204.32005: Flags [P.], seq 710916:711088, ack 433, win 313, length 172
18:38:00.016456 IP lamp-s-1vcpu-1gb-tor1-01.ssh > 198.96.84.204.32005: Flags [P.], seq 711088:711260, ack 433, win 313, length 172
18:38:00.016563 IP lamp-s-1vcpu-1gb-tor1-01.ssh > 198.96.84.204.32005: Flags [P.], seq 711260:711432, ack 433, win 313, length 172
18:38:00.016666 IP lamp-s-1vcpu-1gb-tor1-01.ssh > 198.96.84.204.32005: Flags [P.], seq 711432:711604, ack 433, win 313, length 172
18:38:00.016769 IP lamp-s-1vcpu-1gb-tor1-01.ssh > 198.96.84.204.32005: Flags [P.], seq 711604:711776, ack 433, win 313, length 172
18:38:00.016871 IP lamp-s-1vcpu-1gb-tor1-01.ssh > 198.96.84.204.32005: Flags [P.], seq 711776:711948, ack 433, win 313, length 172
18:38:00.016975 IP lamp-s-1vcpu-1gb-tor1-01.ssh > 198.96.84.204.32005: Flags [P.], seq 711948:712120, ack 433, win 313, length 172
18:38:00.016997 IP 198.96.84.204.32005 > lamp-s-1vcpu-1gb-tor1-01.ssh: Flags [.], ack 706184, win 509, length 0
18:38:00.017007 IP 198.96.84.204.32005 > lamp-s-1vcpu-1gb-tor1-01.ssh: Flags [.], ack 706528, win 507, length 0
18:38:00.017011 IP 198.96.84.204.32005 > lamp-s-1vcpu-1gb-tor1-01.ssh: Flags [.], ack 706872, win 512, length 0
18:38:00.017015 IP 198.96.84.204.32005 > lamp-s-1vcpu-1gb-tor1-01.ssh: Flags [.], ack 707216, win 511, length 0
18:38:00.017019 IP 198.96.84.204.32005 > lamp-s-1vcpu-1gb-tor1-01.ssh: Flags [.], ack 707560, win 510, length 0
18:38:00.017223 IP lamp-s-1vcpu-1gb-tor1-01.ssh > 198.96.84.204.32005: Flags [P.], seq 712120:712852, ack 433, win 313, length 732
18:38:00.017338 IP lamp-s-1vcpu-1gb-tor1-01.ssh > 198.96.84.204.32005: Flags [P.], seq 712852:713024, ack 433, win 313, length 172
18:38:00.017442 IP lamp-s-1vcpu-1gb-tor1-01.ssh > 198.96.84.204.32005: Flags [P.], seq 713024:713196, ack 433, win 313, length 172
18:38:00.017545 IP lamp-s-1vcpu-1gb-tor1-01.ssh > 198.96.84.204.32005: Flags [P.], seq 713196:713368, ack 433, win 313, length 172
18:38:00.017647 IP lamp-s-1vcpu-1gb-tor1-01.ssh > 198.96.84.204.32005: Flags [P.], seq 713368:713540, ack 433, win 313, length 172
18:38:00.017751 IP lamp-s-1vcpu-1gb-tor1-01.ssh > 198.96.84.204.32005: Flags [P.], seq 713540:713712, ack 433, win 313, length 172
18:38:00.017854 IP lamp-s-1vcpu-1gb-tor1-01.ssh > 198.96.84.204.32005: Flags [P.], seq 713712:713884, ack 433, win 313, length 172
18:38:00.017957 IP lamp-s-1vcpu-1gb-tor1-01.ssh > 198.96.84.204.32005: Flags [P.], seq 713884:714056, ack 433, win 313, length 172
18:38:00.018060 IP lamp-s-1vcpu-1gb-tor1-01.ssh > 198.96.84.204.32005: Flags [P.], seq 714056:714228, ack 433, win 313, length 172
18:38:00.018164 IP lamp-s-1vcpu-1gb-tor1-01.ssh > 198.96.84.204.32005: Flags [P.], seq 714228:714400, ack 433, win 313, length 172
18:38:00.018269 IP lamp-s-1vcpu-1gb-tor1-01.ssh > 198.96.84.204.32005: Flags [P.], seq 714400:714572, ack 433, win 313, length 172
18:38:00.018373 IP lamp-s-1vcpu-1gb-tor1-01.ssh > 198.96.84.204.32005: Flags [P.], seq 714572:714744, ack 433, win 313, length 172
18:38:00.018476 IP lamp-s-1vcpu-1gb-tor1-01.ssh > 198.96.84.204.32005: Flags [P.], seq 714744:714916, ack 433, win 313, length 172
18:38:00.018581 IP lamp-s-1vcpu-1gb-tor1-01.ssh > 198.96.84.204.32005: Flags [P.], seq 714916:715088, ack 433, win 313, length 172
18:38:00.018686 IP lamp-s-1vcpu-1gb-tor1-01.ssh > 198.96.84.204.32005: Flags [P.], seq 715088:715260, ack 433, win 313, length 172
18:38:00.018789 IP lamp-s-1vcpu-1gb-tor1-01.ssh > 198.96.84.204.32005: Flags [P.], seq 715260:715432, ack 433, win 313, length 172
18:38:00.018901 IP lamp-s-1vcpu-1gb-tor1-01.ssh > 198.96.84.204.32005: Flags [P.], seq 715432:715604, ack 433, win 313, length 172
18:38:00.019061 IP lamp-s-1vcpu-1gb-tor1-01.ssh > 198.96.84.204.32005: Flags [P.], seq 715604:715776, ack 433, win 313, length 172
18:38:00.019239 IP lamp-s-1vcpu-1gb-tor1-01.ssh > 198.96.84.204.32005: Flags [P.], seq 715776:715948, ack 433, win 313, length 172
18:38:00.019357 IP lamp-s-1vcpu-1gb-tor1-01.ssh > 198.96.84.204.32005: Flags [P.], seq 715948:716120, ack 433, win 313, length 172
18:38:00.019456 IP 198.96.84.204.32005 > lamp-s-1vcpu-1gb-tor1-01.ssh: Flags [.], ack 708352, win 512, length 0
18:38:00.019475 IP 198.96.84.204.32005 > lamp-s-1vcpu-1gb-tor1-01.ssh: Flags [.], ack 708696, win 511, length 0
18:38:00.019481 IP 198.96.84.204.32005 > lamp-s-1vcpu-1gb-tor1-01.ssh: Flags [.], ack 709040, win 510, length 0
18:38:00.019487 IP 198.96.84.204.32005 > lamp-s-1vcpu-1gb-tor1-01.ssh: Flags [.], ack 709384, win 508, length 0
18:38:00.019492 IP 198.96.84.204.32005 > lamp-s-1vcpu-1gb-tor1-01.ssh: Flags [.], ack 709728, win 512, length 0
18:38:00.019776 IP lamp-s-1vcpu-1gb-tor1-01.ssh > 198.96.84.204.32005: Flags [P.], seq 716120:716852, ack 433, win 313, length 732
18:38:00.019922 IP lamp-s-1vcpu-1gb-tor1-01.ssh > 198.96.84.204.32005: Flags [P.], seq 716852:717024, ack 433, win 313, length 172
18:38:00.020066 IP lamp-s-1vcpu-1gb-tor1-01.ssh > 198.96.84.204.32005: Flags [P.], seq 717024:717196, ack 433, win 313, length 172
18:38:00.020273 IP lamp-s-1vcpu-1gb-tor1-01.ssh > 198.96.84.204.32005: Flags [P.], seq 717196:717368, ack 433, win 313, length 172
18:38:00.020463 IP lamp-s-1vcpu-1gb-tor1-01.ssh > 198.96.84.204.32005: Flags [P.], seq 717368:717540, ack 433, win 313, length 172
18:38:00.020634 IP lamp-s-1vcpu-1gb-tor1-01.ssh > 198.96.84.204.32005: Flags [P.], seq 717540:717712, ack 433, win 313, length 172
18:38:00.020753 IP lamp-s-1vcpu-1gb-tor1-01.ssh > 198.96.84.204.32005: Flags [P.], seq 717712:717884, ack 433, win 313, length 172
18:38:00.020864 IP lamp-s-1vcpu-1gb-tor1-01.ssh > 198.96.84.204.32005: Flags [P.], seq 717884:718056, ack 433, win 313, length 172
18:38:00.020969 IP lamp-s-1vcpu-1gb-tor1-01.ssh > 198.96.84.204.32005: Flags [P.], seq 718056:718228, ack 433, win 313, length 172
18:38:00.021080 IP lamp-s-1vcpu-1gb-tor1-01.ssh > 198.96.84.204.32005: Flags [P.], seq 718228:718400, ack 433, win 313, length 172
18:38:00.021119 IP 198.96.84.204.32005 > lamp-s-1vcpu-1gb-tor1-01.ssh: Flags [.], ack 710744, win 508, length 0
18:38:00.021136 IP 198.96.84.204.32005 > lamp-s-1vcpu-1gb-tor1-01.ssh: Flags [.], ack 711088, win 512, length 0
18:38:00.021143 IP 198.96.84.204.32005 > lamp-s-1vcpu-1gb-tor1-01.ssh: Flags [.], ack 711432, win 511, length 0
18:38:00.021148 IP 198.96.84.204.32005 > lamp-s-1vcpu-1gb-tor1-01.ssh: Flags [.], ack 711776, win 510, length 0
18:38:00.021155 IP 198.96.84.204.32005 > lamp-s-1vcpu-1gb-tor1-01.ssh: Flags [.], ack 712120, win 508, length 0
18:38:00.021358 IP lamp-s-1vcpu-1gb-tor1-01.ssh > 198.96.84.204.32005: Flags [P.], seq 718400:719132, ack 433, win 313, length 732
18:38:00.021532 IP lamp-s-1vcpu-1gb-tor1-01.ssh > 198.96.84.204.32005: Flags [P.], seq 719132:719304, ack 433, win 313, length 172
18:38:00.021646 IP lamp-s-1vcpu-1gb-tor1-01.ssh > 198.96.84.204.32005: Flags [P.], seq 719304:719476, ack 433, win 313, length 172
18:38:00.021758 IP lamp-s-1vcpu-1gb-tor1-01.ssh > 198.96.84.204.32005: Flags [P.], seq 719476:719648, ack 433, win 313, length 172
18:38:00.021869 IP lamp-s-1vcpu-1gb-tor1-01.ssh > 198.96.84.204.32005: Flags [P.], seq 719648:719820, ack 433, win 313, length 172
18:38:00.021973 IP lamp-s-1vcpu-1gb-tor1-01.ssh > 198.96.84.204.32005: Flags [P.], seq 719820:719992, ack 433, win 313, length 172
18:38:00.022077 IP lamp-s-1vcpu-1gb-tor1-01.ssh > 198.96.84.204.32005: Flags [P.], seq 719992:720164, ack 433, win 313, length 172
18:38:00.022181 IP lamp-s-1vcpu-1gb-tor1-01.ssh > 198.96.84.204.32005: Flags [P.], seq 720164:720336, ack 433, win 313, length 172
18:38:00.022343 IP lamp-s-1vcpu-1gb-tor1-01.ssh > 198.96.84.204.32005: Flags [P.], seq 720336:720508, ack 433, win 313, length 172
18:38:00.022462 IP 198.96.84.204.32005 > lamp-s-1vcpu-1gb-tor1-01.ssh: Flags [.], ack 713024, win 512, length 0
18:38:00.022482 IP 198.96.84.204.32005 > lamp-s-1vcpu-1gb-tor1-01.ssh: Flags [.], ack 713368, win 511, length 0
18:38:00.022488 IP 198.96.84.204.32005 > lamp-s-1vcpu-1gb-tor1-01.ssh: Flags [.], ack 713712, win 510, length 0
18:38:00.022494 IP 198.96.84.204.32005 > lamp-s-1vcpu-1gb-tor1-01.ssh: Flags [.], ack 714056, win 508, length 0
18:38:00.022500 IP 198.96.84.204.32005 > lamp-s-1vcpu-1gb-tor1-01.ssh: Flags [.], ack 714400, win 512, length 0
18:38:00.022508 IP 198.96.84.204.32005 > lamp-s-1vcpu-1gb-tor1-01.ssh: Flags [.], ack 714744, win 511, length 0
18:38:00.022514 IP 198.96.84.204.32005 > lamp-s-1vcpu-1gb-tor1-01.ssh: Flags [.], ack 715088, win 510, length 0
18:38:00.022733 IP lamp-s-1vcpu-1gb-tor1-01.ssh > 198.96.84.204.32005: Flags [P.], seq 720508:721472, ack 433, win 313, length 964
18:38:00.022856 IP lamp-s-1vcpu-1gb-tor1-01.ssh > 198.96.84.204.32005: Flags [P.], seq 721472:721644, ack 433, win 313, length 172
18:38:00.022970 IP lamp-s-1vcpu-1gb-tor1-01.ssh > 198.96.84.204.32005: Flags [P.], seq 721644:721816, ack 433, win 313, length 172
18:38:00.023075 IP lamp-s-1vcpu-1gb-tor1-01.ssh > 198.96.84.204.32005: Flags [P.], seq 721816:721988, ack 433, win 313, length 172
18:38:00.023181 IP lamp-s-1vcpu-1gb-tor1-01.ssh > 198.96.84.204.32005: Flags [P.], seq 721988:722160, ack 433, win 313, length 172
18:38:00.023286 IP lamp-s-1vcpu-1gb-tor1-01.ssh > 198.96.84.204.32005: Flags [P.], seq 722160:722332, ack 433, win 313, length 172
18:38:00.023452 IP lamp-s-1vcpu-1gb-tor1-01.ssh > 198.96.84.204.32005: Flags [P.], seq 722332:722504, ack 433, win 313, length 172
18:38:00.023599 IP lamp-s-1vcpu-1gb-tor1-01.ssh > 198.96.84.204.32005: Flags [P.], seq 722504:722676, ack 433, win 313, length 172
18:38:00.023780 IP lamp-s-1vcpu-1gb-tor1-01.ssh > 198.96.84.204.32005: Flags [P.], seq 722676:722848, ack 433, win 313, length 172
18:38:00.023938 IP 198.96.84.204.32005 > lamp-s-1vcpu-1gb-tor1-01.ssh: Flags [.], ack 716120, win 511, length 0
18:38:00.023966 IP 198.96.84.204.32005 > lamp-s-1vcpu-1gb-tor1-01.ssh: Flags [.], ack 717024, win 508, length 0
18:38:00.024138 IP lamp-s-1vcpu-1gb-tor1-01.ssh > 198.96.84.204.32005: Flags [P.], seq 722848:723244, ack 433, win 313, length 396
18:38:00.024295 IP lamp-s-1vcpu-1gb-tor1-01.ssh > 198.96.84.204.32005: Flags [P.], seq 723244:723416, ack 433, win 313, length 172
18:38:00.024436 IP lamp-s-1vcpu-1gb-tor1-01.ssh > 198.96.84.204.32005: Flags [P.], seq 723416:723588, ack 433, win 313, length 172
18:38:00.024546 IP lamp-s-1vcpu-1gb-tor1-01.ssh > 198.96.84.204.32005: Flags [P.], seq 723588:723760, ack 433, win 313, length 172
18:38:00.024652 IP lamp-s-1vcpu-1gb-tor1-01.ssh > 198.96.84.204.32005: Flags [P.], seq 723760:723932, ack 433, win 313, length 172
18:38:00.024788 IP lamp-s-1vcpu-1gb-tor1-01.ssh > 198.96.84.204.32005: Flags [P.], seq 723932:724104, ack 433, win 313, length 172
18:38:00.024969 IP lamp-s-1vcpu-1gb-tor1-01.ssh > 198.96.84.204.32005: Flags [P.], seq 724104:724276, ack 433, win 313, length 172
18:38:00.025149 IP lamp-s-1vcpu-1gb-tor1-01.ssh > 198.96.84.204.32005: Flags [P.], seq 724276:724448, ack 433, win 313, length 172
18:38:00.025323 IP lamp-s-1vcpu-1gb-tor1-01.ssh > 198.96.84.204.32005: Flags [P.], seq 724448:724620, ack 433, win 313, length 172
18:38:00.025463 IP lamp-s-1vcpu-1gb-tor1-01.ssh > 198.96.84.204.32005: Flags [P.], seq 724620:724792, ack 433, win 313, length 172
18:38:00.025575 IP lamp-s-1vcpu-1gb-tor1-01.ssh > 198.96.84.204.32005: Flags [P.], seq 724792:724964, ack 433, win 313, length 172
18:38:00.025652 IP 198.96.84.204.32005 > lamp-s-1vcpu-1gb-tor1-01.ssh: Flags [.], ack 717368, win 512, length 0
18:38:00.025671 IP 198.96.84.204.32005 > lamp-s-1vcpu-1gb-tor1-01.ssh: Flags [.], ack 717712, win 511, length 0
18:38:00.025678 IP 198.96.84.204.32005 > lamp-s-1vcpu-1gb-tor1-01.ssh: Flags [.], ack 718056, win 510, length 0
18:38:00.025684 IP 198.96.84.204.32005 > lamp-s-1vcpu-1gb-tor1-01.ssh: Flags [.], ack 718400, win 508, length 0
18:38:00.025692 IP 198.96.84.204.32005 > lamp-s-1vcpu-1gb-tor1-01.ssh: Flags [.], ack 719304, win 512, length 0
18:38:00.025698 IP 198.96.84.204.32005 > lamp-s-1vcpu-1gb-tor1-01.ssh: Flags [.], ack 719648, win 511, length 0
18:38:00.025703 IP 198.96.84.204.32005 > lamp-s-1vcpu-1gb-tor1-01.ssh: Flags [.], ack 719992, win 510, length 0
18:38:00.025906 IP lamp-s-1vcpu-1gb-tor1-01.ssh > 198.96.84.204.32005: Flags [P.], seq 724964:725928, ack 433, win 313, length 964
18:38:00.026026 IP lamp-s-1vcpu-1gb-tor1-01.ssh > 198.96.84.204.32005: Flags [P.], seq 725928:726100, ack 433, win 313, length 172
18:38:00.026136 IP lamp-s-1vcpu-1gb-tor1-01.ssh > 198.96.84.204.32005: Flags [P.], seq 726100:726272, ack 433, win 313, length 172
18:38:00.026244 IP lamp-s-1vcpu-1gb-tor1-01.ssh > 198.96.84.204.32005: Flags [P.], seq 726272:726444, ack 433, win 313, length 172
18:38:00.026349 IP lamp-s-1vcpu-1gb-tor1-01.ssh > 198.96.84.204.32005: Flags [P.], seq 726444:726616, ack 433, win 313, length 172
18:38:00.026461 IP lamp-s-1vcpu-1gb-tor1-01.ssh > 198.96.84.204.32005: Flags [P.], seq 726616:726788, ack 433, win 313, length 172
18:38:00.026565 IP lamp-s-1vcpu-1gb-tor1-01.ssh > 198.96.84.204.32005: Flags [P.], seq 726788:726960, ack 433, win 313, length 172
18:38:00.026670 IP lamp-s-1vcpu-1gb-tor1-01.ssh > 198.96.84.204.32005: Flags [P.], seq 726960:727132, ack 433, win 313, length 172
18:38:00.026774 IP lamp-s-1vcpu-1gb-tor1-01.ssh > 198.96.84.204.32005: Flags [P.], seq 727132:727304, ack 433, win 313, length 172
18:38:00.026876 IP lamp-s-1vcpu-1gb-tor1-01.ssh > 198.96.84.204.32005: Flags [P.], seq 727304:727476, ack 433, win 313, length 172
18:38:00.026980 IP lamp-s-1vcpu-1gb-tor1-01.ssh > 198.96.84.204.32005: Flags [P.], seq 727476:727648, ack 433, win 313, length 172
18:38:00.027082 IP lamp-s-1vcpu-1gb-tor1-01.ssh > 198.96.84.204.32005: Flags [P.], seq 727648:727820, ack 433, win 313, length 172
18:38:00.027185 IP lamp-s-1vcpu-1gb-tor1-01.ssh > 198.96.84.204.32005: Flags [P.], seq 727820:727992, ack 433, win 313, length 172
18:38:00.027324 IP lamp-s-1vcpu-1gb-tor1-01.ssh > 198.96.84.204.32005: Flags [P.], seq 727992:728164, ack 433, win 313, length 172
18:38:00.027479 IP lamp-s-1vcpu-1gb-tor1-01.ssh > 198.96.84.204.32005: Flags [P.], seq 728164:728336, ack 433, win 313, length 172
18:38:00.027576 IP 198.96.84.204.32005 > lamp-s-1vcpu-1gb-tor1-01.ssh: Flags [.], ack 720336, win 508, length 0
18:38:00.027595 IP 198.96.84.204.32005 > lamp-s-1vcpu-1gb-tor1-01.ssh: Flags [.], ack 721472, win 512, length 0
18:38:00.027603 IP 198.96.84.204.32005 > lamp-s-1vcpu-1gb-tor1-01.ssh: Flags [.], ack 721816, win 511, length 0
18:38:00.027609 IP 198.96.84.204.32005 > lamp-s-1vcpu-1gb-tor1-01.ssh: Flags [.], ack 722160, win 510, length 0
18:38:00.027615 IP 198.96.84.204.32005 > lamp-s-1vcpu-1gb-tor1-01.ssh: Flags [.], ack 722504, win 508, length 0
18:38:00.027621 IP 198.96.84.204.32005 > lamp-s-1vcpu-1gb-tor1-01.ssh: Flags [.], ack 722848, win 512, length 0
18:38:00.027627 IP 198.96.84.204.32005 > lamp-s-1vcpu-1gb-tor1-01.ssh: Flags [.], ack 723416, win 510, length 0
18:38:00.027828 IP lamp-s-1vcpu-1gb-tor1-01.ssh > 198.96.84.204.32005: Flags [P.], seq 728336:729300, ack 433, win 313, length 964
18:38:00.027947 IP lamp-s-1vcpu-1gb-tor1-01.ssh > 198.96.84.204.32005: Flags [P.], seq 729300:729472, ack 433, win 313, length 172
18:38:00.028096 IP lamp-s-1vcpu-1gb-tor1-01.ssh > 198.96.84.204.32005: Flags [P.], seq 729472:729644, ack 433, win 313, length 172
18:38:00.028241 IP lamp-s-1vcpu-1gb-tor1-01.ssh > 198.96.84.204.32005: Flags [P.], seq 729644:729816, ack 433, win 313, length 172
18:38:00.028351 IP lamp-s-1vcpu-1gb-tor1-01.ssh > 198.96.84.204.32005: Flags [P.], seq 729816:729988, ack 433, win 313, length 172
18:38:00.028456 IP lamp-s-1vcpu-1gb-tor1-01.ssh > 198.96.84.204.32005: Flags [P.], seq 729988:730160, ack 433, win 313, length 172
18:38:00.028560 IP lamp-s-1vcpu-1gb-tor1-01.ssh > 198.96.84.204.32005: Flags [P.], seq 730160:730332, ack 433, win 313, length 172
18:38:00.028664 IP lamp-s-1vcpu-1gb-tor1-01.ssh > 198.96.84.204.32005: Flags [P.], seq 730332:730504, ack 433, win 313, length 172
18:38:00.028769 IP lamp-s-1vcpu-1gb-tor1-01.ssh > 198.96.84.204.32005: Flags [P.], seq 730504:730676, ack 433, win 313, length 172
18:38:00.028873 IP lamp-s-1vcpu-1gb-tor1-01.ssh > 198.96.84.204.32005: Flags [P.], seq 730676:730848, ack 433, win 313, length 172
18:38:00.028976 IP lamp-s-1vcpu-1gb-tor1-01.ssh > 198.96.84.204.32005: Flags [P.], seq 730848:731020, ack 433, win 313, length 172
18:38:00.029079 IP lamp-s-1vcpu-1gb-tor1-01.ssh > 198.96.84.204.32005: Flags [P.], seq 731020:731192, ack 433, win 313, length 172
18:38:00.029182 IP lamp-s-1vcpu-1gb-tor1-01.ssh > 198.96.84.204.32005: Flags [P.], seq 731192:731364, ack 433, win 313, length 172
18:38:00.029285 IP lamp-s-1vcpu-1gb-tor1-01.ssh > 198.96.84.204.32005: Flags [P.], seq 731364:731536, ack 433, win 313, length 172
18:38:00.029334 IP 198.96.84.204.32005 > lamp-s-1vcpu-1gb-tor1-01.ssh: Flags [.], ack 723760, win 509, length 0
18:38:00.029352 IP 198.96.84.204.32005 > lamp-s-1vcpu-1gb-tor1-01.ssh: Flags [.], ack 724104, win 507, length 0
18:38:00.029359 IP 198.96.84.204.32005 > lamp-s-1vcpu-1gb-tor1-01.ssh: Flags [.], ack 724448, win 512, length 0
18:38:00.029364 IP 198.96.84.204.32005 > lamp-s-1vcpu-1gb-tor1-01.ssh: Flags [.], ack 724792, win 511, length 0
18:38:00.029530 IP lamp-s-1vcpu-1gb-tor1-01.ssh > 198.96.84.204.32005: Flags [P.], seq 731536:732156, ack 433, win 313, length 620
18:38:00.029646 IP lamp-s-1vcpu-1gb-tor1-01.ssh > 198.96.84.204.32005: Flags [P.], seq 732156:732328, ack 433, win 313, length 172
18:38:00.029752 IP lamp-s-1vcpu-1gb-tor1-01.ssh > 198.96.84.204.32005: Flags [P.], seq 732328:732500, ack 433, win 313, length 172
18:38:00.029856 IP lamp-s-1vcpu-1gb-tor1-01.ssh > 198.96.84.204.32005: Flags [P.], seq 732500:732672, ack 433, win 313, length 172
18:38:00.029961 IP lamp-s-1vcpu-1gb-tor1-01.ssh > 198.96.84.204.32005: Flags [P.], seq 732672:732844, ack 433, win 313, length 172
18:38:00.030137 IP lamp-s-1vcpu-1gb-tor1-01.ssh > 198.96.84.204.32005: Flags [P.], seq 732844:733016, ack 433, win 313, length 172
18:38:00.030278 IP lamp-s-1vcpu-1gb-tor1-01.ssh > 198.96.84.204.32005: Flags [P.], seq 733016:733188, ack 433, win 313, length 172
18:38:00.030393 IP lamp-s-1vcpu-1gb-tor1-01.ssh > 198.96.84.204.32005: Flags [P.], seq 733188:733360, ack 433, win 313, length 172
18:38:00.030502 IP lamp-s-1vcpu-1gb-tor1-01.ssh > 198.96.84.204.32005: Flags [P.], seq 733360:733532, ack 433, win 313, length 172
18:38:00.030608 IP lamp-s-1vcpu-1gb-tor1-01.ssh > 198.96.84.204.32005: Flags [P.], seq 733532:733704, ack 433, win 313, length 172
18:38:00.030718 IP lamp-s-1vcpu-1gb-tor1-01.ssh > 198.96.84.204.32005: Flags [P.], seq 733704:733876, ack 433, win 313, length 172
18:38:00.030750 IP 198.96.84.204.32005 > lamp-s-1vcpu-1gb-tor1-01.ssh: Flags [.], ack 725928, win 512, length 0
18:38:00.030764 IP 198.96.84.204.32005 > lamp-s-1vcpu-1gb-tor1-01.ssh: Flags [.], ack 726272, win 511, length 0
18:38:00.030770 IP 198.96.84.204.32005 > lamp-s-1vcpu-1gb-tor1-01.ssh: Flags [.], ack 726616, win 510, length 0
18:38:00.030776 IP 198.96.84.204.32005 > lamp-s-1vcpu-1gb-tor1-01.ssh: Flags [.], ack 726960, win 508, length 0
18:38:00.030782 IP 198.96.84.204.32005 > lamp-s-1vcpu-1gb-tor1-01.ssh: Flags [.], ack 727304, win 512, length 0
18:38:00.030788 IP 198.96.84.204.32005 > lamp-s-1vcpu-1gb-tor1-01.ssh: Flags [.], ack 727648, win 511, length 0
18:38:00.031003 IP lamp-s-1vcpu-1gb-tor1-01.ssh > 198.96.84.204.32005: Flags [P.], seq 733876:734720, ack 433, win 313, length 844
18:38:00.031123 IP lamp-s-1vcpu-1gb-tor1-01.ssh > 198.96.84.204.32005: Flags [P.], seq 734720:734892, ack 433, win 313, length 172
18:38:00.031233 IP lamp-s-1vcpu-1gb-tor1-01.ssh > 198.96.84.204.32005: Flags [P.], seq 734892:735064, ack 433, win 313, length 172
18:38:00.031340 IP lamp-s-1vcpu-1gb-tor1-01.ssh > 198.96.84.204.32005: Flags [P.], seq 735064:735236, ack 433, win 313, length 172
18:38:00.031447 IP lamp-s-1vcpu-1gb-tor1-01.ssh > 198.96.84.204.32005: Flags [P.], seq 735236:735408, ack 433, win 313, length 172
18:38:00.031552 IP lamp-s-1vcpu-1gb-tor1-01.ssh > 198.96.84.204.32005: Flags [P.], seq 735408:735580, ack 433, win 313, length 172
18:38:00.031656 IP lamp-s-1vcpu-1gb-tor1-01.ssh > 198.96.84.204.32005: Flags [P.], seq 735580:735752, ack 433, win 313, length 172
18:38:00.031767 IP lamp-s-1vcpu-1gb-tor1-01.ssh > 198.96.84.204.32005: Flags [P.], seq 735752:735924, ack 433, win 313, length 172
18:38:00.031880 IP lamp-s-1vcpu-1gb-tor1-01.ssh > 198.96.84.204.32005: Flags [P.], seq 735924:736096, ack 433, win 313, length 172
18:38:00.031985 IP lamp-s-1vcpu-1gb-tor1-01.ssh > 198.96.84.204.32005: Flags [P.], seq 736096:736268, ack 433, win 313, length 172
18:38:00.032063 IP 198.96.84.204.32005 > lamp-s-1vcpu-1gb-tor1-01.ssh: Flags [.], ack 728336, win 508, length 0
18:38:00.032080 IP 198.96.84.204.32005 > lamp-s-1vcpu-1gb-tor1-01.ssh: Flags [.], ack 729472, win 512, length 0
18:38:00.032237 IP lamp-s-1vcpu-1gb-tor1-01.ssh > 198.96.84.204.32005: Flags [P.], seq 736268:736664, ack 433, win 313, length 396
18:38:00.032355 IP lamp-s-1vcpu-1gb-tor1-01.ssh > 198.96.84.204.32005: Flags [P.], seq 736664:736836, ack 433, win 313, length 172
18:38:00.032464 IP lamp-s-1vcpu-1gb-tor1-01.ssh > 198.96.84.204.32005: Flags [P.], seq 736836:737008, ack 433, win 313, length 172
18:38:00.032569 IP lamp-s-1vcpu-1gb-tor1-01.ssh > 198.96.84.204.32005: Flags [P.], seq 737008:737180, ack 433, win 313, length 172
18:38:00.032673 IP lamp-s-1vcpu-1gb-tor1-01.ssh > 198.96.84.204.32005: Flags [P.], seq 737180:737352, ack 433, win 313, length 172
18:38:00.032777 IP lamp-s-1vcpu-1gb-tor1-01.ssh > 198.96.84.204.32005: Flags [P.], seq 737352:737524, ack 433, win 313, length 172
18:38:00.032882 IP lamp-s-1vcpu-1gb-tor1-01.ssh > 198.96.84.204.32005: Flags [P.], seq 737524:737696, ack 433, win 313, length 172
18:38:00.032986 IP lamp-s-1vcpu-1gb-tor1-01.ssh > 198.96.84.204.32005: Flags [P.], seq 737696:737868, ack 433, win 313, length 172
18:38:00.033091 IP lamp-s-1vcpu-1gb-tor1-01.ssh > 198.96.84.204.32005: Flags [P.], seq 737868:738040, ack 433, win 313, length 172
18:38:00.033194 IP lamp-s-1vcpu-1gb-tor1-01.ssh > 198.96.84.204.32005: Flags [P.], seq 738040:738212, ack 433, win 313, length 172
18:38:00.033305 IP lamp-s-1vcpu-1gb-tor1-01.ssh > 198.96.84.204.32005: Flags [P.], seq 738212:738384, ack 433, win 313, length 172
18:38:00.033410 IP lamp-s-1vcpu-1gb-tor1-01.ssh > 198.96.84.204.32005: Flags [P.], seq 738384:738556, ack 433, win 313, length 172
18:38:00.033512 IP lamp-s-1vcpu-1gb-tor1-01.ssh > 198.96.84.204.32005: Flags [P.], seq 738556:738728, ack 433, win 313, length 172
18:38:00.033616 IP lamp-s-1vcpu-1gb-tor1-01.ssh > 198.96.84.204.32005: Flags [P.], seq 738728:738900, ack 433, win 313, length 172
18:38:00.033726 IP lamp-s-1vcpu-1gb-tor1-01.ssh > 198.96.84.204.32005: Flags [P.], seq 738900:739072, ack 433, win 313, length 172
18:38:00.033833 IP lamp-s-1vcpu-1gb-tor1-01.ssh > 198.96.84.204.32005: Flags [P.], seq 739072:739244, ack 433, win 313, length 172
18:38:00.033937 IP lamp-s-1vcpu-1gb-tor1-01.ssh > 198.96.84.204.32005: Flags [P.], seq 739244:739416, ack 433, win 313, length 172
18:38:00.034040 IP lamp-s-1vcpu-1gb-tor1-01.ssh > 198.96.84.204.32005: Flags [P.], seq 739416:739588, ack 433, win 313, length 172
18:38:00.034144 IP lamp-s-1vcpu-1gb-tor1-01.ssh > 198.96.84.204.32005: Flags [P.], seq 739588:739760, ack 433, win 313, length 172
18:38:00.034254 IP lamp-s-1vcpu-1gb-tor1-01.ssh > 198.96.84.204.32005: Flags [P.], seq 739760:739932, ack 433, win 313, length 172
18:38:00.034365 IP lamp-s-1vcpu-1gb-tor1-01.ssh > 198.96.84.204.32005: Flags [P.], seq 739932:740104, ack 433, win 313, length 172
18:38:00.034473 IP lamp-s-1vcpu-1gb-tor1-01.ssh > 198.96.84.204.32005: Flags [P.], seq 740104:740276, ack 433, win 313, length 172
18:38:00.034582 IP lamp-s-1vcpu-1gb-tor1-01.ssh > 198.96.84.204.32005: Flags [P.], seq 740276:740448, ack 433, win 313, length 172
18:38:00.034686 IP lamp-s-1vcpu-1gb-tor1-01.ssh > 198.96.84.204.32005: Flags [P.], seq 740448:740620, ack 433, win 313, length 172
18:38:00.034831 IP lamp-s-1vcpu-1gb-tor1-01.ssh > 198.96.84.204.32005: Flags [P.], seq 740620:740792, ack 433, win 313, length 172
18:38:00.034945 IP 198.96.84.204.32005 > lamp-s-1vcpu-1gb-tor1-01.ssh: Flags [.], ack 729816, win 511, length 0
18:38:00.034970 IP 198.96.84.204.32005 > lamp-s-1vcpu-1gb-tor1-01.ssh: Flags [.], ack 730160, win 510, length 0
18:38:00.034978 IP 198.96.84.204.32005 > lamp-s-1vcpu-1gb-tor1-01.ssh: Flags [.], ack 730504, win 508, length 0
18:38:00.034984 IP 198.96.84.204.32005 > lamp-s-1vcpu-1gb-tor1-01.ssh: Flags [.], ack 730848, win 512, length 0
18:38:00.034990 IP 198.96.84.204.32005 > lamp-s-1vcpu-1gb-tor1-01.ssh: Flags [.], ack 731192, win 511, length 0
18:38:00.034996 IP 198.96.84.204.32005 > lamp-s-1vcpu-1gb-tor1-01.ssh: Flags [.], ack 731536, win 510, length 0
18:38:00.035002 IP 198.96.84.204.32005 > lamp-s-1vcpu-1gb-tor1-01.ssh: Flags [.], ack 732328, win 512, length 0
18:38:00.035221 IP lamp-s-1vcpu-1gb-tor1-01.ssh > 198.96.84.204.32005: Flags [P.], seq 740792:741756, ack 433, win 313, length 964
18:38:00.035384 IP lamp-s-1vcpu-1gb-tor1-01.ssh > 198.96.84.204.32005: Flags [P.], seq 741756:741928, ack 433, win 313, length 172
18:38:00.035536 IP lamp-s-1vcpu-1gb-tor1-01.ssh > 198.96.84.204.32005: Flags [P.], seq 741928:742100, ack 433, win 313, length 172
18:38:00.035661 IP lamp-s-1vcpu-1gb-tor1-01.ssh > 198.96.84.204.32005: Flags [P.], seq 742100:742272, ack 433, win 313, length 172
18:38:00.035829 IP lamp-s-1vcpu-1gb-tor1-01.ssh > 198.96.84.204.32005: Flags [P.], seq 742272:742444, ack 433, win 313, length 172
18:38:00.035964 IP lamp-s-1vcpu-1gb-tor1-01.ssh > 198.96.84.204.32005: Flags [P.], seq 742444:742616, ack 433, win 313, length 172
18:38:00.036118 IP lamp-s-1vcpu-1gb-tor1-01.ssh > 198.96.84.204.32005: Flags [P.], seq 742616:742788, ack 433, win 313, length 172
18:38:00.036247 IP 198.96.84.204.32005 > lamp-s-1vcpu-1gb-tor1-01.ssh: Flags [.], ack 733016, win 510, length 0
18:38:00.036356 IP lamp-s-1vcpu-1gb-tor1-01.ssh > 198.96.84.204.32005: Flags [P.], seq 742788:742960, ack 433, win 313, length 172
18:38:00.036507 IP lamp-s-1vcpu-1gb-tor1-01.ssh > 198.96.84.204.32005: Flags [P.], seq 742960:743108, ack 433, win 313, length 148
18:38:00.036677 IP lamp-s-1vcpu-1gb-tor1-01.ssh > 198.96.84.204.32005: Flags [P.], seq 743108:743280, ack 433, win 313, length 172
18:38:00.036764 IP lamp-s-1vcpu-1gb-tor1-01.ssh > 198.96.84.204.32005: Flags [P.], seq 743280:743452, ack 433, win 313, length 172
18:38:00.036964 IP lamp-s-1vcpu-1gb-tor1-01.ssh > 198.96.84.204.32005: Flags [P.], seq 743452:743752, ack 433, win 313, length 300
18:38:00.037114 IP lamp-s-1vcpu-1gb-tor1-01.ssh > 198.96.84.204.32005: Flags [P.], seq 743752:743924, ack 433, win 313, length 172
18:38:00.037262 IP lamp-s-1vcpu-1gb-tor1-01.ssh > 198.96.84.204.32005: Flags [P.], seq 743924:744096, ack 433, win 313, length 172
18:38:00.037435 IP lamp-s-1vcpu-1gb-tor1-01.ssh > 198.96.84.204.32005: Flags [P.], seq 744096:744268, ack 433, win 313, length 172
18:38:00.037587 IP lamp-s-1vcpu-1gb-tor1-01.ssh > 198.96.84.204.32005: Flags [P.], seq 744268:744440, ack 433, win 313, length 172
18:38:00.037732 IP lamp-s-1vcpu-1gb-tor1-01.ssh > 198.96.84.204.32005: Flags [P.], seq 744440:744612, ack 433, win 313, length 172
18:38:00.037869 IP lamp-s-1vcpu-1gb-tor1-01.ssh > 198.96.84.204.32005: Flags [P.], seq 744612:744784, ack 433, win 313, length 172
18:38:00.037980 IP lamp-s-1vcpu-1gb-tor1-01.ssh > 198.96.84.204.32005: Flags [P.], seq 744784:744956, ack 433, win 313, length 172
18:38:00.038106 IP lamp-s-1vcpu-1gb-tor1-01.ssh > 198.96.84.204.32005: Flags [P.], seq 744956:745128, ack 433, win 313, length 172
18:38:00.038258 IP lamp-s-1vcpu-1gb-tor1-01.ssh > 198.96.84.204.32005: Flags [P.], seq 745128:745300, ack 433, win 313, length 172
18:38:00.038446 IP lamp-s-1vcpu-1gb-tor1-01.ssh > 198.96.84.204.32005: Flags [P.], seq 745300:745472, ack 433, win 313, length 172
18:38:00.038620 IP lamp-s-1vcpu-1gb-tor1-01.ssh > 198.96.84.204.32005: Flags [P.], seq 745472:745644, ack 433, win 313, length 172
18:38:00.038775 IP lamp-s-1vcpu-1gb-tor1-01.ssh > 198.96.84.204.32005: Flags [P.], seq 745644:745816, ack 433, win 313, length 172
18:38:00.038955 IP lamp-s-1vcpu-1gb-tor1-01.ssh > 198.96.84.204.32005: Flags [P.], seq 745816:745988, ack 433, win 313, length 172
18:38:00.039146 IP lamp-s-1vcpu-1gb-tor1-01.ssh > 198.96.84.204.32005: Flags [P.], seq 745988:746160, ack 433, win 313, length 172
18:38:00.039322 IP lamp-s-1vcpu-1gb-tor1-01.ssh > 198.96.84.204.32005: Flags [P.], seq 746160:746332, ack 433, win 313, length 172
18:38:00.039498 IP lamp-s-1vcpu-1gb-tor1-01.ssh > 198.96.84.204.32005: Flags [P.], seq 746332:746504, ack 433, win 313, length 172
18:38:00.039623 IP lamp-s-1vcpu-1gb-tor1-01.ssh > 198.96.84.204.32005: Flags [P.], seq 746504:746676, ack 433, win 313, length 172
18:38:00.039730 IP lamp-s-1vcpu-1gb-tor1-01.ssh > 198.96.84.204.32005: Flags [P.], seq 746676:746848, ack 433, win 313, length 172
18:38:00.039819 IP 198.96.84.204.32005 > lamp-s-1vcpu-1gb-tor1-01.ssh: Flags [.], ack 733360, win 508, length 0
18:38:00.039839 IP 198.96.84.204.32005 > lamp-s-1vcpu-1gb-tor1-01.ssh: Flags [.], ack 733704, win 512, length 0
18:38:00.039847 IP 198.96.84.204.32005 > lamp-s-1vcpu-1gb-tor1-01.ssh: Flags [.], ack 734720, win 508, length 0
18:38:00.039853 IP 198.96.84.204.32005 > lamp-s-1vcpu-1gb-tor1-01.ssh: Flags [.], ack 735064, win 512, length 0
18:38:00.039860 IP 198.96.84.204.32005 > lamp-s-1vcpu-1gb-tor1-01.ssh: Flags [.], ack 735408, win 511, length 0
18:38:00.039866 IP 198.96.84.204.32005 > lamp-s-1vcpu-1gb-tor1-01.ssh: Flags [.], ack 735752, win 510, length 0
18:38:00.039871 IP 198.96.84.204.32005 > lamp-s-1vcpu-1gb-tor1-01.ssh: Flags [.], ack 736096, win 508, length 0
18:38:00.040203 IP lamp-s-1vcpu-1gb-tor1-01.ssh > 198.96.84.204.32005: Flags [P.], seq 746848:747812, ack 433, win 313, length 964
18:38:00.040366 IP lamp-s-1vcpu-1gb-tor1-01.ssh > 198.96.84.204.32005: Flags [P.], seq 747812:747984, ack 433, win 313, length 172
18:38:00.040512 IP lamp-s-1vcpu-1gb-tor1-01.ssh > 198.96.84.204.32005: Flags [P.], seq 747984:748156, ack 433, win 313, length 172
18:38:00.040623 IP lamp-s-1vcpu-1gb-tor1-01.ssh > 198.96.84.204.32005: Flags [P.], seq 748156:748328, ack 433, win 313, length 172
18:38:00.040728 IP lamp-s-1vcpu-1gb-tor1-01.ssh > 198.96.84.204.32005: Flags [P.], seq 748328:748500, ack 433, win 313, length 172
18:38:00.040832 IP lamp-s-1vcpu-1gb-tor1-01.ssh > 198.96.84.204.32005: Flags [P.], seq 748500:748672, ack 433, win 313, length 172
18:38:00.040991 IP lamp-s-1vcpu-1gb-tor1-01.ssh > 198.96.84.204.32005: Flags [P.], seq 748672:748844, ack 433, win 313, length 172
18:38:00.041101 IP 198.96.84.204.32005 > lamp-s-1vcpu-1gb-tor1-01.ssh: Flags [.], ack 737008, win 511, length 0
18:38:00.041120 IP 198.96.84.204.32005 > lamp-s-1vcpu-1gb-tor1-01.ssh: Flags [.], ack 737352, win 510, length 0
18:38:00.041126 IP 198.96.84.204.32005 > lamp-s-1vcpu-1gb-tor1-01.ssh: Flags [.], ack 737696, win 508, length 0
18:38:00.041133 IP 198.96.84.204.32005 > lamp-s-1vcpu-1gb-tor1-01.ssh: Flags [.], ack 738040, win 512, length 0
18:38:00.041139 IP 198.96.84.204.32005 > lamp-s-1vcpu-1gb-tor1-01.ssh: Flags [.], ack 738384, win 511, length 0
18:38:00.041145 IP 198.96.84.204.32005 > lamp-s-1vcpu-1gb-tor1-01.ssh: Flags [.], ack 738728, win 510, length 0
18:38:00.041451 IP lamp-s-1vcpu-1gb-tor1-01.ssh > 198.96.84.204.32005: Flags [P.], seq 748844:749688, ack 433, win 313, length 844
18:38:00.041634 IP lamp-s-1vcpu-1gb-tor1-01.ssh > 198.96.84.204.32005: Flags [P.], seq 749688:749860, ack 433, win 313, length 172
18:38:00.041838 IP lamp-s-1vcpu-1gb-tor1-01.ssh > 198.96.84.204.32005: Flags [P.], seq 749860:750032, ack 433, win 313, length 172
18:38:00.042002 IP lamp-s-1vcpu-1gb-tor1-01.ssh > 198.96.84.204.32005: Flags [P.], seq 750032:750204, ack 433, win 313, length 172
18:38:00.042122 IP lamp-s-1vcpu-1gb-tor1-01.ssh > 198.96.84.204.32005: Flags [P.], seq 750204:750376, ack 433, win 313, length 172
18:38:00.042229 IP lamp-s-1vcpu-1gb-tor1-01.ssh > 198.96.84.204.32005: Flags [P.], seq 750376:750548, ack 433, win 313, length 172
18:38:00.042335 IP lamp-s-1vcpu-1gb-tor1-01.ssh > 198.96.84.204.32005: Flags [P.], seq 750548:750720, ack 433, win 313, length 172
18:38:00.042439 IP lamp-s-1vcpu-1gb-tor1-01.ssh > 198.96.84.204.32005: Flags [P.], seq 750720:750892, ack 433, win 313, length 172
18:38:00.042542 IP lamp-s-1vcpu-1gb-tor1-01.ssh > 198.96.84.204.32005: Flags [P.], seq 750892:751064, ack 433, win 313, length 172
18:38:00.042650 IP lamp-s-1vcpu-1gb-tor1-01.ssh > 198.96.84.204.32005: Flags [P.], seq 751064:751236, ack 433, win 313, length 172
18:38:00.042755 IP lamp-s-1vcpu-1gb-tor1-01.ssh > 198.96.84.204.32005: Flags [P.], seq 751236:751408, ack 433, win 313, length 172
18:38:00.042885 IP 198.96.84.204.32005 > lamp-s-1vcpu-1gb-tor1-01.ssh: Flags [.], ack 739072, win 508, length 0
18:38:00.042916 IP 198.96.84.204.32005 > lamp-s-1vcpu-1gb-tor1-01.ssh: Flags [.], ack 739416, win 512, length 0
18:38:00.042928 IP 198.96.84.204.32005 > lamp-s-1vcpu-1gb-tor1-01.ssh: Flags [.], ack 739760, win 511, length 0
