18:44:21.486776 IP lamp-s-1vcpu-1gb-tor1-01.ssh > 198.96.84.204.15419: Flags [P.], seq 1623220:1623392, ack 973, win 313, length 172
18:44:21.486879 IP lamp-s-1vcpu-1gb-tor1-01.ssh > 198.96.84.204.15419: Flags [P.], seq 1623392:1623564, ack 973, win 313, length 172
18:44:21.486983 IP lamp-s-1vcpu-1gb-tor1-01.ssh > 198.96.84.204.15419: Flags [P.], seq 1623564:1623736, ack 973, win 313, length 172
18:44:21.487086 IP lamp-s-1vcpu-1gb-tor1-01.ssh > 198.96.84.204.15419: Flags [P.], seq 1623736:1623908, ack 973, win 313, length 172
18:44:21.487189 IP lamp-s-1vcpu-1gb-tor1-01.ssh > 198.96.84.204.15419: Flags [P.], seq 1623908:1624080, ack 973, win 313, length 172
18:44:21.487293 IP lamp-s-1vcpu-1gb-tor1-01.ssh > 198.96.84.204.15419: Flags [P.], seq 1624080:1624252, ack 973, win 313, length 172
18:44:21.487353 IP 198.96.84.204.15419 > lamp-s-1vcpu-1gb-tor1-01.ssh: Flags [.], ack 1616012, win 512, length 0
18:44:21.487392 IP 198.96.84.204.15419 > lamp-s-1vcpu-1gb-tor1-01.ssh: Flags [.], ack 1616356, win 511, length 0
18:44:21.487400 IP 198.96.84.204.15419 > lamp-s-1vcpu-1gb-tor1-01.ssh: Flags [.], ack 1616700, win 510, length 0
18:44:21.487408 IP 198.96.84.204.15419 > lamp-s-1vcpu-1gb-tor1-01.ssh: Flags [.], ack 1617044, win 508, length 0
18:44:21.487414 IP 198.96.84.204.15419 > lamp-s-1vcpu-1gb-tor1-01.ssh: Flags [.], ack 1617388, win 512, length 0
18:44:21.487419 IP 198.96.84.204.15419 > lamp-s-1vcpu-1gb-tor1-01.ssh: Flags [.], ack 1617732, win 511, length 0
18:44:21.487606 IP lamp-s-1vcpu-1gb-tor1-01.ssh > 198.96.84.204.15419: Flags [P.], seq 1624252:1625104, ack 973, win 313, length 852
18:44:21.487723 IP lamp-s-1vcpu-1gb-tor1-01.ssh > 198.96.84.204.15419: Flags [P.], seq 1625104:1625276, ack 973, win 313, length 172
18:44:21.487829 IP lamp-s-1vcpu-1gb-tor1-01.ssh > 198.96.84.204.15419: Flags [P.], seq 1625276:1625448, ack 973, win 313, length 172
18:44:21.487934 IP lamp-s-1vcpu-1gb-tor1-01.ssh > 198.96.84.204.15419: Flags [P.], seq 1625448:1625620, ack 973, win 313, length 172
18:44:21.488082 IP lamp-s-1vcpu-1gb-tor1-01.ssh > 198.96.84.204.15419: Flags [P.], seq 1625620:1625792, ack 973, win 313, length 172
18:44:21.488201 IP lamp-s-1vcpu-1gb-tor1-01.ssh > 198.96.84.204.15419: Flags [P.], seq 1625792:1625964, ack 973, win 313, length 172
18:44:21.488311 IP lamp-s-1vcpu-1gb-tor1-01.ssh > 198.96.84.204.15419: Flags [P.], seq 1625964:1626136, ack 973, win 313, length 172
18:44:21.488416 IP lamp-s-1vcpu-1gb-tor1-01.ssh > 198.96.84.204.15419: Flags [P.], seq 1626136:1626308, ack 973, win 313, length 172
18:44:21.488521 IP lamp-s-1vcpu-1gb-tor1-01.ssh > 198.96.84.204.15419: Flags [P.], seq 1626308:1626480, ack 973, win 313, length 172
18:44:21.488630 IP lamp-s-1vcpu-1gb-tor1-01.ssh > 198.96.84.204.15419: Flags [P.], seq 1626480:1626652, ack 973, win 313, length 172
18:44:21.488740 IP lamp-s-1vcpu-1gb-tor1-01.ssh > 198.96.84.204.15419: Flags [P.], seq 1626652:1626824, ack 973, win 313, length 172
18:44:21.488767 IP 198.96.84.204.15419 > lamp-s-1vcpu-1gb-tor1-01.ssh: Flags [.], ack 1618756, win 512, length 0
18:44:21.488776 IP 198.96.84.204.15419 > lamp-s-1vcpu-1gb-tor1-01.ssh: Flags [.], ack 1619100, win 511, length 0
18:44:21.488780 IP 198.96.84.204.15419 > lamp-s-1vcpu-1gb-tor1-01.ssh: Flags [.], ack 1619444, win 510, length 0
18:44:21.488784 IP 198.96.84.204.15419 > lamp-s-1vcpu-1gb-tor1-01.ssh: Flags [.], ack 1619788, win 508, length 0
18:44:21.488787 IP 198.96.84.204.15419 > lamp-s-1vcpu-1gb-tor1-01.ssh: Flags [.], ack 1620132, win 512, length 0
18:44:21.488792 IP 198.96.84.204.15419 > lamp-s-1vcpu-1gb-tor1-01.ssh: Flags [.], ack 1620476, win 511, length 0
18:44:21.489015 IP lamp-s-1vcpu-1gb-tor1-01.ssh > 198.96.84.204.15419: Flags [P.], seq 1626824:1627676, ack 973, win 313, length 852
18:44:21.489137 IP lamp-s-1vcpu-1gb-tor1-01.ssh > 198.96.84.204.15419: Flags [P.], seq 1627676:1627848, ack 973, win 313, length 172
18:44:21.489246 IP lamp-s-1vcpu-1gb-tor1-01.ssh > 198.96.84.204.15419: Flags [P.], seq 1627848:1628020, ack 973, win 313, length 172
18:44:21.489352 IP lamp-s-1vcpu-1gb-tor1-01.ssh > 198.96.84.204.15419: Flags [P.], seq 1628020:1628192, ack 973, win 313, length 172
18:44:21.489457 IP lamp-s-1vcpu-1gb-tor1-01.ssh > 198.96.84.204.15419: Flags [P.], seq 1628192:1628364, ack 973, win 313, length 172
18:44:21.489562 IP lamp-s-1vcpu-1gb-tor1-01.ssh > 198.96.84.204.15419: Flags [P.], seq 1628364:1628536, ack 973, win 313, length 172
18:44:21.489668 IP lamp-s-1vcpu-1gb-tor1-01.ssh > 198.96.84.204.15419: Flags [P.], seq 1628536:1628708, ack 973, win 313, length 172
18:44:21.489772 IP lamp-s-1vcpu-1gb-tor1-01.ssh > 198.96.84.204.15419: Flags [P.], seq 1628708:1628880, ack 973, win 313, length 172
18:44:21.489877 IP lamp-s-1vcpu-1gb-tor1-01.ssh > 198.96.84.204.15419: Flags [P.], seq 1628880:1629052, ack 973, win 313, length 172
18:44:21.489982 IP lamp-s-1vcpu-1gb-tor1-01.ssh > 198.96.84.204.15419: Flags [P.], seq 1629052:1629224, ack 973, win 313, length 172
18:44:21.490089 IP lamp-s-1vcpu-1gb-tor1-01.ssh > 198.96.84.204.15419: Flags [P.], seq 1629224:1629396, ack 973, win 313, length 172
18:44:21.490194 IP lamp-s-1vcpu-1gb-tor1-01.ssh > 198.96.84.204.15419: Flags [P.], seq 1629396:1629568, ack 973, win 313, length 172
18:44:21.490299 IP lamp-s-1vcpu-1gb-tor1-01.ssh > 198.96.84.204.15419: Flags [P.], seq 1629568:1629740, ack 973, win 313, length 172
18:44:21.490404 IP lamp-s-1vcpu-1gb-tor1-01.ssh > 198.96.84.204.15419: Flags [P.], seq 1629740:1629912, ack 973, win 313, length 172
18:44:21.490509 IP lamp-s-1vcpu-1gb-tor1-01.ssh > 198.96.84.204.15419: Flags [P.], seq 1629912:1630084, ack 973, win 313, length 172
18:44:21.490614 IP lamp-s-1vcpu-1gb-tor1-01.ssh > 198.96.84.204.15419: Flags [P.], seq 1630084:1630256, ack 973, win 313, length 172
18:44:21.490719 IP lamp-s-1vcpu-1gb-tor1-01.ssh > 198.96.84.204.15419: Flags [P.], seq 1630256:1630428, ack 973, win 313, length 172
18:44:21.490824 IP lamp-s-1vcpu-1gb-tor1-01.ssh > 198.96.84.204.15419: Flags [P.], seq 1630428:1630600, ack 973, win 313, length 172
18:44:21.490931 IP lamp-s-1vcpu-1gb-tor1-01.ssh > 198.96.84.204.15419: Flags [P.], seq 1630600:1630772, ack 973, win 313, length 172
18:44:21.491038 IP lamp-s-1vcpu-1gb-tor1-01.ssh > 198.96.84.204.15419: Flags [P.], seq 1630772:1630944, ack 973, win 313, length 172
18:44:21.491143 IP lamp-s-1vcpu-1gb-tor1-01.ssh > 198.96.84.204.15419: Flags [P.], seq 1630944:1631116, ack 973, win 313, length 172
18:44:21.491249 IP lamp-s-1vcpu-1gb-tor1-01.ssh > 198.96.84.204.15419: Flags [P.], seq 1631116:1631288, ack 973, win 313, length 172
18:44:21.491353 IP lamp-s-1vcpu-1gb-tor1-01.ssh > 198.96.84.204.15419: Flags [P.], seq 1631288:1631460, ack 973, win 313, length 172
18:44:21.491459 IP lamp-s-1vcpu-1gb-tor1-01.ssh > 198.96.84.204.15419: Flags [P.], seq 1631460:1631632, ack 973, win 313, length 172
18:44:21.491564 IP lamp-s-1vcpu-1gb-tor1-01.ssh > 198.96.84.204.15419: Flags [P.], seq 1631632:1631804, ack 973, win 313, length 172
18:44:21.491668 IP lamp-s-1vcpu-1gb-tor1-01.ssh > 198.96.84.204.15419: Flags [P.], seq 1631804:1631976, ack 973, win 313, length 172
18:44:21.491777 IP lamp-s-1vcpu-1gb-tor1-01.ssh > 198.96.84.204.15419: Flags [P.], seq 1631976:1632148, ack 973, win 313, length 172
18:44:21.491884 IP lamp-s-1vcpu-1gb-tor1-01.ssh > 198.96.84.204.15419: Flags [P.], seq 1632148:1632320, ack 973, win 313, length 172
18:44:21.491990 IP lamp-s-1vcpu-1gb-tor1-01.ssh > 198.96.84.204.15419: Flags [P.], seq 1632320:1632492, ack 973, win 313, length 172
18:44:21.492168 IP lamp-s-1vcpu-1gb-tor1-01.ssh > 198.96.84.204.15419: Flags [P.], seq 1632492:1632664, ack 973, win 313, length 172
18:44:21.492328 IP 198.96.84.204.15419 > lamp-s-1vcpu-1gb-tor1-01.ssh: Flags [.], ack 1621500, win 512, length 0
18:44:21.492349 IP 198.96.84.204.15419 > lamp-s-1vcpu-1gb-tor1-01.ssh: Flags [.], ack 1621844, win 511, length 0
18:44:21.492355 IP 198.96.84.204.15419 > lamp-s-1vcpu-1gb-tor1-01.ssh: Flags [.], ack 1622188, win 510, length 0
18:44:21.492362 IP 198.96.84.204.15419 > lamp-s-1vcpu-1gb-tor1-01.ssh: Flags [.], ack 1622532, win 508, length 0
18:44:21.492390 IP 198.96.84.204.15419 > lamp-s-1vcpu-1gb-tor1-01.ssh: Flags [.], ack 1622876, win 512, length 0
18:44:21.492400 IP 198.96.84.204.15419 > lamp-s-1vcpu-1gb-tor1-01.ssh: Flags [.], ack 1623220, win 511, length 0
18:44:21.492406 IP 198.96.84.204.15419 > lamp-s-1vcpu-1gb-tor1-01.ssh: Flags [.], ack 1623564, win 510, length 0
18:44:21.492588 IP lamp-s-1vcpu-1gb-tor1-01.ssh > 198.96.84.204.15419: Flags [P.], seq 1632664:1632836, ack 973, win 313, length 172
18:44:21.492668 IP lamp-s-1vcpu-1gb-tor1-01.ssh > 198.96.84.204.15419: Flags [P.], seq 1632836:1633672, ack 973, win 313, length 836
18:44:21.492796 IP lamp-s-1vcpu-1gb-tor1-01.ssh > 198.96.84.204.15419: Flags [P.], seq 1633672:1633980, ack 973, win 313, length 308
18:44:21.492903 IP lamp-s-1vcpu-1gb-tor1-01.ssh > 198.96.84.204.15419: Flags [P.], seq 1633980:1634152, ack 973, win 313, length 172
18:44:21.493006 IP lamp-s-1vcpu-1gb-tor1-01.ssh > 198.96.84.204.15419: Flags [P.], seq 1634152:1634324, ack 973, win 313, length 172
18:44:21.493165 IP lamp-s-1vcpu-1gb-tor1-01.ssh > 198.96.84.204.15419: Flags [P.], seq 1634324:1634496, ack 973, win 313, length 172
18:44:21.493312 IP lamp-s-1vcpu-1gb-tor1-01.ssh > 198.96.84.204.15419: Flags [P.], seq 1634496:1634668, ack 973, win 313, length 172
18:44:21.493426 IP lamp-s-1vcpu-1gb-tor1-01.ssh > 198.96.84.204.15419: Flags [P.], seq 1634668:1634840, ack 973, win 313, length 172
18:44:21.493532 IP lamp-s-1vcpu-1gb-tor1-01.ssh > 198.96.84.204.15419: Flags [P.], seq 1634840:1635012, ack 973, win 313, length 172
18:44:21.493637 IP lamp-s-1vcpu-1gb-tor1-01.ssh > 198.96.84.204.15419: Flags [P.], seq 1635012:1635184, ack 973, win 313, length 172
18:44:21.493674 IP 198.96.84.204.15419 > lamp-s-1vcpu-1gb-tor1-01.ssh: Flags [.], ack 1625620, win 512, length 0
18:44:21.493691 IP 198.96.84.204.15419 > lamp-s-1vcpu-1gb-tor1-01.ssh: Flags [.], ack 1625964, win 511, length 0
18:44:21.493697 IP 198.96.84.204.15419 > lamp-s-1vcpu-1gb-tor1-01.ssh: Flags [.], ack 1626308, win 510, length 0
18:44:21.493702 IP 198.96.84.204.15419 > lamp-s-1vcpu-1gb-tor1-01.ssh: Flags [.], ack 1626652, win 508, length 0
18:44:21.493879 IP lamp-s-1vcpu-1gb-tor1-01.ssh > 198.96.84.204.15419: Flags [P.], seq 1635184:1635812, ack 973, win 313, length 628
18:44:21.494003 IP lamp-s-1vcpu-1gb-tor1-01.ssh > 198.96.84.204.15419: Flags [P.], seq 1635812:1635984, ack 973, win 313, length 172
18:44:21.494110 IP lamp-s-1vcpu-1gb-tor1-01.ssh > 198.96.84.204.15419: Flags [P.], seq 1635984:1636156, ack 973, win 313, length 172
18:44:21.494214 IP lamp-s-1vcpu-1gb-tor1-01.ssh > 198.96.84.204.15419: Flags [P.], seq 1636156:1636328, ack 973, win 313, length 172
18:44:21.494317 IP lamp-s-1vcpu-1gb-tor1-01.ssh > 198.96.84.204.15419: Flags [P.], seq 1636328:1636500, ack 973, win 313, length 172
18:44:21.494421 IP lamp-s-1vcpu-1gb-tor1-01.ssh > 198.96.84.204.15419: Flags [P.], seq 1636500:1636672, ack 973, win 313, length 172
18:44:21.494524 IP lamp-s-1vcpu-1gb-tor1-01.ssh > 198.96.84.204.15419: Flags [P.], seq 1636672:1636844, ack 973, win 313, length 172
18:44:21.494628 IP lamp-s-1vcpu-1gb-tor1-01.ssh > 198.96.84.204.15419: Flags [P.], seq 1636844:1637016, ack 973, win 313, length 172
18:44:21.494732 IP lamp-s-1vcpu-1gb-tor1-01.ssh > 198.96.84.204.15419: Flags [P.], seq 1637016:1637188, ack 973, win 313, length 172
18:44:21.494836 IP lamp-s-1vcpu-1gb-tor1-01.ssh > 198.96.84.204.15419: Flags [P.], seq 1637188:1637360, ack 973, win 313, length 172
18:44:21.494939 IP lamp-s-1vcpu-1gb-tor1-01.ssh > 198.96.84.204.15419: Flags [P.], seq 1637360:1637532, ack 973, win 313, length 172
18:44:21.495043 IP lamp-s-1vcpu-1gb-tor1-01.ssh > 198.96.84.204.15419: Flags [P.], seq 1637532:1637704, ack 973, win 313, length 172
18:44:21.495147 IP lamp-s-1vcpu-1gb-tor1-01.ssh > 198.96.84.204.15419: Flags [P.], seq 1637704:1637876, ack 973, win 313, length 172
18:44:21.495250 IP lamp-s-1vcpu-1gb-tor1-01.ssh > 198.96.84.204.15419: Flags [P.], seq 1637876:1638048, ack 973, win 313, length 172
18:44:21.495356 IP lamp-s-1vcpu-1gb-tor1-01.ssh > 198.96.84.204.15419: Flags [P.], seq 1638048:1638220, ack 973, win 313, length 172
18:44:21.495561 IP lamp-s-1vcpu-1gb-tor1-01.ssh > 198.96.84.204.15419: Flags [P.], seq 1638220:1638392, ack 973, win 313, length 172
18:44:21.495709 IP lamp-s-1vcpu-1gb-tor1-01.ssh > 198.96.84.204.15419: Flags [P.], seq 1638392:1638564, ack 973, win 313, length 172
18:44:21.495821 IP lamp-s-1vcpu-1gb-tor1-01.ssh > 198.96.84.204.15419: Flags [P.], seq 1638564:1638736, ack 973, win 313, length 172
18:44:21.495927 IP lamp-s-1vcpu-1gb-tor1-01.ssh > 198.96.84.204.15419: Flags [P.], seq 1638736:1638908, ack 973, win 313, length 172
18:44:21.496078 IP lamp-s-1vcpu-1gb-tor1-01.ssh > 198.96.84.204.15419: Flags [P.], seq 1638908:1639080, ack 973, win 313, length 172
18:44:21.496118 IP 198.96.84.204.15419 > lamp-s-1vcpu-1gb-tor1-01.ssh: Flags [.], ack 1627676, win 512, length 0
18:44:21.496136 IP 198.96.84.204.15419 > lamp-s-1vcpu-1gb-tor1-01.ssh: Flags [.], ack 1628020, win 511, length 0
18:44:21.496142 IP 198.96.84.204.15419 > lamp-s-1vcpu-1gb-tor1-01.ssh: Flags [.], ack 1628364, win 510, length 0
18:44:21.496148 IP 198.96.84.204.15419 > lamp-s-1vcpu-1gb-tor1-01.ssh: Flags [.], ack 1628708, win 508, length 0
18:44:21.496154 IP 198.96.84.204.15419 > lamp-s-1vcpu-1gb-tor1-01.ssh: Flags [.], ack 1629052, win 512, length 0
18:44:21.496160 IP 198.96.84.204.15419 > lamp-s-1vcpu-1gb-tor1-01.ssh: Flags [.], ack 1629396, win 511, length 0
18:44:21.496416 IP lamp-s-1vcpu-1gb-tor1-01.ssh > 198.96.84.204.15419: Flags [P.], seq 1639080:1639932, ack 973, win 313, length 852
18:44:21.496538 IP lamp-s-1vcpu-1gb-tor1-01.ssh > 198.96.84.204.15419: Flags [P.], seq 1639932:1640104, ack 973, win 313, length 172
18:44:21.496643 IP lamp-s-1vcpu-1gb-tor1-01.ssh > 198.96.84.204.15419: Flags [P.], seq 1640104:1640276, ack 973, win 313, length 172
18:44:21.496750 IP lamp-s-1vcpu-1gb-tor1-01.ssh > 198.96.84.204.15419: Flags [P.], seq 1640276:1640448, ack 973, win 313, length 172
18:44:21.496853 IP lamp-s-1vcpu-1gb-tor1-01.ssh > 198.96.84.204.15419: Flags [P.], seq 1640448:1640620, ack 973, win 313, length 172
18:44:21.496957 IP lamp-s-1vcpu-1gb-tor1-01.ssh > 198.96.84.204.15419: Flags [P.], seq 1640620:1640792, ack 973, win 313, length 172
18:44:21.497059 IP lamp-s-1vcpu-1gb-tor1-01.ssh > 198.96.84.204.15419: Flags [P.], seq 1640792:1640964, ack 973, win 313, length 172
18:44:21.497162 IP lamp-s-1vcpu-1gb-tor1-01.ssh > 198.96.84.204.15419: Flags [P.], seq 1640964:1641136, ack 973, win 313, length 172
18:44:21.497264 IP lamp-s-1vcpu-1gb-tor1-01.ssh > 198.96.84.204.15419: Flags [P.], seq 1641136:1641308, ack 973, win 313, length 172
18:44:21.497355 IP 198.96.84.204.15419 > lamp-s-1vcpu-1gb-tor1-01.ssh: Flags [.], ack 1632492, win 510, length 0
18:44:21.497453 IP lamp-s-1vcpu-1gb-tor1-01.ssh > 198.96.84.204.15419: Flags [P.], seq 1641308:1641592, ack 973, win 313, length 284
18:44:21.497565 IP lamp-s-1vcpu-1gb-tor1-01.ssh > 198.96.84.204.15419: Flags [P.], seq 1641592:1641764, ack 973, win 313, length 172
18:44:21.497670 IP lamp-s-1vcpu-1gb-tor1-01.ssh > 198.96.84.204.15419: Flags [P.], seq 1641764:1641936, ack 973, win 313, length 172
18:44:21.497785 IP lamp-s-1vcpu-1gb-tor1-01.ssh > 198.96.84.204.15419: Flags [P.], seq 1641936:1642108, ack 973, win 313, length 172
18:44:21.497929 IP lamp-s-1vcpu-1gb-tor1-01.ssh > 198.96.84.204.15419: Flags [P.], seq 1642108:1642280, ack 973, win 313, length 172
18:44:21.498040 IP lamp-s-1vcpu-1gb-tor1-01.ssh > 198.96.84.204.15419: Flags [P.], seq 1642280:1642452, ack 973, win 313, length 172
18:44:21.498145 IP lamp-s-1vcpu-1gb-tor1-01.ssh > 198.96.84.204.15419: Flags [P.], seq 1642452:1642624, ack 973, win 313, length 172
18:44:21.498250 IP lamp-s-1vcpu-1gb-tor1-01.ssh > 198.96.84.204.15419: Flags [P.], seq 1642624:1642796, ack 973, win 313, length 172
18:44:21.498355 IP lamp-s-1vcpu-1gb-tor1-01.ssh > 198.96.84.204.15419: Flags [P.], seq 1642796:1642968, ack 973, win 313, length 172
18:44:21.498459 IP lamp-s-1vcpu-1gb-tor1-01.ssh > 198.96.84.204.15419: Flags [P.], seq 1642968:1643140, ack 973, win 313, length 172
18:44:21.498564 IP lamp-s-1vcpu-1gb-tor1-01.ssh > 198.96.84.204.15419: Flags [P.], seq 1643140:1643312, ack 973, win 313, length 172
18:44:21.498646 IP 198.96.84.204.15419 > lamp-s-1vcpu-1gb-tor1-01.ssh: Flags [.], ack 1632836, win 508, length 0
18:44:21.498665 IP 198.96.84.204.15419 > lamp-s-1vcpu-1gb-tor1-01.ssh: Flags [.], ack 1633980, win 512, length 0
18:44:21.498671 IP 198.96.84.204.15419 > lamp-s-1vcpu-1gb-tor1-01.ssh: Flags [.], ack 1634324, win 511, length 0
18:44:21.498806 IP lamp-s-1vcpu-1gb-tor1-01.ssh > 198.96.84.204.15419: Flags [P.], seq 1643312:1643828, ack 973, win 313, length 516
18:44:21.498919 IP lamp-s-1vcpu-1gb-tor1-01.ssh > 198.96.84.204.15419: Flags [P.], seq 1643828:1644000, ack 973, win 313, length 172
18:44:21.499028 IP lamp-s-1vcpu-1gb-tor1-01.ssh > 198.96.84.204.15419: Flags [P.], seq 1644000:1644172, ack 973, win 313, length 172
18:44:21.499133 IP lamp-s-1vcpu-1gb-tor1-01.ssh > 198.96.84.204.15419: Flags [P.], seq 1644172:1644344, ack 973, win 313, length 172
18:44:21.499237 IP lamp-s-1vcpu-1gb-tor1-01.ssh > 198.96.84.204.15419: Flags [P.], seq 1644344:1644516, ack 973, win 313, length 172
18:44:21.499339 IP lamp-s-1vcpu-1gb-tor1-01.ssh > 198.96.84.204.15419: Flags [P.], seq 1644516:1644688, ack 973, win 313, length 172
18:44:21.499442 IP lamp-s-1vcpu-1gb-tor1-01.ssh > 198.96.84.204.15419: Flags [P.], seq 1644688:1644860, ack 973, win 313, length 172
18:44:21.499545 IP lamp-s-1vcpu-1gb-tor1-01.ssh > 198.96.84.204.15419: Flags [P.], seq 1644860:1645032, ack 973, win 313, length 172
18:44:21.499648 IP lamp-s-1vcpu-1gb-tor1-01.ssh > 198.96.84.204.15419: Flags [P.], seq 1645032:1645204, ack 973, win 313, length 172
18:44:21.499752 IP lamp-s-1vcpu-1gb-tor1-01.ssh > 198.96.84.204.15419: Flags [P.], seq 1645204:1645376, ack 973, win 313, length 172
18:44:21.499857 IP lamp-s-1vcpu-1gb-tor1-01.ssh > 198.96.84.204.15419: Flags [P.], seq 1645376:1645548, ack 973, win 313, length 172
18:44:21.499960 IP lamp-s-1vcpu-1gb-tor1-01.ssh > 198.96.84.204.15419: Flags [P.], seq 1645548:1645720, ack 973, win 313, length 172
18:44:21.500120 IP lamp-s-1vcpu-1gb-tor1-01.ssh > 198.96.84.204.15419: Flags [P.], seq 1645720:1645892, ack 973, win 313, length 172
18:44:21.500237 IP lamp-s-1vcpu-1gb-tor1-01.ssh > 198.96.84.204.15419: Flags [P.], seq 1645892:1646064, ack 973, win 313, length 172
18:44:21.500322 IP lamp-s-1vcpu-1gb-tor1-01.ssh > 198.96.84.204.15419: Flags [P.], seq 1646064:1646236, ack 973, win 313, length 172
18:44:21.500429 IP lamp-s-1vcpu-1gb-tor1-01.ssh > 198.96.84.204.15419: Flags [P.], seq 1646236:1646408, ack 973, win 313, length 172
18:44:21.500534 IP lamp-s-1vcpu-1gb-tor1-01.ssh > 198.96.84.204.15419: Flags [P.], seq 1646408:1646580, ack 973, win 313, length 172
18:44:21.500639 IP lamp-s-1vcpu-1gb-tor1-01.ssh > 198.96.84.204.15419: Flags [P.], seq 1646580:1646752, ack 973, win 313, length 172
18:44:21.500747 IP lamp-s-1vcpu-1gb-tor1-01.ssh > 198.96.84.204.15419: Flags [P.], seq 1646752:1646924, ack 973, win 313, length 172
18:44:21.500855 IP lamp-s-1vcpu-1gb-tor1-01.ssh > 198.96.84.204.15419: Flags [P.], seq 1646924:1647096, ack 973, win 313, length 172
18:44:21.500961 IP lamp-s-1vcpu-1gb-tor1-01.ssh > 198.96.84.204.15419: Flags [P.], seq 1647096:1647268, ack 973, win 313, length 172
18:44:21.501064 IP lamp-s-1vcpu-1gb-tor1-01.ssh > 198.96.84.204.15419: Flags [P.], seq 1647268:1647440, ack 973, win 313, length 172
18:44:21.501167 IP lamp-s-1vcpu-1gb-tor1-01.ssh > 198.96.84.204.15419: Flags [P.], seq 1647440:1647612, ack 973, win 313, length 172
18:44:21.501270 IP lamp-s-1vcpu-1gb-tor1-01.ssh > 198.96.84.204.15419: Flags [P.], seq 1647612:1647784, ack 973, win 313, length 172
18:44:21.501372 IP lamp-s-1vcpu-1gb-tor1-01.ssh > 198.96.84.204.15419: Flags [P.], seq 1647784:1647956, ack 973, win 313, length 172
18:44:21.501475 IP lamp-s-1vcpu-1gb-tor1-01.ssh > 198.96.84.204.15419: Flags [P.], seq 1647956:1648128, ack 973, win 313, length 172
18:44:21.502098 IP 198.96.84.204.15419 > lamp-s-1vcpu-1gb-tor1-01.ssh: Flags [.], ack 1634668, win 510, length 0
18:44:21.502132 IP lamp-s-1vcpu-1gb-tor1-01.ssh > 198.96.84.204.15419: Flags [P.], seq 1648128:1648300, ack 973, win 313, length 172
18:44:21.502149 IP 198.96.84.204.15419 > lamp-s-1vcpu-1gb-tor1-01.ssh: Flags [.], ack 1635012, win 508, length 0
18:44:21.502156 IP 198.96.84.204.15419 > lamp-s-1vcpu-1gb-tor1-01.ssh: Flags [.], ack 1635812, win 512, length 0
18:44:21.502163 IP 198.96.84.204.15419 > lamp-s-1vcpu-1gb-tor1-01.ssh: Flags [.], ack 1636156, win 511, length 0
18:44:21.502169 IP 198.96.84.204.15419 > lamp-s-1vcpu-1gb-tor1-01.ssh: Flags [.], ack 1636500, win 510, length 0
18:44:21.502174 IP 198.96.84.204.15419 > lamp-s-1vcpu-1gb-tor1-01.ssh: Flags [.], ack 1636844, win 508, length 0
18:44:21.502548 IP lamp-s-1vcpu-1gb-tor1-01.ssh > 198.96.84.204.15419: Flags [P.], seq 1648300:1649152, ack 973, win 313, length 852
18:44:21.502671 IP lamp-s-1vcpu-1gb-tor1-01.ssh > 198.96.84.204.15419: Flags [P.], seq 1649152:1649324, ack 973, win 313, length 172
18:44:21.502781 IP lamp-s-1vcpu-1gb-tor1-01.ssh > 198.96.84.204.15419: Flags [P.], seq 1649324:1649496, ack 973, win 313, length 172
18:44:21.502890 IP lamp-s-1vcpu-1gb-tor1-01.ssh > 198.96.84.204.15419: Flags [P.], seq 1649496:1649668, ack 973, win 313, length 172
18:44:21.502998 IP lamp-s-1vcpu-1gb-tor1-01.ssh > 198.96.84.204.15419: Flags [P.], seq 1649668:1649840, ack 973, win 313, length 172
18:44:21.503102 IP lamp-s-1vcpu-1gb-tor1-01.ssh > 198.96.84.204.15419: Flags [P.], seq 1649840:1650012, ack 973, win 313, length 172
18:44:21.503214 IP lamp-s-1vcpu-1gb-tor1-01.ssh > 198.96.84.204.15419: Flags [P.], seq 1650012:1650184, ack 973, win 313, length 172
18:44:21.503341 IP lamp-s-1vcpu-1gb-tor1-01.ssh > 198.96.84.204.15419: Flags [P.], seq 1650184:1650356, ack 973, win 313, length 172
18:44:21.503450 IP lamp-s-1vcpu-1gb-tor1-01.ssh > 198.96.84.204.15419: Flags [P.], seq 1650356:1650528, ack 973, win 313, length 172
18:44:21.503556 IP lamp-s-1vcpu-1gb-tor1-01.ssh > 198.96.84.204.15419: Flags [P.], seq 1650528:1650700, ack 973, win 313, length 172
18:44:21.503593 IP 198.96.84.204.15419 > lamp-s-1vcpu-1gb-tor1-01.ssh: Flags [.], ack 1640964, win 508, length 0
18:44:21.503610 IP 198.96.84.204.15419 > lamp-s-1vcpu-1gb-tor1-01.ssh: Flags [.], ack 1641308, win 512, length 0
18:44:21.503616 IP 198.96.84.204.15419 > lamp-s-1vcpu-1gb-tor1-01.ssh: Flags [.], ack 1641764, win 511, length 0
18:44:21.503622 IP 198.96.84.204.15419 > lamp-s-1vcpu-1gb-tor1-01.ssh: Flags [.], ack 1642108, win 509, length 0
18:44:21.503628 IP 198.96.84.204.15419 > lamp-s-1vcpu-1gb-tor1-01.ssh: Flags [.], ack 1642452, win 508, length 0
18:44:21.503634 IP 198.96.84.204.15419 > lamp-s-1vcpu-1gb-tor1-01.ssh: Flags [.], ack 1642796, win 512, length 0
18:44:21.503890 IP lamp-s-1vcpu-1gb-tor1-01.ssh > 198.96.84.204.15419: Flags [P.], seq 1650700:1651552, ack 973, win 313, length 852
18:44:21.504068 IP lamp-s-1vcpu-1gb-tor1-01.ssh > 198.96.84.204.15419: Flags [P.], seq 1651552:1651724, ack 973, win 313, length 172
18:44:21.504215 IP lamp-s-1vcpu-1gb-tor1-01.ssh > 198.96.84.204.15419: Flags [P.], seq 1651724:1651896, ack 973, win 313, length 172
18:44:21.504377 IP lamp-s-1vcpu-1gb-tor1-01.ssh > 198.96.84.204.15419: Flags [P.], seq 1651896:1652068, ack 973, win 313, length 172
18:44:21.504506 IP lamp-s-1vcpu-1gb-tor1-01.ssh > 198.96.84.204.15419: Flags [P.], seq 1652068:1652240, ack 973, win 313, length 172
18:44:21.504621 IP lamp-s-1vcpu-1gb-tor1-01.ssh > 198.96.84.204.15419: Flags [P.], seq 1652240:1652412, ack 973, win 313, length 172
18:44:21.504732 IP lamp-s-1vcpu-1gb-tor1-01.ssh > 198.96.84.204.15419: Flags [P.], seq 1652412:1652584, ack 973, win 313, length 172
18:44:21.504843 IP lamp-s-1vcpu-1gb-tor1-01.ssh > 198.96.84.204.15419: Flags [P.], seq 1652584:1652756, ack 973, win 313, length 172
18:44:21.504949 IP lamp-s-1vcpu-1gb-tor1-01.ssh > 198.96.84.204.15419: Flags [P.], seq 1652756:1652928, ack 973, win 313, length 172
18:44:21.505014 IP 198.96.84.204.15419 > lamp-s-1vcpu-1gb-tor1-01.ssh: Flags [.], ack 1645892, win 511, length 0
18:44:21.505033 IP 198.96.84.204.15419 > lamp-s-1vcpu-1gb-tor1-01.ssh: Flags [.], ack 1646236, win 510, length 0
18:44:21.505041 IP 198.96.84.204.15419 > lamp-s-1vcpu-1gb-tor1-01.ssh: Flags [.], ack 1646580, win 508, length 0
18:44:21.505049 IP 198.96.84.204.15419 > lamp-s-1vcpu-1gb-tor1-01.ssh: Flags [.], ack 1646924, win 512, length 0
18:44:21.505055 IP 198.96.84.204.15419 > lamp-s-1vcpu-1gb-tor1-01.ssh: Flags [.], ack 1647268, win 511, length 0
18:44:21.505060 IP 198.96.84.204.15419 > lamp-s-1vcpu-1gb-tor1-01.ssh: Flags [.], ack 1647612, win 510, length 0
18:44:21.505267 IP lamp-s-1vcpu-1gb-tor1-01.ssh > 198.96.84.204.15419: Flags [P.], seq 1652928:1653780, ack 973, win 313, length 852
18:44:21.505407 IP lamp-s-1vcpu-1gb-tor1-01.ssh > 198.96.84.204.15419: Flags [P.], seq 1653780:1653952, ack 973, win 313, length 172
18:44:21.505549 IP lamp-s-1vcpu-1gb-tor1-01.ssh > 198.96.84.204.15419: Flags [P.], seq 1653952:1654124, ack 973, win 313, length 172
18:44:21.505663 IP lamp-s-1vcpu-1gb-tor1-01.ssh > 198.96.84.204.15419: Flags [P.], seq 1654124:1654296, ack 973, win 313, length 172
18:44:21.505805 IP lamp-s-1vcpu-1gb-tor1-01.ssh > 198.96.84.204.15419: Flags [P.], seq 1654296:1654468, ack 973, win 313, length 172
18:44:21.505917 IP lamp-s-1vcpu-1gb-tor1-01.ssh > 198.96.84.204.15419: Flags [P.], seq 1654468:1654640, ack 973, win 313, length 172
18:44:21.506024 IP lamp-s-1vcpu-1gb-tor1-01.ssh > 198.96.84.204.15419: Flags [P.], seq 1654640:1654812, ack 973, win 313, length 172
18:44:21.506130 IP lamp-s-1vcpu-1gb-tor1-01.ssh > 198.96.84.204.15419: Flags [P.], seq 1654812:1654984, ack 973, win 313, length 172
18:44:21.506234 IP lamp-s-1vcpu-1gb-tor1-01.ssh > 198.96.84.204.15419: Flags [P.], seq 1654984:1655156, ack 973, win 313, length 172
18:44:21.506338 IP lamp-s-1vcpu-1gb-tor1-01.ssh > 198.96.84.204.15419: Flags [P.], seq 1655156:1655328, ack 973, win 313, length 172
18:44:21.506442 IP lamp-s-1vcpu-1gb-tor1-01.ssh > 198.96.84.204.15419: Flags [P.], seq 1655328:1655500, ack 973, win 313, length 172
18:44:21.506546 IP lamp-s-1vcpu-1gb-tor1-01.ssh > 198.96.84.204.15419: Flags [P.], seq 1655500:1655672, ack 973, win 313, length 172
18:44:21.506665 IP lamp-s-1vcpu-1gb-tor1-01.ssh > 198.96.84.204.15419: Flags [P.], seq 1655672:1655844, ack 973, win 313, length 172
18:44:21.506776 IP lamp-s-1vcpu-1gb-tor1-01.ssh > 198.96.84.204.15419: Flags [P.], seq 1655844:1656016, ack 973, win 313, length 172
18:44:21.506896 IP lamp-s-1vcpu-1gb-tor1-01.ssh > 198.96.84.204.15419: Flags [P.], seq 1656016:1656188, ack 973, win 313, length 172
18:44:21.507010 IP lamp-s-1vcpu-1gb-tor1-01.ssh > 198.96.84.204.15419: Flags [P.], seq 1656188:1656360, ack 973, win 313, length 172
18:44:21.507116 IP lamp-s-1vcpu-1gb-tor1-01.ssh > 198.96.84.204.15419: Flags [P.], seq 1656360:1656532, ack 973, win 313, length 172
18:44:21.507144 IP 198.96.84.204.15419 > lamp-s-1vcpu-1gb-tor1-01.ssh: Flags [.], ack 1649324, win 508, length 0
18:44:21.507153 IP 198.96.84.204.15419 > lamp-s-1vcpu-1gb-tor1-01.ssh: Flags [.], ack 1649668, win 512, length 0
18:44:21.507158 IP 198.96.84.204.15419 > lamp-s-1vcpu-1gb-tor1-01.ssh: Flags [.], ack 1650012, win 511, length 0
18:44:21.507161 IP 198.96.84.204.15419 > lamp-s-1vcpu-1gb-tor1-01.ssh: Flags [.], ack 1650356, win 510, length 0
18:44:21.507166 IP 198.96.84.204.15419 > lamp-s-1vcpu-1gb-tor1-01.ssh: Flags [.], ack 1650700, win 508, length 0
18:44:21.507374 IP lamp-s-1vcpu-1gb-tor1-01.ssh > 198.96.84.204.15419: Flags [P.], seq 1656532:1657272, ack 973, win 313, length 740
18:44:21.507489 IP lamp-s-1vcpu-1gb-tor1-01.ssh > 198.96.84.204.15419: Flags [P.], seq 1657272:1657444, ack 973, win 313, length 172
18:44:21.507595 IP lamp-s-1vcpu-1gb-tor1-01.ssh > 198.96.84.204.15419: Flags [P.], seq 1657444:1657616, ack 973, win 313, length 172
18:44:21.507700 IP lamp-s-1vcpu-1gb-tor1-01.ssh > 198.96.84.204.15419: Flags [P.], seq 1657616:1657788, ack 973, win 313, length 172
18:44:21.507834 IP lamp-s-1vcpu-1gb-tor1-01.ssh > 198.96.84.204.15419: Flags [P.], seq 1657788:1657960, ack 973, win 313, length 172
18:44:21.507946 IP lamp-s-1vcpu-1gb-tor1-01.ssh > 198.96.84.204.15419: Flags [P.], seq 1657960:1658132, ack 973, win 313, length 172
18:44:21.508139 IP lamp-s-1vcpu-1gb-tor1-01.ssh > 198.96.84.204.15419: Flags [P.], seq 1658132:1658304, ack 973, win 313, length 172
18:44:21.508303 IP lamp-s-1vcpu-1gb-tor1-01.ssh > 198.96.84.204.15419: Flags [P.], seq 1658304:1658476, ack 973, win 313, length 172
18:44:21.508419 IP lamp-s-1vcpu-1gb-tor1-01.ssh > 198.96.84.204.15419: Flags [P.], seq 1658476:1658648, ack 973, win 313, length 172
18:44:21.508553 IP lamp-s-1vcpu-1gb-tor1-01.ssh > 198.96.84.204.15419: Flags [P.], seq 1658648:1658820, ack 973, win 313, length 172
18:44:21.508664 IP lamp-s-1vcpu-1gb-tor1-01.ssh > 198.96.84.204.15419: Flags [P.], seq 1658820:1658992, ack 973, win 313, length 172
18:44:21.508777 IP lamp-s-1vcpu-1gb-tor1-01.ssh > 198.96.84.204.15419: Flags [P.], seq 1658992:1659164, ack 973, win 313, length 172
18:44:21.508885 IP lamp-s-1vcpu-1gb-tor1-01.ssh > 198.96.84.204.15419: Flags [P.], seq 1659164:1659336, ack 973, win 313, length 172
18:44:21.508989 IP lamp-s-1vcpu-1gb-tor1-01.ssh > 198.96.84.204.15419: Flags [P.], seq 1659336:1659508, ack 973, win 313, length 172
18:44:21.509095 IP lamp-s-1vcpu-1gb-tor1-01.ssh > 198.96.84.204.15419: Flags [P.], seq 1659508:1659680, ack 973, win 313, length 172
18:44:21.509201 IP lamp-s-1vcpu-1gb-tor1-01.ssh > 198.96.84.204.15419: Flags [P.], seq 1659680:1659852, ack 973, win 313, length 172
18:44:21.509306 IP lamp-s-1vcpu-1gb-tor1-01.ssh > 198.96.84.204.15419: Flags [P.], seq 1659852:1660024, ack 973, win 313, length 172
18:44:21.509411 IP lamp-s-1vcpu-1gb-tor1-01.ssh > 198.96.84.204.15419: Flags [P.], seq 1660024:1660196, ack 973, win 313, length 172
18:44:21.509516 IP lamp-s-1vcpu-1gb-tor1-01.ssh > 198.96.84.204.15419: Flags [P.], seq 1660196:1660368, ack 973, win 313, length 172
18:44:21.509620 IP lamp-s-1vcpu-1gb-tor1-01.ssh > 198.96.84.204.15419: Flags [P.], seq 1660368:1660540, ack 973, win 313, length 172
18:44:21.509726 IP lamp-s-1vcpu-1gb-tor1-01.ssh > 198.96.84.204.15419: Flags [P.], seq 1660540:1660712, ack 973, win 313, length 172
18:44:21.509832 IP lamp-s-1vcpu-1gb-tor1-01.ssh > 198.96.84.204.15419: Flags [P.], seq 1660712:1660884, ack 973, win 313, length 172
18:44:21.509937 IP lamp-s-1vcpu-1gb-tor1-01.ssh > 198.96.84.204.15419: Flags [P.], seq 1660884:1661056, ack 973, win 313, length 172
18:44:21.510041 IP lamp-s-1vcpu-1gb-tor1-01.ssh > 198.96.84.204.15419: Flags [P.], seq 1661056:1661228, ack 973, win 313, length 172
18:44:21.510147 IP lamp-s-1vcpu-1gb-tor1-01.ssh > 198.96.84.204.15419: Flags [P.], seq 1661228:1661400, ack 973, win 313, length 172
18:44:21.510253 IP lamp-s-1vcpu-1gb-tor1-01.ssh > 198.96.84.204.15419: Flags [P.], seq 1661400:1661572, ack 973, win 313, length 172
18:44:21.510360 IP lamp-s-1vcpu-1gb-tor1-01.ssh > 198.96.84.204.15419: Flags [P.], seq 1661572:1661744, ack 973, win 313, length 172
18:44:21.510466 IP lamp-s-1vcpu-1gb-tor1-01.ssh > 198.96.84.204.15419: Flags [P.], seq 1661744:1661916, ack 973, win 313, length 172
18:44:21.510640 IP lamp-s-1vcpu-1gb-tor1-01.ssh > 198.96.84.204.15419: Flags [P.], seq 1661916:1662088, ack 973, win 313, length 172
18:44:21.510798 IP lamp-s-1vcpu-1gb-tor1-01.ssh > 198.96.84.204.15419: Flags [P.], seq 1662088:1662260, ack 973, win 313, length 172
18:44:21.510953 IP lamp-s-1vcpu-1gb-tor1-01.ssh > 198.96.84.204.15419: Flags [P.], seq 1662260:1662432, ack 973, win 313, length 172
18:44:21.511088 IP lamp-s-1vcpu-1gb-tor1-01.ssh > 198.96.84.204.15419: Flags [P.], seq 1662432:1662604, ack 973, win 313, length 172
18:44:21.511198 IP lamp-s-1vcpu-1gb-tor1-01.ssh > 198.96.84.204.15419: Flags [P.], seq 1662604:1662776, ack 973, win 313, length 172
18:44:21.511305 IP lamp-s-1vcpu-1gb-tor1-01.ssh > 198.96.84.204.15419: Flags [P.], seq 1662776:1662948, ack 973, win 313, length 172
18:44:21.511411 IP lamp-s-1vcpu-1gb-tor1-01.ssh > 198.96.84.204.15419: Flags [P.], seq 1662948:1663120, ack 973, win 313, length 172
18:44:21.511488 IP 198.96.84.204.15419 > lamp-s-1vcpu-1gb-tor1-01.ssh: Flags [.], ack 1651724, win 512, length 0
18:44:21.511507 IP 198.96.84.204.15419 > lamp-s-1vcpu-1gb-tor1-01.ssh: Flags [.], ack 1652068, win 511, length 0
18:44:21.511513 IP 198.96.84.204.15419 > lamp-s-1vcpu-1gb-tor1-01.ssh: Flags [.], ack 1652412, win 510, length 0
18:44:21.511519 IP 198.96.84.204.15419 > lamp-s-1vcpu-1gb-tor1-01.ssh: Flags [.], ack 1652756, win 508, length 0
18:44:21.511525 IP 198.96.84.204.15419 > lamp-s-1vcpu-1gb-tor1-01.ssh: Flags [.], ack 1653780, win 512, length 0
18:44:21.511531 IP 198.96.84.204.15419 > lamp-s-1vcpu-1gb-tor1-01.ssh: Flags [.], ack 1654124, win 511, length 0
18:44:21.511537 IP 198.96.84.204.15419 > lamp-s-1vcpu-1gb-tor1-01.ssh: Flags [.], ack 1654468, win 510, length 0
18:44:21.511769 IP lamp-s-1vcpu-1gb-tor1-01.ssh > 198.96.84.204.15419: Flags [P.], seq 1663120:1664092, ack 973, win 313, length 972
18:44:21.511891 IP lamp-s-1vcpu-1gb-tor1-01.ssh > 198.96.84.204.15419: Flags [P.], seq 1664092:1664264, ack 973, win 313, length 172
18:44:21.512045 IP lamp-s-1vcpu-1gb-tor1-01.ssh > 198.96.84.204.15419: Flags [P.], seq 1664264:1664436, ack 973, win 313, length 172
18:44:21.512185 IP lamp-s-1vcpu-1gb-tor1-01.ssh > 198.96.84.204.15419: Flags [P.], seq 1664436:1664608, ack 973, win 313, length 172
18:44:21.512334 IP lamp-s-1vcpu-1gb-tor1-01.ssh > 198.96.84.204.15419: Flags [P.], seq 1664608:1664780, ack 973, win 313, length 172
18:44:21.512448 IP lamp-s-1vcpu-1gb-tor1-01.ssh > 198.96.84.204.15419: Flags [P.], seq 1664780:1664952, ack 973, win 313, length 172
18:44:21.512553 IP lamp-s-1vcpu-1gb-tor1-01.ssh > 198.96.84.204.15419: Flags [P.], seq 1664952:1665124, ack 973, win 313, length 172
18:44:21.512658 IP lamp-s-1vcpu-1gb-tor1-01.ssh > 198.96.84.204.15419: Flags [P.], seq 1665124:1665296, ack 973, win 313, length 172
18:44:21.512763 IP lamp-s-1vcpu-1gb-tor1-01.ssh > 198.96.84.204.15419: Flags [P.], seq 1665296:1665468, ack 973, win 313, length 172
18:44:21.512834 IP 198.96.84.204.15419 > lamp-s-1vcpu-1gb-tor1-01.ssh: Flags [.], ack 1656532, win 512, length 0
18:44:21.512852 IP 198.96.84.204.15419 > lamp-s-1vcpu-1gb-tor1-01.ssh: Flags [.], ack 1657444, win 509, length 0
18:44:21.512858 IP 198.96.84.204.15419 > lamp-s-1vcpu-1gb-tor1-01.ssh: Flags [.], ack 1657788, win 507, length 0
18:44:21.512866 IP 198.96.84.204.15419 > lamp-s-1vcpu-1gb-tor1-01.ssh: Flags [.], ack 1658132, win 512, length 0
18:44:21.513016 IP lamp-s-1vcpu-1gb-tor1-01.ssh > 198.96.84.204.15419: Flags [P.], seq 1665468:1666096, ack 973, win 313, length 628
18:44:21.513131 IP lamp-s-1vcpu-1gb-tor1-01.ssh > 198.96.84.204.15419: Flags [P.], seq 1666096:1666268, ack 973, win 313, length 172
18:44:21.513236 IP lamp-s-1vcpu-1gb-tor1-01.ssh > 198.96.84.204.15419: Flags [P.], seq 1666268:1666440, ack 973, win 313, length 172
18:44:21.513340 IP lamp-s-1vcpu-1gb-tor1-01.ssh > 198.96.84.204.15419: Flags [P.], seq 1666440:1666612, ack 973, win 313, length 172
18:44:21.513443 IP lamp-s-1vcpu-1gb-tor1-01.ssh > 198.96.84.204.15419: Flags [P.], seq 1666612:1666784, ack 973, win 313, length 172
18:44:21.513548 IP lamp-s-1vcpu-1gb-tor1-01.ssh > 198.96.84.204.15419: Flags [P.], seq 1666784:1666956, ack 973, win 313, length 172
18:44:21.513652 IP lamp-s-1vcpu-1gb-tor1-01.ssh > 198.96.84.204.15419: Flags [P.], seq 1666956:1667128, ack 973, win 313, length 172
18:44:21.513755 IP lamp-s-1vcpu-1gb-tor1-01.ssh > 198.96.84.204.15419: Flags [P.], seq 1667128:1667300, ack 973, win 313, length 172
18:44:21.513859 IP lamp-s-1vcpu-1gb-tor1-01.ssh > 198.96.84.204.15419: Flags [P.], seq 1667300:1667472, ack 973, win 313, length 172
18:44:21.513963 IP lamp-s-1vcpu-1gb-tor1-01.ssh > 198.96.84.204.15419: Flags [P.], seq 1667472:1667644, ack 973, win 313, length 172
18:44:21.514066 IP lamp-s-1vcpu-1gb-tor1-01.ssh > 198.96.84.204.15419: Flags [P.], seq 1667644:1667816, ack 973, win 313, length 172
18:44:21.514169 IP lamp-s-1vcpu-1gb-tor1-01.ssh > 198.96.84.204.15419: Flags [P.], seq 1667816:1667988, ack 973, win 313, length 172
18:44:21.514272 IP lamp-s-1vcpu-1gb-tor1-01.ssh > 198.96.84.204.15419: Flags [P.], seq 1667988:1668160, ack 973, win 313, length 172
18:44:21.514377 IP lamp-s-1vcpu-1gb-tor1-01.ssh > 198.96.84.204.15419: Flags [P.], seq 1668160:1668332, ack 973, win 313, length 172
18:44:21.514480 IP lamp-s-1vcpu-1gb-tor1-01.ssh > 198.96.84.204.15419: Flags [P.], seq 1668332:1668504, ack 973, win 313, length 172
18:44:21.514584 IP lamp-s-1vcpu-1gb-tor1-01.ssh > 198.96.84.204.15419: Flags [P.], seq 1668504:1668676, ack 973, win 313, length 172
18:44:21.514689 IP lamp-s-1vcpu-1gb-tor1-01.ssh > 198.96.84.204.15419: Flags [P.], seq 1668676:1668848, ack 973, win 313, length 172
18:44:21.514828 IP lamp-s-1vcpu-1gb-tor1-01.ssh > 198.96.84.204.15419: Flags [P.], seq 1668848:1669020, ack 973, win 313, length 172
18:44:21.514960 IP lamp-s-1vcpu-1gb-tor1-01.ssh > 198.96.84.204.15419: Flags [P.], seq 1669020:1669192, ack 973, win 313, length 172
18:44:21.515097 IP 198.96.84.204.15419 > lamp-s-1vcpu-1gb-tor1-01.ssh: Flags [.], ack 1658476, win 511, length 0
18:44:21.515117 IP 198.96.84.204.15419 > lamp-s-1vcpu-1gb-tor1-01.ssh: Flags [.], ack 1658820, win 510, length 0
18:44:21.515124 IP 198.96.84.204.15419 > lamp-s-1vcpu-1gb-tor1-01.ssh: Flags [.], ack 1659164, win 508, length 0
18:44:21.515154 IP lamp-s-1vcpu-1gb-tor1-01.ssh > 198.96.84.204.15419: Flags [P.], seq 1669192:1669364, ack 973, win 313, length 172
18:44:21.515189 IP 198.96.84.204.15419 > lamp-s-1vcpu-1gb-tor1-01.ssh: Flags [.], ack 1659508, win 512, length 0
18:44:21.515199 IP 198.96.84.204.15419 > lamp-s-1vcpu-1gb-tor1-01.ssh: Flags [.], ack 1659852, win 511, length 0
18:44:21.515204 IP 198.96.84.204.15419 > lamp-s-1vcpu-1gb-tor1-01.ssh: Flags [.], ack 1660196, win 510, length 0
18:44:21.515481 IP lamp-s-1vcpu-1gb-tor1-01.ssh > 198.96.84.204.15419: Flags [P.], seq 1669364:1670216, ack 973, win 313, length 852
18:44:21.515603 IP lamp-s-1vcpu-1gb-tor1-01.ssh > 198.96.84.204.15419: Flags [P.], seq 1670216:1670388, ack 973, win 313, length 172
18:44:21.515710 IP lamp-s-1vcpu-1gb-tor1-01.ssh > 198.96.84.204.15419: Flags [P.], seq 1670388:1670560, ack 973, win 313, length 172
18:44:21.515836 IP lamp-s-1vcpu-1gb-tor1-01.ssh > 198.96.84.204.15419: Flags [P.], seq 1670560:1670732, ack 973, win 313, length 172
18:44:21.515953 IP lamp-s-1vcpu-1gb-tor1-01.ssh > 198.96.84.204.15419: Flags [P.], seq 1670732:1670904, ack 973, win 313, length 172
18:44:21.516112 IP lamp-s-1vcpu-1gb-tor1-01.ssh > 198.96.84.204.15419: Flags [P.], seq 1670904:1671076, ack 973, win 313, length 172
18:44:21.516264 IP lamp-s-1vcpu-1gb-tor1-01.ssh > 198.96.84.204.15419: Flags [P.], seq 1671076:1671248, ack 973, win 313, length 172
18:44:21.516386 IP lamp-s-1vcpu-1gb-tor1-01.ssh > 198.96.84.204.15419: Flags [P.], seq 1671248:1671420, ack 973, win 313, length 172
18:44:21.516498 IP lamp-s-1vcpu-1gb-tor1-01.ssh > 198.96.84.204.15419: Flags [P.], seq 1671420:1671592, ack 973, win 313, length 172
18:44:21.516611 IP lamp-s-1vcpu-1gb-tor1-01.ssh > 198.96.84.204.15419: Flags [P.], seq 1671592:1671764, ack 973, win 313, length 172
18:44:21.516719 IP lamp-s-1vcpu-1gb-tor1-01.ssh > 198.96.84.204.15419: Flags [P.], seq 1671764:1671936, ack 973, win 313, length 172
18:44:21.516830 IP lamp-s-1vcpu-1gb-tor1-01.ssh > 198.96.84.204.15419: Flags [P.], seq 1671936:1672108, ack 973, win 313, length 172
18:44:21.516939 IP lamp-s-1vcpu-1gb-tor1-01.ssh > 198.96.84.204.15419: Flags [P.], seq 1672108:1672280, ack 973, win 313, length 172
18:44:21.517017 IP 198.96.84.204.15419 > lamp-s-1vcpu-1gb-tor1-01.ssh: Flags [.], ack 1664436, win 511, length 0
18:44:21.517036 IP 198.96.84.204.15419 > lamp-s-1vcpu-1gb-tor1-01.ssh: Flags [.], ack 1664092, win 512, length 0
